Bug Id,Summary,Description,Workaround,Products,Type,Fixed In,Modified Date
2499459," Incorrect Code Generation: Incorrect results are possible for a model containing Data Store Memory, Selector, and Assignment blocks","The generated code might be incorrect for a model that meets the following conditions: The model contains a Data Store Memory block, a Selector block, and an Assignment block. A Data Store Read block is connected to the index port of the Selector block. The same Data Store Read block is connected to the index port of the Assignment block. The output of the Selector block is connected to the data port (U ) of the Assignment block.  ",,Embedded Coder,Incorrect Code Generation,"R2019a Update 9, R2020a, R2020b, R2021a, R2021b",22 Sep 2021
2380126, ImportOptions setvaropts function errors with string array inputs,"opts = detectImportOptions(filename);  opts = setvaropts(opts,[""Var1"",""Var2""],""TreatAsMissing"",""NA"");  Will error with ""Operands to the || and &amp;&amp; operators must be convertible to logical scalar values.""  ","Use numeric inputs, or cell arrays of character vectors for setting multiple variables.opts = detectImportOptions(filename);opts = setvaropts(opts,cellstr([""Var1"",""Var2""]),""TreatAsMissing"",""NA"");?or?opts = setvaropts(opts,[1 2],""TreatAsMissing"",""NA"");?",MATLAB,Other,R2019a,30 Nov 2020
2338501, Creating an anonymous function might result in a memory leak,"When the handle to an anonymous function is no longer in use, MATLAB might not free up all the memory allocated to the function handle.",,MATLAB,Other,"R2018b Update 8, R2019a",11 Feb 2021
2314141, Incorrect documentation for configuration parameter?Use algorithms optimized for row-major array layout?(UseRowMajorAlgorithm),"The documentation for configuration parameter?Use algorithms optimized for row-major array layout ?(UseRowMajorAlgorithm ) contains this incorrect statement: ""You can enable the Use algorithms optimized for row-major array layout  configuration parameter to enable efficient algorithms, which might result in numeric differences between simulation and generated code."" ",Refer the updated documentation link -?https://www.mathworks.com/help/simulink/gui/use-algorithms-optimized-for-row-major-array-layout.html,Simulink Coder,Other,"R2019a Update 9, R2019b Update 6, R2020a",18 Sep 2020
2312936, Stateflow charts that perform floating point operations might assert during HDL code generation in Native Floating Point mode,HDL code generation for a Stateflow chart might generate an assertion when the following conditions are met: MATLAB  is set as the Action Language  in the Chart Properties dialog box The chart contains floating point operations The Floating Point IP Library  in the HDL Code Generation > Floating Point  pane of the Configuration Parameters dialog box is set to Native Floating Point??   The assertion looks like the following:In cast: Assertion failed: isa(aValue)   [? 0] ../matlab/bin/glnxa64/builtins/sl_main/../../../../bin/glnxa64/libmwcg_ir.so+13427972 _ZN2CG11DoubleValue4castEPKNS_5ValueE+00000086 [? 1] ../matlab/bin/glnxa64/simulink_plugins/sl_pir_cpp/../../../../bin/glnxa64/libmwcgir_hdl.so+25912710  [? 2] ../matlab/bin/glnxa64/simulink_plugins/sl_pir_cpp/../../../../bin/glnxa64/libmwcgir_hdl.so+25919655  [? 3] ../matlab/bin/glnxa64/simulink_plugins/sl_pir_cpp/../../../../bin/glnxa64/libmwcgir_hdl.so+25921796  [? 4] ../matlab/bin/glnxa64/simulink_plugins/sl_pir_cpp/../../../../bin/glnxa64/libmwcgir_hdl.so+20326342  [? 5] ../matlab/bin/glnxa64/simulink_plugins/sl_pir_cpp/../../../../bin/glnxa64/libmwcgir_hdl.so+20590166?  ,,HDL Coder,Other,"R2019a Update 9, R2019b Update 7, R2020b Update 1, R2021a",10 Mar 2021
2305513, The Capacity vector and Head vector?parameters?in the Centrifugal Pump (TL) block cannot be set to Run-time,"In the Centrifugal Pump (TL) block, the?Capacity vector ?and?Head vector? parameters?do not currently support run-time capabilities. However, the block dialog incorrectly provides the option to choose between the?Compile-time ?or?Run-time ?settings. Selecting?Run-time ?and simulating the model results in a compilation error: Function 'fluids_functions. polynomial_fit' must be an unprotected MATLAB function. ?In fluids. thermal_liquid. pumps_motors. centrifugal_pump ",,Simscape Fluids,Other,"R2018b Update 8, R2019a Update 9, R2019b Update 7, R2020a Update 6, R2020b Update 1, R2021a",10 Mar 2021
2305118, Compilation error when Dynamic compressibility is set to Off?for heat exchanger sample variants in the?thermal liquid domain,"This issue occurs if Dynamic compressibility ?is set to Off  in: Heat Exchanger (TL), Simple Variant Heat Exchanger (TL-TL), Simple Variant Heat Exchanger (TL-G), Simple Variant? Simple Heat Exchanger Interface (TL)  In such situations, simulating the model generates this error message: Number of equations exceeds number of variables .? ",Set Dynamic compressibility?to On.,Simscape Fluids,Other,"R2019a Update 9, R2019b Update 7, R2020a Update 6, R2020b Update 1, R2021a",10 Mar 2021
2302723," Assertion thrown during HDL code generation from a Simulink model containing Gain blocks that are operating in ""u*K"" mode","When performing HDL code generation from a Simulink model containing a Gain block, we throw the following assertion if the gain mode is ""u*K"", the input vector is unordered and the gain factor is a square matrix: Error: Evaluation of elaborate function on class hdldefaults. Gain failed with the error message: pir_core:pirudd:assertionFailed: Assertion failed: dom_pir_udd/ paramset. cpp:65:orientation. size() == 1 ? ",,HDL Coder,Other,"R2019a Update 9, R2019b Update 7, R2021a",10 Mar 2021
2299729, Error when creating link with IBM DOORS Next (DNG),"When you create a link from an item in MATLAB or Simulink to an item in IBM DOORS Next (formerly known as IBM DOORS Next Generation, and often abbreviated as DNG), a dialog box might appear with an error that says ""Failed to parse ProjectID "". This error might occur if the IBM DOORS Next service is hosted on Jazz server 6.0.6.1 or later version. As a result of this error, you cannot create links between items in MATLAB or Simulink and items in IBM DOORS Next. ",,Requirements Toolbox,Other,"R2019a Update 9, R2019b Update 6, R2020a Update 5, R2020b",18 Sep 2020
2296077," If you set the Vehicle Body 3DOF Dual Track block Axle force?parameter to?External forces, the block incorrectly implements the lateral force signal input to the front right tire","If you set the Vehicle Body 3DOF Dual Track block?Axle force? parameter to?External forces , the block incorrectly implements the signal array connected to the input port?FwF . Specifically, the block does not correctly use the array element for lateral force on the right front tire. The issue does not affect the Vehicle Body 3DOF Single Track block.?  ",,Vehicle Dynamics Blockset,Other,"R2018b Update 8, R2019a Update 9, R2019b Update 7, R2020a Update 5, R2020b, R2021a",10 Mar 2021
2289718, Simulink Design Verifier might fail to complete normally when performing Out of bound array access detection on models containing matrix-typed data with an InitialValue,"Simulink Design Verifier might fail to complete normally when all of the following conditions are true: Design Error Detection is performed with?Out of bound array access   enabled A data object of matrix type has a non-empty InitialValue   specification (such as through the Model Workspace).  In some cases, analysis might fail with an ""Error detection produced errors"" message. In all cases, the return status of sldvrun will be 0 when this issue is applicable. ",,Simulink Design Verifier,Other,"R2019a Update 9, R2019b Update 7, R2020a Update 6, R2020b",23 Dec 2020
2286940, Project does not automatically rename usages of data dictionaries inside internal test harnesses,"Project automatic renaming does not update data dictionary names  inside internal test harnesses saved in a model. When renaming a data dictionary, in the Rename  dialog box, Project offers to automatically update all links to the data dictionary. However, the automatic renaming does not complete the expected actions :?  When the user expands the impacted model and double-clicks the Data Dictionary  line in the Rename  dialog box, Project highlights the data dictionary of the containing model instead. When the user confirms renaming the data dictionary in the Rename  dialog box, Project does not update the link in the internal test harness.  ",Manually update the data dictionary name in the internal test harness.,Simulink Test,Other,"R2019a Update 9, R2019b Update 7, R2020a Update 5, R2020b, R2021a",10 Mar 2021
2284196, Incorrect Code Generation: Code generated for the cast?function might return a real matrix instead of a complex matrix with zero imaginary part,"If you use the 'like' ?argument of the?cast ?function in the generated code , the result might have incorrect complexity if all ?these conditions are true: The first input A  (the input array that is to be cast) is sparse, real, and numeric (not logical) The last input p  (the prototype) is complex  ",,MATLAB Coder,Incorrect Code Generation,"R2019a Update 9, R2019b Update 7, R2020a Update 5, R2020b, R2021a",10 Mar 2021
2284137, Autorename fails for a Simulink bus object containing multiple bus elements.,The autorename fails for a Simulink bus object that meets the following conditions: The bus object contains two or more bus elements. One of the bus elements is based on the type that is being renamed.  MATLAB stack trace: Operands to the || and &amp;&amp; operators must be convertible to logical scalar values.  Error in Simulink.ModelManagement.Project.Buses.Refactoring.BusObjectHandler  Error in Simulink.ModelManagement.Project.Buses.Refactoring.BusObjectHandler  Error in Simulink.ModelManagement.Project.Buses.Refactoring.BusObjectHandler  Error in Simulink.ModelManagement.Project.Buses.Refactoring.BusObjectHandler  Error in Simulink.ModelManagement.Project.Buses.Refactoring.BusObjectHandler  Error in Simulink.ModelManagement.Project.Buses.Refactoring.BaseWorkspaceFileHandler/modifyObject  Error in Simulink.ModelManagement.Project.Buses.Refactoring.BusObjectHandler/refactor  Error in Simulink.ModelManagement.Project.Buses.Refactoring.VariableRefactoringHandler/refactor  Error in dependencies.internal.action.refactor  Error in dependencies.internal.action.refactor  Error in Simulink.ModelManagement.Project.Dependency.refactor?  ,Manually modify the remaining instances of the bus usages.,Simulink,Other,"R2019a Update 9, R2019b Update 6, R2020a Update 5, R2020b, R2021a",10 Mar 2021
2282944," Simulink might crash when multiple models simulate simultaneously, but the models finishing last contain string signals",Simulink allows multiple unrelated models to simulate at the same time. Simulink might crash if one model finishes simulation and the remaining models contain string signals. ,,Simulink,Other,"R2019a Update 9, R2019b Update 7, R2020a Update 5, R2020b, R2021a",31 Oct 2023
2282734, MAAB check?Stateflow transition appearance incorrectly flags transitions crossing junctions,The Model Advisor check?Stateflow transition appearance ? (Check ID:mathworks.maab.db_0129) incorrectly flags?transitions crossing junctions when transitions and junctions are grouped into sub-charts within the states.,,Simulink Check,Other,"R2019a Update 9, R2020b, R2021a",10 Mar 2021
2279233," Incorrect Code Generation: sum(x,dim) might return incorrect answers for?single?and?half?inputs?in generated code that uses row-major layout","Code generated for the function  sum(x,dim) , where?dim ?is the dimension to operate along,?might return incorrect answers if all  the following conditions are true: class(x)  is 'single ' or 'half ' The generated code stores  x ?in row-major order x  is not a vector x  is not empty The dim  argument is supplied size(x,dim)  is greater than 1024  size(x,k)~=1 ?for some?k < dim   This issue affects MATLAB Coder, MATLAB Function blocks or MATLAB System blocks in Simulink, and MATLAB functions in Stateflow. ",,MATLAB Coder,Incorrect Code Generation,"R2018b Update 8, R2019a Update 9, R2019b Update 6, R2020a Update 5, R2020b, R2021a",10 Mar 2021
2267485, Incorrect Code Generation: MATLAB functions that recursively call themselves might produce incorrect code,"C/C++ code generation from MATLAB might produce incorrect code if all  of these conditions are true: The source MATLAB code contains a function that (directly or indirectly) calls itself? The first call to the recursive function (or the function that starts the recursion) passes a constant input to that function During recursion, the subsequent calls to that function pass different values for that input parameter?  For example, define a MATLAB function simple2 ?that calls the recursive function? recursive_fcn ? with a constant input?5 : function out = simple2 %#codegenout = recursive_fcn(5);end The function recursive_fcn ? recursively calls itself with a different input value for each call:function out = recursive_fcn(n)if n > 0    m = n - 1;    out = 0;    out = recursive_fcn(m);    out = out + do_something(n);else    out = 0;endend function out = do_something(n)out = cumsum(1,n);end The generated C code contains an infinite recursion and does not terminate. This issue affects MATLAB Coder, MATLAB Function blocks or MATLAB System blocks in Simulink, and MATLAB functions in Stateflow.? ",,MATLAB Coder,Incorrect Code Generation,"R2019a Update 9, R2019b Update 7, R2020a Update 5, R2020b, R2021a",10 Mar 2021
2266491, Drive Cycle Source block produces an incompatible file error,The Drive Cycle Source block produces an incompatible file error dialogue message when importing files with non-uniformly sampled time data.,Click?OK?to accept the error. You will then see the correct error message regarding the issue with non-uniformly sampled data.,Powertrain Blockset,Other,"R2019a Update 9, R2019b Update 6, R2020a Update 4, R2020b, R2021a",10 Mar 2021
2265414, Multiple CAN FD  channel connections cannot run on the same MathWorks virtual channel,You cannot simultaneously run more than one CAN FD channel connected to the same MathWorks virtual device channel. ,,Vehicle Network Toolbox,Other,"R2019a Update 9, R2019b Update 6, R2020a Update 5, R2020b",18 Sep 2020
2255441, Incorrect Code Generation: Lookup Table(n-D) block with fixed point inputs containing negative fraction length generates incorrect HDL code,"The generated HDL code for a Simulink model might be incorrect when the following settings are applied: The model contains a Lookup Table(n-D) block with Flat? Interpolation method The inputs are of fixed-point type with negative fractional length?, such as  sfix6_E3 numerictype(0, 6, -3)?   The incorrect HDL code can result in simulation failures in ModelSim when verifying the generated code. ",Avoid negative fraction lengths as input type to the Lookup Table(n-D) block.,HDL Coder,Incorrect Code Generation,"R2019a Update 9, R2020a Update 8, R2020b",17 Feb 2022
2253686, Persistent lateral drift for vehicle models with solid axle suspensions and non-zero initial roll angles,"If your vehicle model has a non-zero initial roll angle and a solid axle suspension, the vehicle can have a persistent lateral drift during simulation. ",,Vehicle Dynamics Blockset,Other,"R2019a Update 9, R2019b Update 6, R2020a Update 5, R2020b",18 Sep 2020
2253483, Incorrect Code Generation: Memory allocated for a dynamic array in the generated code might be?freed before last use of the array,"In the generated code, memory allocated for a dynamic array might be?freed before the last use of the array if all  these conditions are true: Your MATLAB code contains an array for which the code generator allocates memory dynamically on the heap. (Such arrays must be variable-size and unbounded, or variable-size with bound that is greater than a threshold.) In your MATLAB code, the last reference of the dynamic array is used inside a function call. This function call appears in the condition of an if  or while ?statement.  For example, consider this MATLAB function: function y = example(n1,n2) assert(isa(n1, 'double'));assert(n1 <= 100);assert(isa(n2, 'double')); % Create a 1x100 upper bounded struct array that contains an inner unbounded arrays1 = repmat(struct('x', zeros(1,n2)), 1, n1);% Create an unbounded struct array that contains an inner unbounded arrays2 = repmat(struct('x', zeros(1,n2)), 1, n2);for i = 1:numel(s1)    s1(i).x(10) = n1;end a2 = subfcn(s2);if subfcn(s1) == 42    y = 123 + s2(10).x(2);else    y = 456 + a2;end function y = subfcn(s)coder.inline('never');y = 0;for i = 1:numel(s)    y = y + s(i).x(1);end Generate MEX code for this function by running:? codegen example?  The condition ""if  subfcn(s1) == 42 "" ?contains the last reference to s1 . This last reference ?occurs inside a call to the function subfcn . In the generated code,?s1  contains dynamic matrices that are heap allocated and need to be freed after the last use of s1 . (The reason for the prior call subfcn(s2)  is to make sure that the code generated for the function subfcn ? can handle arbitrary array sizes. The second call subfcn(s1) ?reuses this generated code.)  The generated code looks like: b_s1.data = &amp;s1.data[0];b_s1.size = &amp;s1.size[0];b_s1.allocatedSize = 100;b_s1.numDimensions = 2;b_s1.canFreeData = false;emxFree_struct_T_1x100(&amp;s1); /* The free happens too early because s1 is indirectly used below via b_s1 */st.site = &amp;d_emlrtRSI;if (subfcn(&amp;st, &amp;b_s1) == 42.0) { Calling the generated MEX function example_mex  might result in a MATLAB crash and/or an incorrect answer. For example, example_mex(10,10)?  This issue affects MATLAB Coder, MATLAB Function blocks or MATLAB System blocks in Simulink, and MATLAB functions in Stateflow. ","Create a new temporary variable that holds the last reference to the dynamic array instead of putting that reference directly in the condition of the if or while statement. For example, in the previous MATLAB function example, change:?if subfcn(s1) == 42?to:t = subfcn(s1);if t == 42",MATLAB Coder,Incorrect Code Generation,"R2019a Update 9, R2019b Update 7, R2020a Update 6, R2020b, R2021a",10 Mar 2021
2251486, Incorrect Code Generation: Lookup Table block with linear interpolation and output word length less than or equal to table word length causes HDL mismatch,"When calculating the interval of two consecutive points in a Lookup Table block for linear interpolation, overflow might occur if the result cannot be represented by the output type set on the block. This can cause a numeric mismatch in the generated HDL code.",Increase the output data type to be 1 bit larger in word length than the data type of the table data.,HDL Coder,Incorrect Code Generation,"R2019a Update 9, R2019b Update 6, R2020a Update 4, R2020b, R2021a",10 Mar 2021
2244485, Discrete-Time Integrator block logs incorrect minimum and maximum values for fixed-point data types with slope and bias scaling,"The Discrete-Time Integrator block logs incorrect minimum and maximum values during simulation when its output data type is fixed-point with slope and bias scaling.  To observe this issue, perform?Range Analysis ?with the Fixed-Point Designer.  Alternatively, search for ""Range Analysis using Fixed Point Tool"" in the documentation to find instructions on how to do this. ",,Simulink,Other,"R2019a Update 9, R2019b Update 7, R2020b, R2021a",10 Mar 2021
2237803, Shared utility code folder error for modified Vehicle Dynamics Blockset and Powertrain Blockset example,"Simulating or updating the diagram of a Powertrain Blockset or Vehicle Dynamics Blockset example model might produce an unexpected error if you have edited a model in the model hierarchy. The error might look like: ? Error while bringing model references of model SiCiPtReferenceApplication up to date: Error????building model 'SiEngineController'.  The current model configuration differs from the model????configuration used to generate the shared utility code folder, ????'<myPath>\ slprj\ sim\ _sharedutils'.  ","Delete the slprj folder and .slxc files, then try again.?",Simulink,Other,"R2018b Update 8, R2019a Update 9, R2019b Update 6, R2020a Update 5, R2020b",11 Feb 2021
2232359, Incorrect Code Generation: Missing logged signals from Stateflow charts when Simulink.fileGenControl sets the CacheFolder to a directory other than pwd,"Signals inside Stateflow charts that are inside a model block (set to Accelerator mode simulation) can be logged using the Data Import/Export  pane. When Simulink.fileGenControl  is set to generate code and cache files in a directory other than pwd  using the following command:? Simulink.fileGenControl('set','CacheFolder','C:\otherDirectory')?  Such signals may not appear in the final logged data.? ",,Stateflow,Incorrect Code Generation,"R2019a Update 9, R2019b Update 6, R2020a Update 4, R2020b",18 Sep 2020
2227156," Incorrect Code Generation: Index outputs of union, setdiff, and setxor might refer to the last instances of repeated elements instead of the first instances","The generated code for setxor  and union  might return the indices corresponding to the last occurrence of repeated elements in its second and third outputs rather than the first occurrences. For example, with?[y,ia,ib] = x_union([2,2],1) ,  we should have?ia = 1 , but code generation returns?ia = 2 .?  Similarly, the generated code for setdiff ?might return the last occurrence of repeated elements in its second output rather than the first occurrence. This issue affects MATLAB Coder, MATLAB Function blocks or MATLAB System blocks in Simulink, and MATLAB functions in Stateflow. ",,MATLAB Coder,Incorrect Code Generation,"R2019a Update 9, R2019b Update 7, R2020a Update 3, R2020b",18 Sep 2020
2226722, Incorrect Code Generation: Streaming and sharing of resources that are clock-rate pipelined can cause HDL mismatch,"If streaming and sharing are both requested when Clock Rate Pipelining  is enabled, the generated HDL code might have a numeric mismatch when compared to the original model. The mismatch occurs because the scheduling logic inside the clock-rate pipelined region does not correctly handle resources participating in multiple optimizations that require scheduling such as streaming and sharing. This can happen if streaming is requested on a subsystem which contains another subsystem requesting sharing.  ","Remove the sharing request from the lower subsystem, or avoid using Clock Rate Pipelining when requesting the streaming and sharing optimizations on the same resources.",HDL Coder,Incorrect Code Generation,"R2019a Update 9, R2019b Update 7, R2020a Update 5, R2020b",18 Sep 2020
2221957, Incorrect Code Generation: Mismatch in value of parameter Scalarize vector ports?between protected model and model in which it is used generates incorrect HDL code,"If the value of the Configuration parameter Scalarize vector ports  does not match between the model underneath a protected subsystem and the model in which the protected subsystem is being used, then HDL Coder can generate incorrect code. If the design contains a protected subsystem for HDL code generation, then all Configuration Parameters must match between the top model and the protected model as mentioned in this HDL Coder documentation page:?Protected Model Restrictions for HDL Code Generation .  ",,HDL Coder,Incorrect Code Generation,"R2019a Update 9, R2019b Update 7, R2020a Update 5, R2020b",18 Sep 2020
2220730, Incorrect Code Generation: Incorrect code generation for PC Worx 6.0?target when using models with?Shift Arithmetic?blocks,Behaviour of?Shift Arithmetic ?instructions on target?PC Worx 6.0? is different from that in Simulink. This could lead to incorrect code generation for Out-Of-Range bit shift operations. ,,Simulink PLC Coder,Incorrect Code Generation,"R2019a Update 9, R2019b Update 6, R2020a Update 4, R2020b, R2021a",10 Mar 2021
2216400, Incorrect Code Generation: HDL coder might generate incorrect code for 1-bit HDL Counter with step value of -1,The generated code from the HDL Counter might be incorrect when the?step value  is -1  and the difference between the?Word length  and Fraction length  is 1 .,,HDL Coder,Incorrect Code Generation,"R2019a Update 9, R2019b Update 7, R2020a Update 7, R2020b",18 Oct 2023
2216327, Incorrect Code Generation: Calling discretize with repeated bin edges and the 'IncludedEdge' option set to 'right' might produce incorrect answer,"In the generated code, calling  discretize  might produce incorrect answer if all  these conditions are true:?  The bin edges provided to discretize   include repeated values, implying that at least one bin has right and left edges that are the same.  The 'IncludedEdge'  option is set to 'right'  and the bin with repeated edges is not the first (i.e. left-most) bin. This indicates that the bin with repeated edges must be empty because the conditions for an element to be placed in it contradict each other.   MATLAB correctly leaves such a bin empty, but the generated code might place elements in it.? Here is an example that illustrates this issue: discretize([0 1 2],[0 0 1 1 2],'IncludedEdge','right')?  MATLAB execution produces this result:?   [1? ? ?2? ? ?4]?  Generated code produces this result:? [1? ? ?3? ? ?4]?  Note that if the call to discretize ?does not use the ?'IncludedEdge' ?option or if the?'IncludedEdge' ?option is set to?'left' , the generated code ?is not affected by this issue.? This issue affects MATLAB Coder, MATLAB Function blocks or MATLAB System blocks in Simulink, and MATLAB functions in Stateflow. ",,MATLAB Coder,Incorrect Code Generation,"R2019a Update 9, R2019b Update 7, R2020a Update 5, R2020b",18 Sep 2020
