Bug Id,Summary,Description,Workaround,Products,Type,Fixed In,Modified Date
662135, Simulation And Code Generation Mismatch: Nondeterministic simulation results for asynchronous tasks with Rate Transition blocks and signal storage reuse,"Simulation of a model that contains multiple asynchronous function-call subsystems and Rate Transition blocks might give incorrect results if all of the following conditions are true: The model option Signal storage reuse  is selected. This allows Rate Transition block output buffers potentially to be reused by another Rate Transition block. The output buffers of a Rate Transition block that is connected to one asynchronous function-call subsystem are reused for a Rate Transition block driven by another asynchronous function-call subsystem.  Under these conditions, an incorrect value might be generated in the Rate Transition block output during simulation. (Note:  Generated code behavior is correct.) ","To work around this bug, clear the model option Signal storage reuse on the Optimization pane of the Configuration Parameters dialog box.",Simulink,Other,R2011a,28 Jun 2011
662035, MATLAB may crash when using a builtin name as a variable in a script.,"MATLAB may crash when using a builtin name as a variable in a script, e.g.for t=1:2  gamma(t)= 0;endc = gamma(1);","Use names for variables that do not conflict with MATLAB's builtin function names, e.g.for t=1:2  mygamma(t)= 0;endc = mygamma(1);",MATLAB,Other,R2011a,07 Apr 2011
661996, getinputstruct returns error for a model that has inputs with scalar dimension of 2 or greater,The getinputstruct  command returns an error when used with an operating point of a model that has a scalar multi-dimensional Inport block at the root level. The error occurs if you enter a scalar value of 2 or greater in the Port dimensions field of the Inport block dialog box. ,"When you set the inport dimensions for a multi-dimensional input signal, do not use a scalar value. Instead, use a vector value that describes the number of rows and columns of the signal at the inport. For example, if the input signal is a column vector of two elements, enter the value [2 1] in the Port dimensions field of the Inport block dialog box.",Simulink Control Design,Other,R2011a,07 Apr 2011
661964, Requirements report fails to correctly include links to DocBlock contents,"Creating links from Simulink model objects to the contents of RTF DocBlock blocks in the same or another Simulink model is a new feature in R2010a. Links are highlighted and navigated correctly, but creating a requirements report for a model that includes such links produces the following warnings: Warning: Unresolved relative path: ModelName:[some number].rtf In C:\Program Files\MATLAB\R2010b\toolbox\slvnv\reqmgt\+rmiut\full_path.p>full_path at 44  In C:\Program Files\MATLAB\R2010b\toolbox\slvnv\reqmgt\+rmisl\locateFile.p>locateFile at 18  In C:\Program Files\MATLAB\R2010b\toolbox\slvnv\reqmgt\@RptgenRMI\doc2path.p>doc2path at 8  In C:\Program Files\MATLAB\R2010b\toolbox\slvnv\reqmgt\@RptgenRMI\@ReqDocTable\execute.p>execute at 33  The Document Table at the top of the report shows the following errors : ERROR: unable to locate ModelName:[same number].rtf  Clicking any such link in a Document Table in the requirements report results in the ""File or URL Not Found "" message from the browser, or current working folder window may open depending on the browser. Similar links in Requirmements Tables in the body of the Report will also not work. ? ",Installation instructions (Windows only)Log in to an account with appropriate permissions to overwrite files in your MATLAB installation.Locate your MATLAB installation by typing matlabroot at the MATLAB command prompt. This folder is referred to as <MATLAB> in subsequent steps.Exit MATLAB.Download the attached .zip file associated with this Bug Report and store the file in the <MATLAB> folder. Use R2010a or R2010b patch depending on your installed MATLAB version.Make a backup copy of each of the *.m files listed in the .zip file and/or of each corresponding *.p file. Remove the originals.Extract the files from the .zip file to your <MATLAB> folder.Delete the .zip file in the <MATLAB> folder.,Simulink Check,Other,"R2010bSP1, R2011a",07 Apr 2011
661855," On Windows 7, compiling Simulink S-Functions using the MEX build script may issue an error that the Simulink include header file 'simstruc.h' cannot be found.","On Windows 7, if the MATLAB installation path contains a space (e.g. C:\Program Files\MATLAB), compiling Simulink S-Functions using: MEX build script S-Function Builder block build button Embedded Coder SIL and PIL mode Legacy Code Tool  will result in the following error in the MATLAB command window (for each of the supported compilers): Microsoft compilers :""fatal error C1083: Cannot open include file: 'simstruc.h': No such file or directory"" LCC :""<filename:lineNumber> Could not find include file ""simstruc.h"""" Intel C++ : compilation aborted for <file path> (code 4) <file> <filename(lineNumber)>: catastrophic error: could not open source file ""simstruc.h""  #include ""simstruc.h""  ^ Watcom : Error! E1073: Invalid option '-I""C:\Program' Error! E1139: Command line contains more than one file to compile Unable to open 'Files\MATLAB\R2010b""\extern\include.c' Error: Compiler returned a bad status compiling ""<filename>"" NOTE: The patch below does not fix this issue for Watcom compiler users. ","Installation instructionsLog in to an account with appropriate permissions to overwrite files in your MATLAB installation. On Linux systems, this is typically the root account.Locate your MATLAB installation by typing matlabroot at the MATLAB command prompt. This folder is referred to as <MATLAB> in subsequent steps.Exit MATLAB.Download the attached .zip file associated with this Bug Report and store the file in the <MATLAB> folder.Make a backup copy of each of the files listed in the .zip file. To see the contents of the .zip file: Windows Systems: Open the .zip file and look at the contents.Linux/Macintosh Systems: Type the following in a shell (Linux) or in a terminal window (Macintosh):unzip -l <MATLAB>/<.zip file>Extract the files from the .zip file. Windows Systems: If you are on Windows 7, run ""WinZip"" as administrator by right-clicking on the ""WinZip"" executable and selecting ""Run as Administrator"", otherwise go on to the next step.Open the .zip file.Extract the contents of the file to your <MATLAB> folder.Linux/Macintosh Systems: Type the following in a shell (Linux) or in a terminal window (Macintosh): cd <MATLAB>unzip <.zip file>Delete the .zip file in the <MATLAB> folder.NOTE: This patch does not fix this issue for Watcom compiler users.August 25, 2010: attachment_661855_10b_win7_2010-08-25.zip: initial version, works on R2010b and Windows 7 only",Simulink,Other,"R2010bSP1, R2011a",07 Apr 2011
661645, Incorrect Code Generation: Wrong answer returned when using a vector of fixed-point or Simulink.IntEnumType initial values,"In Stateflow, the initial value for data objects can be set in the Model Explorer using a scalar or vector value. When setting the initial value of a data object using either a vector of type fixed-point or Simulink.IntEnumType, the value is not correctly preserved. For example, if a user sets the initial value of a local data object to be: [fi(1, 1, 16, 0) fi(2, 1, 16, 0)] then the actual value being used will be: [1 1]  instead of [1 2]  In other words, the value of the first element will be duplicated for all the elements of the vector or matrix. ","The workaround is to cast the initial value vectors of type fixed-point or Simulink.IntEnumType to double.For instance, in the case of a Simulink.IntEnumType class called Colors with 'Red' and 'Blue' enumerations, replace the following:[Colors.Red Colors.Blue]withdouble([Colors.Red Colors.Blue])",Stateflow,Incorrect Code Generation,"R2010bSP1, R2011a",06 Apr 2015
661302, F2802x / F2803x Serial Transmit does not transmit all of the data when the baud rate is higher.,"The F2802x / F2803x Serial Transmit block interprets the transmit FIFO level incorrectly. The maximum capacity of the FIFO is 4 words instead of 16. As a result, higher baud rates can cause a FIFO full condition and data loss. ","The patch file, patch_661302.zip, applies to releases R2009b, R2010a and R2010b.Download the attached files, attachment_661302_20110202.zip and patch_661302.zip.Extract patch_installer.m from attachment_661302_20110202.zip.In MATLAB, set Current Folder to the location of patch_installer.m and patch_661302.zip. (e.g., ""C:\Users\username\Downloads"")At the MATLAB command prompt, enter: patch_installer('patch_661302.zip', 'install')Follow the instructions displayed on the MATLAB command line.Reboot MATLAB.",Embedded Coder,Other,R2011a,17 Oct 2011
661297, comm.RSEncoder and comm.RSDecoder error out if neither Simulink nor the Fixed-Point Toolbox are installed.,"If neither Simulink nor the Fixed-Point Toolbox are installed with your copy of MATLAB, then when you run the comm.RSEncoder System object with bit inputs, MATLAB generates the following error:??? Undefined function or method 'isfi' for input arguments of type 'double'.Error in ==> RSEncoder>castData at 411  if isfi(input)If you run the comm.RSDecoder System object with bit inputs, it will fail with a similar error:??? Undefined function or method 'isfi' for input arguments of type 'double'.Error in ==> RSDecoder>castData at 529  if isfi(input)",Download the attached isfi.m file to the following location:$matlabroot/toolbox/commblks/commblks.,Communications Toolbox,Other,R2011a,09 Aug 2011
661292, comm.MemorylessNonlinearity errors out if neither Simulink nor the Fixed-Point Toolbox are installed.,"If neither Simulink nor the Fixed-Point Toolbox are installed with your copy of MATLAB, then when you run the comm.MemorylessNonlinearity System object, MATLAB generates the following error:??? Undefined function or method 'isfi' for input arguments of type 'double'.Error in ==> MemorylessNonlinearity>MemorylessNonlinearity.mOutput at 310    if isfi(x)",Download the attached isfi.m file to the following location:$matlabroot/toolbox/commblks/commblks.,Communications Toolbox,Other,R2011a,09 Aug 2011
661289, comm.DiscreteTimeVCO errors out if neither Simulink nor the Fixed-Point Toolbox are installed.,"If neither Simulink nor the Fixed-Point Toolbox are installed with your copy of MATLAB, then when you run the comm.DiscreteTimeVCO System object, MATLAB generates the following error:??? Undefined function or method 'isfi' for input arguments of type 'double'.Error in ==> DiscreteTimeVCO>DiscreteTimeVCO.mOutput at 172    if isfi(x)",Download the attached isfi.m file to the following location:$matlabroot/toolbox/commblks/commblks.,Communications Toolbox,Other,R2011a,09 Aug 2011
661285, comm.CRCGenerator &amp; comm.CRCDetector error out if neither Simulink nor the Fixed-Point Toolbox are installed.,"If neither Simulink nor the Fixed-Point Toolbox are installed with your copy of MATLAB, then when you run the comm.CRCGenerator or comm.CRCDetector System objects, MATLAB generates the following error:??? Undefined function or method 'isfi' for input arguments of type 'double'.Error in ==> commblkCheckInistates at 10 if ~( isvector(iniStates) &amp;&amp; ~isempty(iniStates) &amp;&amp; ~isfi(iniStates) )",Download the attached isfi.m file to the following location:$matlabroot/toolbox/commblks/commblks.,Communications Toolbox,Other,R2011a,09 Aug 2011
661257, H5T.commit does not work for 1.8.x syntax.,The syntax for H5T.commit  corresponding to the 1.8.x API version of H5Tcommit  in the HDF5 library does not work.,"Installation instructions?????? Log in to an account with appropriate permissions to overwrite files in your MATLAB installation. On Linux systems, this is typically the root account.?????? Locate your MATLAB installation by typing matlabroot at the MATLAB command prompt. This folder is referred to as <MATLAB> in subsequent steps.?????? Exit MATLAB.?????? Download the attached .zip file associated with this Bug Report and store the file in the <MATLAB> folder.?????? Make a backup copy of each of the files listed in the .zip file. To see the contents of the .zip file: ????????????? ???????????????????? Windows Systems: Open the .zip file and look at the contents.???????????????????? Linux/Macintosh Systems: Type the following in a shell (Linux) or in a terminal window (Macintosh):unzip -l <MATLAB>/<.zip file>????????????? ?????? ?????? Extract the files from the .zip file. ????????????? ???????????????????? Windows Systems:?????????????????????????? ????????????????????????????????? Open the .zip file.????????????????????????????????? Extract the contents of the file to your <MATLAB> folder.?????????????????????????? ???????????????????? ???????????????????? Linux/Macintosh Systems: Type the following in a shell (Linux) or in a terminal window (Macintosh): ?????????????????????????? cd <MATLAB>unzip <.zip file>???????????????????? ????????????? ?????? ?????? Delete the .zip file in the <MATLAB> folder.Change log: November 08, 2010, 2010:  updated 10a_10b attachment, replaced win32, win64 mex-files.  September 21, 2010:  attachment_661257_09a_2010_09_21.zip, initial version, works on 2009a.  September 17, 2010:  attachment_661257_10a_10b_2010_09_17.zip, initial version, works on 2010a, 2010b.  September 17, 2010:  attachment_661257_09b_2010_09_17.zip, initial version, works on 2009b.  September 17, 2010:  removed attachment_661257_09a_09b_2010_09_17.zip, it does not qualify on R2009a.  Added attachment_661257_09b_2010_09_17.zip",MATLAB,Other,R2011a,07 Apr 2011
661250, comm.CPMCarrierPhaseSynchronizer errors out if neither Simulink nor the Fixed-Point Toolbox are installed.,"If neither Simulink nor the Fixed-Point Toolbox are installed with your copy of MATLAB, then when you run the comm.CPMCarrierPhaseSynchronizer System object, MATLAB generates the following error:??? Undefined function or method 'isfi' for input arguments of type 'double'.Error in ==> CPMPSKCarrierPhaseSynchronizerBase>CPMPSKCarrierPhaseSynchronizerBase.mOutput at 82    if isfi(x)",Download the attached isfi.m file to the following location:$matlabroot/toolbox/commblks/commblks.,Communications Toolbox,Other,R2011a,09 Aug 2011
661059, A function-call port in a referenced model that has the States when enabling parameter set to inherit may generate incorrect code,The results from simulation do not match the results from code generation for a function-call subsytem in a referenced model if all  of these conditions exist: There is a Model block in a conditionally executed subsystem (such as an enabled subsystem). The Model block references a model that: Contains a function-call subsytem whose function-call port has the States when enabling  parameter set to inherit  Uses an ERT-based system target file (STF) Has the Configuration Parameters  > Optimization  > Optimize initialization code for model reference  parameter turned on   ,"For all function-call ports, set the States when enabling parameter to either held or reset.",Simulink Coder,Other,R2011a,20 Apr 2011
661043, MATLAB crashes while reading some H.264 encoded QuickTime movie (.mov) files using mmreader,"MATLAB crashes when you use mmreader  to read QuickTime movies with these characteristics: H.264 encoding   ""Current Size"" set to a width and height different from the native size of the movie   The following code exhibits the behavior:    obj = mmreader('myfile.mov');    img = read(obj, 1); ",Installation instructionsLog into your computer using an account with Administrator privilegesDownload the workaround files associated with this Bug ReportLocate the download - this directory is referred to as <DOWNLOAD> in subsequent stepsLocate your MATLAB installation by typing matlabroot at the MATLAB command prompt - this directory is referred to as <MATLAB> in subsequent stepsExit MATLABType the following in a Terminal window:cd <MATLAB>tar ?xvf <DOWNLOAD>/<downloaded file>,MATLAB,Other,R2011a,09 Aug 2011
660937, Running MCR Installer on 64-bit Linux Centos system with LANG set to ja_JP causes null pointer exception.,Running the MCR Installer on a 64-bit Centos Linux system may cause a null pointer exception and prevent a successful installation when the LANG is set to ja_JP. ,"To work around this issue, change LANG to en_US.UTF-8. This change will enable you to install the MCR in English without error.",MATLAB Compiler,Other,R2011a,13 Feb 2012
660896," When you enable task profiling, generating code for TI 2804x processors errors out","If you enable Task Profiling  in the model Configuration Parameters, and then build the model for a processor in the Texas Intruments 2804x family of processors, the code generation software produces the following error message: ### Writing source file mAllC2000Procs_data.c ### Writing source file mAllC2000Procs_main.c ### TLC code generation complete. Error: cslLib_C2000_profileReadTimer: Unknown processor family ""2804x"". ","To work around this problem, perform the following steps:1. Download attachment_660896_20110223.zip and a single patch file for your version of MATLAB:R2009b: patch_660896_9b.zipR2010a: patch_660896_10a.zipR2020b: patch_660896_10b.zip2. Extract patch_installer.m from attachment_660896_20110223.zip.3. In MATLAB, set Current Folder to the location of patch_installer.m and the patch zip file. (e.g., ""C:\Users\username\Downloads"")4. At the MATLAB command prompt, enter the commands that matches your patch file:patch_installer('patch_660896_9b.zip', 'install')patch_installer('patch_660896_10a.zip', 'install')patch_installer('patch_660896_10b.zip', 'install')5. Follow the instructions displayed on the MATLAB command line.6. Reboot MATLAB.7. Delete the following files:toolbox/idelink/extensions/ticcs/@CCSLinkTgtPkg/@TMS320C2000/getTokens.ptoolbox/idelink/extensions/ticcs/envChecker/f2804x_pdf.p8. Enter the following commands at the MATLAB command prompt:rehash toolboxreset; rehash toolboxcache;9. Restart MATLAB.",Embedded Coder,Other,R2011a,09 Aug 2011
660766, Incorrect Code Generation: MATLAB Coder might generate incorrect code for arrays whose size is determined by one of multiple outputs returned by a function,"MATLAB Coder and MATLAB Function blocks in Simulink might generate incorrect code for an array when its size is determined by one of multiple outputs returned by a function. For example,   [sz, ...] = foo(...);  m = zeros(sz); ",Do not return the size of an array as one of multiple outputs to a function call.,MATLAB Coder,Incorrect Code Generation,R2011a,28 Nov 2011
660678, Using a mask parameter for port data logging fields can cause run-time update diagram to fail,"Updating a diagram during simulation can fail if both of these conditions apply: For a signal inside a masked subsystem, you use a mask parameter to set either the Limit data points to last  or Decimation  fields in the Signal Properties dialog box. The Configuration Parameters -> Optimization -> Inline parameters  option is checked.  ",Set the Limit data points to last or Decimation fields to numeric values or expressions that do not refer to mask parameters.,Simulink,Other,R2011a,07 Apr 2011
660398, Selecting certain Help menu entries for Operating Points and Linearization Task produces errors,"In the Operating Points and Linearization Task nodes of the Control and Estimation Tools Manager, selecting one of the following entries from the Help menu produces an error dialog box: What is Linearization Linearizing Models Selecting Analysis I/Os Inspecting and Validating Results Creating Custom Views Exporting and Saving Results  The error states that the selected help topic ""is not found or help is not installed ."" ? ",,Simulink Control Design,Other,R2011a,04 Apr 2016
660159, The MSLOWESS and MALOWESS functions use the Median Absolute Deviation (MAD) instead of the median of absolute residuals when using the robust option.,"A robust implementation of local regression using weighted linear least squares is available when the 'ROBUSTITERATIONS'  input argument is set to 1 or larger in the function MSLOWESS  or when the 'ROBUST'  input argument is set to TRUE  in the function MALOWESS . Multiple iterations of this algorithm prevent deviant points distorting the smoothing points. To emphasize points that are not outliers, the literature recommends using a bisquare function dependent on the median of the absolute value of the residuals, MEDIAN(ABS(res)) . However, the functions MSLOWESS  and MALOWESS  use median absolute deviation of the residuals MEDIAN(ABS(res-MEDIAN(res))) . ","Installation instructions1. Log into your computer using an account with Administrator privileges2. Download the workaround files associated with this Bug Report3. Locate the download - this directory is referred to as <DOWNLOAD> in subsequent steps4. Locate your MATLAB installation by typing matlabroot at the MATLAB command prompt - this directory is referred to as <MATLAB> in subsequent steps5. Exit MATLAB6. Follow additional steps, depending on your operating systemOn Windows:Open the downloaded fileExtract the contents of the file to your <MATLAB> directoryOn Linux and Macintosh:Type the following in a shell (on Linux) or a Terminal (on Macintosh) window:cd <MATLAB>tar -xvf <DOWNLOAD>/<downloaded file>",Bioinformatics Toolbox,Other,R2011a,07 Apr 2011
660095, Use of a Simulink.AliasType to a Simulink.AliasType defining an AUTOSAR builtin data type results in a redefinition of typedef compilation error when used with code from an AUTOSAR RTE generator,"For code generation, when a Simulink.AliasType  is used to reference a Simulink.AliasType  that defines an AUTOSAR builtin data type, the software places the typedef  statement for this data type in model_types.h . An AUTOSAR RTE generator will place this typedef in Rte_Type.h . When code from the model and the RTE generator are compiled together a compilation error will be produced, for example: error: redefinition of typedef 'UInt8' ","To work around the issue, remove the typedef statement from model_types.h.",Embedded Coder,Other,R2011a,16 May 2011
660007, .NET event handlers are not removed by the delete function.,"? If you add a .NET event handler, delete it, and then add it again, the MATLAB event callback function gets called multiple times. This happens because the MATLAB event handler was not removed from the .NET event delegate's invocation target list by the delete  function. The following example demonstrates this behavior. C# class definition:     namespace MyNamespace    {        public delegate void MyDelegate(object src, EventArgs args);        public class MyClass        {            public event MyDelegate MyEvent;            public void DoSomething()            {                if (MyEvent != null)                {                    MyEvent(this, new EventArgs());                }            }        }    } MATLAB event handler:     function MyEventHandler(evtSrc, evtArgs)        disp('FROM: MyEventHandler');    end In MATLAB do the following: obj = MyNamespace.MyEventSource();% Add event listenerl = addlistener(obj, 'MyEvent', @MyEventHandler);% Fire .NET eventobj.DoSomething();    FROM: MyEventHandler% Delete event listenerdelete(l);% Add event listener second timel = addlistener(obj, 'MyEvent', @MyEventHandler);% Fire .NET event. MATLAB event handler is called twice.obj.DoSomething();    FROM: MyEventHandler    FROM: MyEventHandler  ",,MATLAB,Other,R2011a,07 Apr 2011
659863, Simulink might not save and restore complete simulation state (SimState) for data with the nonvirtual bus data type,"If a Simulink model contains simulation state for data with the nonvirtual bus data type, Simulink might not correctly save and restore the complete SimState. ","As a workaround, do not use nonvirtual bus data types in the model.",Simulink,Other,"R2010bSP2, R2011a",05 Apr 2012
659803, GigE Vision camera(s) may not be detected on Linux,"Due to a bug, GigE Vision cameras can only be detected on one network interface (i.e., an Ethernet card). Users of only one network interface will not notice any issues (if the camera is on the network that the PC is on, or the PC is not connected to a network and instead is only connected to a camera). However, users of more than one network interface may not see their single camera. Alternatively, if you have more than one camera on more than one interface, you may be able to detect at most one camera. For bandwidth reasons, it is recommended that each GigE Vision camera be on its own interface if they are to be used concurrently. ? ? ","Installation instructionsLog in to an account with appropriate permissions to overwrite files in your MATLAB installation. On Linux systems, this is typically the root account.Locate your MATLAB installation by typing matlabroot at the MATLAB command prompt. This folder is referred to as <MATLAB> in subsequent steps.Exit MATLAB.Download the attached .zip file associated with this Bug Report and store the file in the <MATLAB> folder.Make a backup copy of each of the files listed in the .zip file. To see the contents of the .zip file: Windows Systems: Open the .zip file and look at the contents.Linux/Macintosh Systems: Type the following in a shell (Linux) or in a terminal window (Macintosh):unzip -l <MATLAB>/<.zip file>Extract the files from the .zip file. Windows Systems: Open the .zip file.Extract the contents of the file to your <MATLAB> folder.Linux/Macintosh Systems: Type the following in a shell (Linux) or in a terminal window (Macintosh): cd <MATLAB>unzip <.zip file>Delete the .zip file in the <MATLAB> folder.",Image Acquisition Toolbox,Other,R2011a,13 Feb 2012
