Bug Id,Summary,Description,Workaround,Products,Type,Fixed In,Modified Date
1881779, Simulink might crash when generating code for some System objects,"Simulink might crash?during code generation?for a model containing MATLAB System block when a System object implements the releaseImpl  method, or uses other System objects that implement the releaseImpl  method. ",,Simulink,Other,"R2018b Update 2, R2019a",14 Jan 2019
1881716, Incorrect Code Generation: Missing calls for C charts with more than one call to rand(),"If you have a C action language chart that calls the rand()  C function more than once during the same time step, some of the calls might be incorrectly eliminated from the generated code. ",,Stateflow,Incorrect Code Generation,R2019a,20 Mar 2019
1881552, Incorrect Code Generation: Incremental rebuild ignored with normal MATLAB variant controls,"Incremental rebuild is ignored when a Variant block uses normal MATLAB variant control variables.  The incorrect behavior may cause numerical mismatch in code generation,f or example:  >> rtwdemo_preprocessor_subsys; >> VSSMODE = 1; >> rtwbuild(bdroot); >> VSSMODE = 0; //Change the Variant control value in the Base Workspace >> rtwbuild(bdroot); // Notice that code corresponding to the new value is not regenerated even though the value of variant control is changed.??  The incorrect behavior happens when all the below conditions are met: The Simulink model uses an ERT? based code generation target Variant block has Analyze all choices and generate pre-processor conditionals  selected Variant control variable is a normal MATLAB variant control and not a?Simulink.Parameter   ",Use Simulink.Parameter instead of normal MATLAB variables. (OR)Remove slprj folder,Embedded Coder,Incorrect Code Generation,"R2018b Update 3, R2019a",20 Mar 2019
1880978, MATLAB might crash when you open a?Bus Creator inside an inactive variant choice,"MATLAB might crash when you attempt to open a Bus Creator inside the inactive variant choice,if all the below conditions are TRUE:Model has a linked Variant Subsystem library block The linked Variant Subsystem block has an active choice  ",Consider breaking the link to the library block.,Simulink,Other,R2019a,20 Mar 2019
1880910, An mdce service started in MATLAB R2018b using an mdce_def file copied from an earlier release cannot start workers,"The WORKER_MAXIMUM_MEMORY  property was added to the default mdce_def  file in MATLAB R2018b. If you start the mdce service using an mdce_def  file which is missing this new property, then the following error is issued when you start workers: Problem starting the MATLAB worker.?  The cause of the problem is:?============================================================================????timeout creating child process?????????This is causing:?????????Problem starting the worker group process.?????????This is causing:?????????Problem starting the worker group process.?============================================================================ ","To resolve the problem, copy the missing line from the R2018b mdce_def file to the mdce_def file copied from a previous release.For a unix platform, add the following line to your mdce_def.sh file:WORKER_MAXIMUM_MEMORY=""1024m""For a windows platform, add the following line to your mdce_def.bat file:?set WORKER_MAXIMUM_MEMORY=1024m?",Parallel Computing Toolbox,Other,"R2018b Update 2, R2019a",20 Mar 2019
1880778, Performance regression with imageDataAugmenter,"When training small deep learning networks on small images using imageDataAugmenter and trainNetwork, training times can be slightly longer compared with R2018a. This bug affects MATLAB Deep Learning Container for NVIDIA GPU Cloud. ",,Deep Learning Toolbox,Other,R2019a,20 Mar 2019
1880754, Missing CONCRT140.dll error,"On Windows, if the Visual Studio 2017 redistributable runtime is not installed, Image Processing Toolbox throws an error when calling any function which depends on CONCRT140.dll (a Visual Studio 2017 C Runtime DLL). For example, >> strel('disk',10, 8);  Error using images.internal.morphmexInvalid MEX-file 'C:\Program Files\MATLAB\R2018b\toolbox\images\images\+images\+internal\morphmex.mexw64': Missing dependent shared libraries:'CONCRT140.dll' required by 'C:\Program Files\MATLAB\R2018b/bin/win64\opencv_core340.dll->C:\Program Files\MATLAB\R2018b/bin/win64\libmwmorphop_ocv.dll->C:\Program Files\MATLAB\R2018b\toolbox\images\images\+images\+internal\morphmex.mexw64'.  ",,Image Processing Toolbox,Other,"R2018b Update 4, R2019a",26 Mar 2019
1879741, Incorrect incompatibility reported for Simulink Function with enumerated?interface?configured in data dictionary,"If your Simulink model satisfies all these conditions, Simulink Design Verifier compatibility check may incorrectly report the model as incompatible:  The model contains Simulink Functions  The parameters or arguments to a Simulink Function are Enumerated data types  The model uses a data-dictionary   The Diagnostic Viewer window displays this error:   Translation failed: Could not evaluate <Name of Enum Type> in data dictionary""  ",,Simulink Design Verifier,Other,R2019a,20 Mar 2019
1879701, Incorrect Code Generation: Code generated from a model containing Model blocks both with and without Initialize/Reset/Terminate Functions may fail to compile,"Code generated from a model may fail to compile due to mismatched signatures when all of the following conditions are true: The model contains one or more Model blocks. The top model or one of the submodels referenced by its Model blocks contains an Initialize Function, Reset Function, or Terminate Function block. At least one of the submodels referenced by a Model block does not contain an Initialize Function, Reset Function, or Terminate Function block. The submodel without?an Initialize Function, Reset Function, or Terminate Function block?uses only constant or triggered sample times.  ","Place an empty Initialize Function, Reset Function, or Terminate Function block in the referenced model that does not have one.",Simulink,Incorrect Code Generation,"R2018b Update 8, R2019a, R2019b",01 Mar 2021
1879494, Report API's customizeReporter method can generate an invalid subclass,"The Report API's customizeReporter  method can generate a reporter subclass that contains coding errors. This occurs if the method is used to generate a reporter that is a member of a? package of reporters.? For example, this command ?mlreportgen.report.TitlePage.customizeReporter(""+my/@TitlePage"")  generates a reporter named my.TitlePage  that contains coding errors. Adding an instance of this reporter to a report, for example, import mlreportgen.report.*rpt = Report('myreport');add(rpt, my.TitlePage);close(rpt);?  causes an error similar to? Undefined variable ""TitlePage"" or class ""TitlePage.getClassFolder"".? ","Replace occurrences of the unqualified class name (e.g., TitlePage) with the fully qualified name (e.g., my.TitlePage) in the following methods generated by the customizeReport method:getDefaultTemplatePathcreateTemplate",MATLAB Report Generator,Other,R2019a,20 Mar 2019
1879413, Error when executing Simulink Code Inspector qualification tests with MinGW compiler,"?The following build error might occur when executing qualification tests for Simulink Code Inspector if you are using the MinGW compiler: Exception during eval : The model is configured for C++ code generation, but the C-only compiler, LCC, is the default compiler. To allow code generation, on the Code Generation pane:? 1. Select the 'Generate code only' check box.? 2. In the Toolchain field, select a toolchain from the drop-down list.? For information about C++ compiler support, see?  https://www.mathworks.com/support/compilers/current_release  .   ","Follow these steps to make the model toolchain compliant: 1. Navigate to <matlabroot>/toolbox/qualkits/do/slci/tests.2. Open the model that encountered the error.3. Run the following command from the MATLAB command line: set_param(<modelName>,? 'RTWCompilerOptimization','off');4. Save the model.",DO Qualification Kit,Other,R2019a,03 Sep 2019
1879192," Altitude and Julian date inputs to the WGS84 Gravity Model block are?limited to between 0?and 20,000?meters (altitude) and?before 2451545 (Jan 1, 2000)?(Julian date)","Altitude and Julian date inputs to the WGS84 Gravity Model  block are?limited to between 0?and 20,000?meters (altitude) and?before 2451545  (Jan 1, 2000)?(Julian date), regardless of the Action for out-of-range input  setting. ",,Aerospace Blockset,Other,"R2018b Update 1, R2019a",20 Mar 2019
1879183, Incorrect error on valid header file specified for imported Simulink Bus in data dictionary,"When?a model containing Stateflow and MATLAB Function blocks has a Simulink bus object in model associated data dictionary, Simulink may throw a false error on a Simulink Bus, claiming the imported bus doesn't have a valid 'HeaderFile'  specified. For example:  Custom code settings contain a structure type with the name 'A_BUS'. The bus type 'A_BUS' needs to have its 'HeaderFile' field specified with the header file name.  ","In the?Configuration Parameters > Simulation Target pane, clear the Import custom code parameter.",Simulink,Other,"R2018b Update 3, R2019a",20 Mar 2019
1879054, Cannot start remote server from Polyspace Metrics and Remote Analysis Server Settings interface,"When an mdce service is started with the Start Server  button in the Polyspace Metrics and Remote Analysis Server Settings interface (polyspace-server-settings.exe ), the interface freezes and displays a timeout message:     Script startworker unable to complete successfully - exiting    The mdce service on the host     returned the following error:    Problem starting the MATLAB worker.    The cause of the problem is:    ===================================================       timeout creating child process     This is causing:       Problem starting the worker group process.    This is causing:       Problem starting the worker group process.    =================================================== ",Edit the file MATLAB_INSTALL_DIR\toolbox\polyspace\distcomp\bin\polyspace_mdce_def.bat (or .sh on Linux/MAC) and add the following line:WORKER_MAXIMUM_MEMORY=1024m,"Polyspace Bug Finder, Polyspace Bug Finder Server",Other,"R2018b Update 3, R2019a",20 Mar 2019
1878944, GRT code generation may assert when Simulink model with MATLAB Function block multiplies 2-D matrices with unbounded dimensions,"GRT code generation may assert when all the following conditions are met:? System target for the model is GRT. Model has a MATLAB Function block. This MATLAB function block multiplies a pair of 2-dimensional arrays. Both dimensions of the multiplication result are unbounded i.e., A and B are 2-D matrices of dimensions MxN and NxW respectively. The result of their multiplication is MxW where both M and W are unbounded.  Model is simulated in rapid accelerator mode or code is generated for it.  For ERT target an error is thrown for these unbounded dimensions.  ",,Embedded Coder,Other,R2019a,25 Aug 2020
1877434, Reading certain MP4/MOV files using?VideoReader causes MATLAB? to crash,"On Linux systems, using?VideoReader  to read frames from MP4/MOV files can cause MATLAB to crash.  For example, the following code can cause a crash:   vidObj = VideoReader('myVideoFile.mp4'); ",,MATLAB,Other,"R2018b Update 1, R2019a",20 Mar 2019
1877340, Scope cannot be deleted while launching error when trying to delete a Scope block,"After resizing the window of a Scope block, then saving and closing a model, the Scope window might be empty upon re-opening the model. Only the title bar of the Scope window appears. If you subsequently try to delete this Scope block, Simulink throws an error:  Scope cannot be deleted while launching  ","Open the scope window and resize the window large enough so that the axes will fit.? The Scope will still appear empty.?Save the model, close it, and finally re-open it.?The Scope should now show the axes.?If the empty Scope window persists, try restarting MATLAB.",Simulink,Other,R2019a,29 May 2019
1876850," The Model Advisor check ""Appropriate implementation of fundamental logical and numerical operations"" (ID: mathworks.maab.na_0002) flags Function-Call Subsystems driven by a root level Inport.","The Model Advisor check ""Appropriate implementation of fundamental logical and numerical operations"" (ID: mathworks.maab.na_0002) flags Function-Call subsystems driven by a root level Inport with the warning "" The following logic operation blocks have non-boolean data type at input"" even though Function-Call subsystem is not a logic block. ",,Simulink Check,Other,R2019a,20 Mar 2019
1876488, Custom Test Objective?block with broken link ignored or not validated,"If the?custom?Test Objective's??  linked? library?block is broken in the Simulink model, then the?Simulink Design Verifier :  Ignores it when the?coverage filter is enabled anywhere in the model. Does not validate the custom Test Objective ,? if the? coverage filter is disabled.   ",,Simulink Design Verifier,Other,R2019a,20 Mar 2019
1876474, Initialize/Reset/Terminate subsystems errors when fixed-in-minor time step signal feeds into IRT ports on model ref blocks,"When fixed-in-minor time step signals feed into the initialize/reset/terminate ports on the model reference blocks, unexpected error messages occur, such as Event input port of Model block cannot be driven by signals with continuous sample time or fixed-in-minor-step sample time  ",,Simulink,Other,"R2018b Update 3, R2019a",20 Mar 2019
1875971, Parameters and input/output ports in S-function builder may be shuffled when S-function builder block dialog reopens,"Upon opening S-function builder blockdialog, the block?tries to find the previously generated <sfcn_name>.c file where <sfcn_name>?is the nameof the S-function as it appears on the block icon. If the file exists, S-functionbuilder reads and parses the C code, then?applies the parsed data into theblock dialog. In R2018b, a bug in the parser causes the order of parameters being shuffled when the block dialog is reopened, making unintended parameter value assignments in the Ports and Parameters Properties table in the S-function builder dialog. Then, if the user builds their S-function, the parameters or input/output ports may take shuffled values and?causing?signals to be routed to wrong ports. ","Delete the <sfcn_name>.c files on path before opening an S-function builder dialog.Before building or saving an S-function builder, verify that the orders of parameters and ports are assigned as intended, to avoid any previouslyshuffled order being saved to the model.",Simulink,Other,"R2018b Update 2, R2019a",20 Mar 2019
1875935, Accelerator simulation mode fails for a model with a Simulink Function block that is called only from inside an Initialize Function or a Terminate Function block (but not both),A model with a Simulink Function block that is called only from inside an Initialize Function or a Terminate Function block (but not both) can throw an error similar to the one below when simulated in accelerator mode.? ? ? Error using accelbuild_private>LocalAccelbuildprivate (line 261)?  ? ? /private/var/folders/zz/zyxvpxvq6csfxvn_n0000jbr0004_y/T/tpdb54ee86_sjha-maci/slprj/accel/mSLFcnCalledOnlyInsideTerminate/mSLFcnCalledOnlyInsideTerminate_acc.c:230:7:?  ? ? error: use of undeclared identifier?  ? ? 'mSLFcnCalledOnlyInsideTerminate_SettheDSMValueFNI'?  ? ? ? ? ? mSLFcnCalledOnlyInsideTerminate_SettheDSMValueFNI;?  ? ? ? ? ? ^?  ? ? 1 error generated. - Show complete stack trace  ,,Simulink,Other,"R2018b Update 3, R2019a",20 Mar 2019
1875809, Crash when loading or updating AUTOSAR model that uses Basic Software blocks or library-linked Function Callers or Rate Transitions,"Loading a model or updating the diagram causes MATLAB to crash if all of these conditions are true: The model is configured as an AUTOSAR component. Function Caller blocks defined in a library (for example, the Basic Software block library) or Rate Transition blocks defined in a library were added to the model. The AUTOSAR mapping was updated to include the added blocks, for example, by clicking the Code Mappings editor?Update ?button. Later, one or more of the added blocks was removed from the model, but was not removed using delete_block . The model was saved without updating the AUTOSAR mapping for the block removals.  ",,Embedded Coder,Other,"R2018b Update 7, R2019a",06 Feb 2020
1875534, Incorrect Code Generation: Rounding loss in CAN Pack and CAN FD Pack blocks,"If you use the CAN Pack or CAN FD Pack block with signals represented by signed or unsigned integer data types, the block truncates the fractional part of the raw value, instead of rounding the raw value to the nearest integer.  For example, assuming you send a physical value of 106 to the pack block for a signal represented by a 32-bit signed integer, with offset 0, and factor 10, the raw value being packed would be 10, instead of 11.  ",,Vehicle Network Toolbox,Incorrect Code Generation,R2019a,08 Feb 2021
1875291, Incorrect Code Generation: Initial values?might not be assigned?before an object?is passed to an extrinsic function in generated code,"This issue occurs if all of the following conditions are true:? In your MATLAB code, an object is passed to an extrinsic function. The object?has a property prop ?whose initial value?is not defined in the constructor. prop ?is?initialized with a?default property value.  In this situation, the initial value might not be assigned before the extrinsic function is called in the generated code. For example, consider this definition for the class SomeClass :? classdef SomeClass    properties        prop = 12;    endend Suppose that you generate code for the?MATLAB?function foo ?that?creates an instance of SomeClass  and passes it to an extrinsic function efun . function v = foocoder.extrinsic('efun');v = efun(SomeClass());end? In the generated code,?the instance of SomeClass? might not have prop ?initialized as 12 . ","If you pass an instance of a class to an extrinsic function, explicitly define the initial values for all properties in the constructor of that class.",MATLAB Coder,Incorrect Code Generation,R2019a,20 Mar 2019
1875233, Incorrect Code Generation: Creation of a branch from a message line connected to Outport block insidean Atomic Subsystem may produce wrong results,"Amodel involving messages may produce wrong results when all of the followingconditions are met: A branchis created from the message line connected to the Outport block  A Scope blockis connected to the new message line branch  The Scopeblock is removed from the new branch  AnotherOutport block is connected to the new branch  The newsubsystem output port is not connected to any block   Whenthese conditions are met, messages may appear to be leaked out from the newunconnected output port of the subsystem, and produce incorrect simulation results. ",,Simulink,Incorrect Code Generation,"R2019a, R2019b",03 Jun 2019
1874332, Data logging of signals from target computer displays corrupt or inaccurate data in SDI?immediate mode,A real-time application that streams signal data in immediate mode may display corrupt or inaccurate data in Simulink Data Inspector. The signal data issue occurs most frequently when the application streams many signals at a time and often appears as large data spikes in the data displayed in SDI.,"Stream the signals in buffered mode instead of immediate mode. For more information, see?Minimize Data Loss with Simulation Data Inspector Buffer Mode.",Simulink Real-Time,Other,"R2018b Update 1, R2019a",20 Mar 2019
1873935, Incorrect Code Generation: Incorrect results are possible for a model?with a Unit Delay block?and custom code definitions,"The generated code may be incorrect for a model that meets the following conditions:? In the Configuration Parameters dialog box, the System target file   is set to ert.tlc . The model contains a conditionally executed subsystem block such as an Enabled, Triggered, Enabled and Triggered, Enable, or Trigger block. The conditionally executed subsystem connects to model-level root output port. Inside the conditionally executed subsystem, a Unit Delay block connects to the output port?of the subsystem that drives model-level root output port. The model uses an Embedded Coder Dictionary in which the step function prototype is customized.   ",Remove the step function prototype specification from the model.,Embedded Coder,Incorrect Code Generation,"R2018b Update 1, R2019a",20 Mar 2019
1873881, ginput causes errors when used for axes inside a tab or panel,"The ginput  data exploration function does not work when used on Axes? objects ? inside of a Tab  or Panel  object . For example, the following code generates an error:   f = figure;   p = uipanel(f);   a = axes(p);   [x,y] = ginput;  The error also occurs for those functions that depend on ginput , such as gname  from Statistics Toolbox.? ",,MATLAB,Other,"R2018b Update 1, R2019a",20 Mar 2019
1873384, Error when running model with supercritical fluid properties,"Fluids with pseudocritical lines near the maximum valid specific internal energy for the model can produce calculation errors at compile time. The errors cause the fluid density derivatives calculated from the fluid property tables to become NaN. Model compilation fails and simulation does not run. Fluid properties, including the pseudocritical line, are specified on the Two-Phase Fluid Properties (2P) block. The pseudocritical line is an extension of the liquid and vapor saturation lines above the critical pressure. The maximum valid specific internal energy is also specified on the Two-Phase Fluid Properties (2P) block. ",,Simscape,Other,"R2018b Update 1, R2019a",20 Mar 2019
1873179, Incorrect Code Generation: Processing entities carrying bus or structure type data with event actions or MATLAB Discrete-Event System block may produce incorrect results,"Processing entities might produce incorrect results when the following conditions are met: ?Entities carry data of complex bus or structure type with non-double data type elements ?Entities are processed with event actions or MATLAB Discrete-Event System block (with the?Simulate using? parameter is set to 'Code generation ')  For instance, processing an entity carrying nested bus with non-double data type elements by Event Actions might produce wrong results. ","If an incorrect result is produced by MATLAB Discrete-Event System block, set the?Simulate using?parameter to 'Interpreted execution'.",SimEvents,Incorrect Code Generation,"R2019a Update 4, R2019b",15 Jul 2019
1872879, Error indicating a missing makefile during code generation of a model hierarchy that includes a protected model,"When generating code for a model reference hierarchy that includes a protected model, you see an error such as the following: Cannot find makefile 'Array_DatatypesRef.mk' in the build directory '.\ slprj\ target\ Array_DatatypesRef' which is needed to make the application ?? The error can occur when all of the following conditions apply: The unprotected source of the protected model was originally configured to use the Template Makefile (TMF) infrastructure for compiling code. The unprotected source of the protected model is configured with the configuration parameters?'GenerateMakefile' ?and 'GenCodeOnly'  set to 'on' . The resulting protected model is used in a top model which is configured with the configuration parameter?'GenCodeOnly'  set to 'off' .  ",,Simulink Coder,Other,"R2018b Update 1, R2019a",20 Mar 2019
1872611, Incorrect Code Generation: GPU code generation for the?rectifyStereoImages?function produces incorrect results when compared to the MATLAB simulation,"The generated GPU code for the Computer Vision Toolbox function, rectifyStereoImages  produces incorrect results when compared to its MATLAB simulation. This behavior can be observed when the following conditions are met: The?rectifyStereoImages ?function is used in the form:[J1,J2] = rectifyStereoImages(I1,I2,tform1,tform2);   where tform1  and tform2  are the projective transformations to be applied to the input images I1  and I2 . Data type of the input images I1  and I2  must be uint8 .  ",,GPU Coder,Incorrect Code Generation,R2019a,29 Apr 2019
1872547, Incorrect Code Generation: Initialization code might be incorrect for n-D Lookup Table and Interpolation Using Prelookup blocks,"The generated code might contain incorrect initialization code for n-D Lookup Table and?Interpolation Using Prelookup blocks when all of these conditions are true: ?The number of table dimensions is greater than or equal to 2. ?The n-D Lookup Table or Interpolation Using Prelookup block operates?at a?constant sample time. ?In the model Configuration Parameters dialog box, the Default?parameter?behavior ?parameter is set to?Inlined . ?In the model Configuration Parameters dialog box, the Array Layout ?parameter is set to?Row-major . ?A Simulink.Signal  object is assigned to the n-D Lookup Table or Interpolation Using Prelookup block?output.?  This incorrect code might lead to a mismatch between the simulation and generated code results. ",Remove the?Simulink.Signal object that is assigned to the block output.,Embedded Coder,Incorrect Code Generation,"R2018b Update 3, R2019a",18 Sep 2023
