Bug Id,Summary,Description,Workaround,Products,Type,Fixed In,Modified Date
1338316, MATLAB may crash when generating code for a variant subsystem that is outputting a virtual bus,"If a model contains a variant subsystem that is outputting a virtual bus and is configured to generate preprocessor conditionals, MATLAB may crash. ","Installation instructions  Log in to an account with appropriate permissions to overwrite files in your MATLAB installation. On Linux systems, this is typically the root account. Locate your MATLAB installation by typing matlabroot at the MATLAB command prompt. This folder is referred to as <MATLAB> in subsequent steps. Exit MATLAB.Download the attached .zip file associated with this Bug Report and store the file in the <MATLAB> folder.  Windows Systems: You may need administrative privileges to save the .zip file in the <MATLAB> folder. To do this, open this Bug Report in a browser started in administrator mode, then from the browser save the .zip file in the <MATLAB> folder.   For each file that appears in the .zip file, find the corresponding file in your existing <MATLAB> folder and make a backup of it. To see the contents of the .zip file:  Windows Systems: Open the .zip file and look at the contents.    Extract the files from the .zip file into the <MATLAB> folder.  Windows Systems:  Open the .zip file. Extract the contents of the file into your <MATLAB> folder. You may be prompted to provide Administrator privileges when extracting the .zip file.     Delete the .zip file in the <MATLAB> folder.  *Change log:    May 03, 2016: attachment_1338316_10bsp2_win32_2016-01-04.zip: added.  May 03, 2016: attachment_1338316_10bsp2_win64_2016-01-04.zip: added.  ",Embedded Coder,Other,R2011a,03 May 2016
1177104, Sometimes the Model Reference Signal Logging dialog does not display all logged signals in referenced models,"If a model hierarchy contains more than three levels of models, it is possible for a signal logged in one of the lowest level models to not show up on the Model Reference Signal Logging dialog. ",,Simulink,Other,R2011a,15 Dec 2014
1031921, Code generation for a referenced model results in empty terminate function,Code generation for a referenced model with a Stateflow chart might result in a terminate function containing only comments. This terminate function is not optimized out even if the Code Generation > Interface > Terminate function required  check box is cleared and the function does not include executable code.,,Embedded Coder,Other,R2011a,13 Jan 2014
1011981, Running Simulink.findVars in cached search mode causes MATLAB to crash,"Simulink.findVars  provides an argument called SearchMethod , which accepts cached  as one of two possible values. The value cached  avoids unnecessary model compilation, thereby optimizing the search. However, if you use the value cached  while writing custom Model Advisor checks that take a model in and out of compiled mode, MATLAB can crash. ","If you see this bug while calling Simulink.findVars in code for custom Model Advisor checks, remove the name-value pair of SearchMethod and cached from the list of arguments for Simulink.findVars.Cached search method is a performance optimization, and therefore removing it will not impact the output of Simulink.findVars.",Simulink,Other,R2011a,11 Nov 2013
933595, Model build using Microsoft Visual Studio 2010 to generate Visual C/C++ Solution File fails with compiler not found (Windows only),"On a Windows system, building a model for a Visual C/C++ Solution File target might fail if Microsoft Visual Studio 2010 is installed on the system. The build process does not recognize Visual Studio 2010 as supported for MSVC project creation and incorrectly displays the following error message: No supported Visual C/C++ compiler found. Check your installation of Visual C/C++ Note that this bug affects only Visual C/C++ Solution File builds and not template makefile (TMF) based builds. ",,Simulink Coder,Other,R2011a,08 Apr 2013
928180," Models containing ForEach subsystems which, in turn, contain conditionally executed logic, can cause MATLAB to produce incorrect results or crash during linearization.","For models containing ForEach subsystems, performing linearization can cause MATLAB to produce incorrect results or crash if these models contain certain modeling features. The following list describes these features: 1.A ForEach subsystem containing any of the following blocks: Switch Multiport switch An S-function with at least one input marked as conditionally executed A conditionally executed subsystem where the 'Propagate execution context across subsystem boundary' setting is set to ON  2. Any one of the above blocks are traceable (via a connection) to an input port of the ForEach subsystem to which the block belongs. 3. A ForEach subsystem, which meets conditions 1 &amp; 2 above, is on the linearization path. This bug does not affect simulation results. ","To work around this issue, change the following settings whenever you perform linearization on such models:1. In the Optimizations pane of the model's configuration parameters dialog box, set the 'Conditional Input Branch Execution' setting to OFF. To do this programmatically,set_param(model,'ConditionallyExecuteInputs','off');2. Check to see if the models contain conditionally executed subsystems (such as Enabled subsystems or Triggered Subsystems). In thise case,i)Right click on the subsystem block. Select the 'Subsystem Parameters' option.ii)Set the 'Propagate execution context across subsystem boundary' setting to OFF.",Simulink,Other,R2011a,15 Mar 2013
817023, Dialog snapshots may be captured as black boxes,Dialog snapshots may be captured as black boxes. ,"Apply the attached bug fix.Installation instructionsLog in to an account with appropriate permissions to overwrite files in your MATLAB installation. On Linux systems, this is typically the root account.Locate your MATLAB installation by typing matlabroot at the MATLAB command prompt. This folder is referred to as <MATLAB> in subsequent steps.Exit MATLAB.Download the attached .zip file associated with this Bug Report and store the file in the <MATLAB> folder.Make a backup copy of each of the files listed in the .zip file. To see the contents of the .zip file: Windows Systems*: Open the .zip file and look at the contents.Linux/Macintosh Systems: Type the following in a shell (Linux) or in a terminal window (Macintosh):unzip -l <MATLAB>/<.zip file>Extract the files from the .zip file. Windows Systems*: Open the .zip file.Extract the contents of the file to your <MATLAB> folder.Linux/Macintosh Systems: Type the following in a shell (Linux) or in a terminal window (Macintosh): cd <MATLAB>unzip <.zip file>Delete the .zip file in the <MATLAB> folder.*Notes for Windows Systems:If you see ˇ°Error: Access is deniedˇ± when attempting to extract the .zip file, you may need to start WinZip in administrator mode. Do this by navigating to WinZip.exe or the WinZip Start menu entry, right-clicking on it, and selecting Run as administrator.From within WinZip, find and open the downloaded .zip file.Extract the contents of the file to your <MATLAB> folder.",Simulink Report Generator,Other,R2011a,01 Jun 2012
815806, Time vector of signals logged in Simulink.Timeseries format might differ from simulation time by +/- eps(time),"In releases prior to R2011a, all signal logging data used the Simulink.ModelDataLogs  objects, which store data using Simulink.Timeseries  objects. When using ModelDataLogs  (Simulink.Timeseries ) format to log discrete signals, it is possible that the time values of the logged data differ from the time steps taken by the model by +/- eps(time) . ","Installation instructionsLog in to an account with appropriate permissions to overwrite files in your MATLAB installation. On Linux systems, this is typically the root account.Locate your MATLAB installation by typing matlabroot at the MATLAB command prompt. This folder is referred to as <MATLAB> in subsequent steps.Exit MATLAB.Download the attached .zip file associated with this Bug Report and store the file in the <MATLAB> folder.Make a backup copy of each of the files listed in the .zip file. To see the contents of the .zip file: Windows Systems*: Open the .zip file and look at the contents.Linux/Macintosh Systems: Type the following in a shell (Linux) or in a terminal window (Macintosh):unzip -l <MATLAB>/<.zip file>Extract the files from the .zip file. Windows Systems*: Open the .zip file.Extract the contents of the file to your <MATLAB> folder.Linux/Macintosh Systems: Type the following in a shell (Linux) or in a terminal window (Macintosh): cd <MATLAB>unzip <.zip file>Delete the .zip file in the <MATLAB> folder.*Notes for Windows Systems:If you see ˇ°Error: Access is deniedˇ± when attempting to extract the .zip file, you may need to start WinZip in administrator mode. Do this by navigating to WinZip.exe or the WinZip Start menu entry, right-clicking on it, and selecting Run as administrator.From within WinZip, find and open the downloaded .zip file.Extract the contents of the file to your <MATLAB> folder.",Simulink,Other,R2011a,07 May 2012
807817, Current Folder browser: Navigation to folder containing encrypted zip file returns exception,"Navigating in the Current Folder browser to a folder containing a zip file encrypted by 128-Bit AES or 256-Bit AES results in this error: Exception in thread ""Thread-74"" java.lang.IllegalArgumentException: invalid compression method ","The attached patch only works for R2010b. 1) Copy the patch.zip file to {MATLABROOT}\java, where {MATLABROOT} is the directory where you installed MATLAB  2) Run MATLAB  3) In the MATLAB Command Window, type:  cd([matlabroot '/java'])  unzip('patch.zip')  Files unzip to folders {MATLABROOT}\java\patch\com\mathworks\mlwidgets and {MATLABROOT}\java\patch\com\mathworks\matlab 4) Exit MATLAB   5)Restart MATLABLet us know if the reported problem continues.",MATLAB,Other,R2011a,14 Mar 2012
791486, Simulation Data Inspector might display incorrect data when zooming on a plot with two signals,"On the Inspect Signals tab of the Simulation Data Inspector, when zooming in a plot containing two signals, the plot might not display all of the data points for one of the signals. ","Installation instructionsLog in to an account with appropriate permissions to overwrite files in your MATLAB installation. On Linux systems, this is typically the root account.Locate your MATLAB installation by typing matlabroot at the MATLAB command prompt. This folder is referred to as <MATLAB> in subsequent steps.Exit MATLAB.Download the attached .zip file associated with this Bug Report and store the file in the <MATLAB> folder.Make a backup copy of each of the files listed in the .zip file. To see the contents of the .zip file: Windows Systems*: Open the .zip file and look at the contents.Linux/Macintosh Systems: Type the following in a shell (Linux) or in a terminal window (Macintosh):unzip -l <MATLAB>/<.zip file>Extract the files from the .zip file. Windows Systems*: Open the .zip file.Extract the contents of the file to your <MATLAB> folder.Linux/Macintosh Systems: Type the following in a shell (Linux) or in a terminal window (Macintosh): cd <MATLAB>unzip <.zip file>Delete the .zip file in the <MATLAB> folder.*Notes for Windows Systems:If you see ˇ°Error: Access is deniedˇ± when attempting to extract the .zip file, you may need to start ˇ°WinZipˇ± in administrator mode. Do this by navigating to WinZip.exe or the WinZip Start menu entry, right-clicking on it, and selecting ˇ°Run as administratorˇ±.From within WinZip, find and open the downloaded .zip file.Extract the contents of the file to your <MATLAB> folder.",Simulink,Other,R2011a,20 Jan 2012
755728," Original model file incorrectly renamed with "".bak"" when you try to cancel the ""Saving Referenced Models"" dialog","When you save a model containing model references, you might see a dialog prompting you to also save the referenced models. If you click the ""Cancel"" button in the ""Saving Referenced Models"" dialog, Simulink incorrectly renames the file containing the model to end in "".bak"".For example, if you save the model ""mymodel"", and then click ""Cancel"" in the ""Saving Referenced Models"" dialog, Simulink renames the file ""mymodel.mdl"" to ""mymodel.bak"".","Rename the file back to its original name.  For example, rename ""mymodel.bak"" back to ""mymodel.mdl"".",Simulink,Other,R2011a,19 Sep 2011
753095, Error detecting a common compiler for parallel model reference builds if only MSVC Express is installed,"The build process might fail to identify Microsoft Visual C++ (MSVC) Express as a suitable common compiler for parallel model reference builds if MSVC Express is the only supported compiler installed on a Windows host system. If this occurs, the build process displays the following message: A common compiler is needed in order to link the final executable together. However, a common compiler does not exist across all workers in the MATLAB Distributed Compute Server pool. ",,Simulink Coder,Other,R2011a,24 May 2012
752230," wavefun errors when loading user-defined type III, IV, or V wavelets ","Prior to R2011a, attempting to use a type III, IV, or V wavelet added to the toolbox as a MAT file with wavemngr  results in the error ??? Error using ==> fevalUndefined function or method 'FSN.mat' for input arguments of type 'double'.  where FSN  is the wavelet family short name.  Because wavefun  is called by a number of other functions, including cwt , you can experience this error anytime you attempt to use a type III, IV, or V wavelet you have added to the toolbox. ",,Wavelet Toolbox,Other,R2011a,11 Oct 2011
738576, Menus added to the Mac screen menu bar with uimenu cannot be disabled,"If you set the uimenu  'Enable'  property to 'off' , all of the menu items become disabled (gray) but the menu itself remains selectable. This behavior is a side effect of moving MATLAB menus to the top of the screen in R2011a (see the Update on MATLAB for the Mac  and the uimenu  documentation ). Menus now appear in the screen menu bar and Apple's JDK does not allow menus in the screen menu bar to appear disabled. ","Consider reworking your menu hierarchy to avoid the need to disable a top-level menu.If this is not feasible, one alternative to disabling a uimenu is to hide it by setting its 'Visible' property to 'off'.A more drastic workaround is to disable the Mac screen menu bar in MATLAB. For more information, see the workaround in Bug Report 718285.",MATLAB,Other,R2011a,23 Jun 2011
735917," cfamounts produces incorrect cash flows for cases where Period is 1, Basis is a non-ISMA day count, and AdjustCashFlowsBasis is set to true","For example, cfamounts  produces incorrect cash flows for the following: cfamounts(0.1, '28-Feb-2009', '28-Feb-2014', 'Period', 1,'Basis',0, 'AdjustCashFlowsBasis', true)   ans = 0 4.9589 4.9589 4.9863 4.9589 104.9589   These cash flows should be:  cfamounts(0.1, '28-Feb-2009', '28-Feb-2014', 'Period', 1,'Basis',0, 'AdjustCashFlowsBasis', true)   ans = 0 10.0000 10.0000 10.0274 9.9727 110.0000   ","Attached is the fix for the problem.To workaround this issue, replace the version of cfamounts.m function in your current installation with the updated version attached.1. Exit MATLAB?.Make a backup copy of the following files.matlabroot\toolbox\finance\cfamounts.mwhere matlabroot represents the name of your MATLAB installation directory, as returned by the matlabroot function.For example, rename the existing files by adding ""old"" to the file extension, cfamounts.m.OLD.2. Download the attached file and store it in the directory specified in the previous step.3. Restart MATLAB.4. Run the rehash toolboxcache command at the MATLAB prompt.",Financial Toolbox,Other,R2011a,09 Aug 2011
720551, UIGETFILE does not open file selection dialog box on Mac? systems,"On Mac? systems, calling WAITBAR along with multiple calls to UIGETFILE can result in the file selection dialog box not displaying. For example, run the following code: h = waitbar(0.5,'waiting'); FileName1 = uigetfile() close(h) FileName2 = uigetfile()  The second file selection dialog box might not appear and the variable FileName2  is assigned a value of 0.",,MATLAB,Other,R2011a,07 Apr 2011
715239, Incorrect Code Generation: Simulink PLC Coder generated code for CoDeSys2.3 target causes PLC controller to compute zero values,"In Simulink PLC Coder Version 1.2 (R2011a), generated code for the CoDeSys2.3 IDE might have the following issues:  The return value of the TRUNC  function is incorrectly typed as INT. It should be DINT. Use of SEL  operator is incompatible with the PLC controller run-time system.  These issues in the generated code might cause the PLC controller to compute zero values during execution. ","Installation instructionsLog in to an account with appropriate permissions to overwrite files in your MATLAB installation.Locate your MATLAB installation by typing matlabroot at the MATLAB command prompt. This folder is referred to as <MATLAB> in subsequent steps.Exit MATLAB.Download the attached .zip file associated with this Bug Report and store the file in the <MATLAB> folder.Make a backup copy of each of the files listed in the .zip file. To see the contents of the .zip file: Windows Systems: Open the .zip file and look at the contents.Extract the files from the .zip file. Windows Systems: Open the .zip file.Extract the contents of the file to your <MATLAB> folder.Delete the .zip file in the <MATLAB> folder.Change log:April 11, 2011: attachment_715239_11a_win32_2011-04-11.zip: initial version, works on R2011a only",Simulink PLC Coder,Incorrect Code Generation,R2011a,26 Jul 2017
715043, imerode function causes segmentation violation on Mac OS X,"For certain input images and structuring elements, the imerode  function causes a segmentation violation on Mac OS X. The error only occurs for a limited set of inputs, and the beginning of the stack trace looks like this: [0] morphmex.mexmaci64:tbb::internal::start_for<SubRegion2D, ErodeLogicalTwodFunctor, tbb::simple_partitioner>::execute() + 175 bytes[1] libtbb.dylib:tbb::captured_exception::throw_self()~ + 470 bytes[2] libtbb.dylib:tbb::internal::task_scheduler_observer_v3::observe(bool)~ + 2654 bytes[3] libSystem.B.dylib:_pthread_start~ + 316 bytes[4] libSystem.B.dylib:thread_start~ + 13 bytes ","Installation instructionsLog in to an account with appropriate permissions to overwrite files in your MATLAB installation. On Linux systems, this is typically the root account.Locate your MATLAB installation by typing matlabroot at the MATLAB command prompt. This folder is referred to as <MATLAB> in subsequent steps.Exit MATLAB.Download the attached .zip file associated with this Bug Report and store the file in the <MATLAB> folder.Make a backup copy of each of the files listed in the .zip file. To see the contents of the .zip file: Macintosh Systems: Type the following in a terminal window:unzip -l <MATLAB>/<.zip file>Extract the files from the .zip file. Macintosh Systems: Type the following in a terminal window: cd <MATLAB>unzip <.zip file>Delete the .zip file in the <MATLAB> folder.",Image Processing Toolbox,Other,R2011a,21 Feb 2012
712256," Simulation And Code Generation Mismatch: When submodel output is returned by value, the behavior of the code and simulation may not match","The results of a model's simulation and generated code might be inconsistent, if the model contains a submodel under the following conditions: You use Function Prototype Control to configure the signature of the submodel step function On the Diagnostics > Data Validity  pane, the diagnostic Underspecified initialization detection  is set to Classic  You specify that one of the submodel outputs is returned by value The submodel output is conditionally computed.  Modeling patterns that indicate conditional computations include: A conditionally executed subsystem (enabled subsystem) connected to the root model Outport block A Stateflow chart, Model block, or S-function block that conditionally computes its output and is connected to the root model Outport block  ","Place a Signal Conversion block at the input to the root model Outport block, which is both conditionally computed and configured as a return argument of the model step function. Select the Signal Conversion block parameter Exclude this block from 'Block reduction' optimization.",Embedded Coder,Other,R2011a,07 Apr 2011
712022," Incorrect Code Generation: When model output is returned by value, the value might be undefined","If you use Function Prototype Control to configure the signature of the model step function, and you specify that one of the model outputs is returned by value, then the return value might be undefined if it is conditionally computed. Modeling patterns that indicate conditional computations include: A conditionally executed subsystem (enabled subsystem) connected to the root model Outport block A Stateflow chart, Model block, or S-Function block that conditionally computes its output and is connected to the root model Outport block  ","Place a Signal Conversion block at the input to the root model Outport block, which is both conditionally computed and configured as a return argument of the model step function. Select the Signal Conversion block parameter Exclude this block from 'Block reduction' optimization.",Embedded Coder,Incorrect Code Generation,R2011a,07 Apr 2011
711742," On Macintosh, MATLAB R2010b Service Pack 1 has a main menu that says ""StartMATLAB"", and emits warnings when launched from a terminal window. This issue does not show up in R2010b, only R2010b Service Pack 1.","After MATLAB R2010b Service Pack 1 is launched on Macintosh, MATLAB's main menu says ""StartMATLAB"" instead of ""MATLAB"". In addition, when launched from the command line, MATLAB emits several messages that say: CFPropertyListCreateFromXMLData(): Old-style plist parser: missing semicolon in dictionary.  Both of these symptoms are benign and do not affect the proper functioning of MATLAB. ","Note that these instructions are for Macintosh only.First, log in to an account with appropriate permissions to overwrite files in your MATLAB installation.Then to fix the problems described above, you may either execute commands at the MATLAB command prompt or download and install a patch (choose one method or the other; you do not need to do both.)Option 1: Execute commands at the MATLAB command promptBe sure to copy these commands and paste them to the command prompt exactly as follows:cd (matlabroot);!perl -pi -e 's/"" ""//g' Contents/Resources/English.lproj/InfoPlist.stringsOROption 2: Download and install a patchLocate your MATLAB installation by typing matlabroot at the MATLAB command prompt. This folder is referred to as <MATLAB> in subsequent steps.Exit MATLAB.Download the attached .zip file associated with this Bug Report and store the file in the <MATLAB> folder.Make a backup copy of each of the files listed in the .zip file. To see the contents of the .zip file, type the following in a terminal window:unzip -l <MATLAB>/<.zip file>Extract the files from the .zip file by typing the following in a terminal window:cd <MATLAB>unzip <.zip file>Delete the .zip file in the <MATLAB> folder.Change log:March 1, 2011: attachment_711742_10bSP1_2011-03-01.zip: initial version, works on R2010bSP1 only",MATLAB,Other,"R2010bSP2, R2011a",05 Apr 2012
709480, Possible incorrect unit conversion applied to variables in through equations,"If unit of variable passed to through  statement differs from the unit of the Balancing  variable passed to the same through  statement, then an incorrect unit conversion is applied. ",Change unit of variables passed to through statement to match those of the Balancing variable passed to the same through statement.,Simscape,Other,R2011a,02 May 2011
709086, MEX hangs when building MEX-files using LCC on Windows 7 and using -output or -outdir to a directory with spaces.,"When building MEX-files using LCC on Windows 7 and using the -output  or -outdir  options to a directory with spaces, MATLAB hangs. It might display a window with the following message: buildlib.exebuildlib.exe has stopped working  A problem caused the program to stop working correctly. Windowswill close the program and notify you if a solution is available.                                         <Debug> <Close program> ",Close the dialogue. MATLAB might continue and successfully generate a MEX-file.,MATLAB,Other,R2011a,20 Apr 2011
708956, Incorrect Code Generation: Incorrect code generation when multiple bus objects with the same hierarchical structure are used,"If you use multiple bus objects with the same hierarchical structure but with different data types for some of the leaf elements, Real-Time Workshop generates incorrect typedef struct  definitions. In the generated code, Real-Time Workshop incorrectly defines such dissimilar bus objects to have the same struct  type. ",,Simulink Coder,Incorrect Code Generation,"R2010bSP1, R2011a",08 Apr 2011
