Bug Id,Summary,Description,Workaround,Products,Type,Fixed In,Modified Date
251291, Solaris: MATLAB Fails to Start When Stack Size Is Unlimited,"When you try to start MATLAB on Solaris and the machine's default stack size is set to unlimited, MATLAB fails to start and this exception appears: java.lang.OutOfMemoryError: unable to create new native thread To verify that this is the cause of the problem, run the following at an xterm prompt: ulimit -a (For some UNIX shells, the command is limit  or unlimit  rather than ulimit . For more information, run man ulimit .) The limits for various OS parameters appear, including the stack size limit. If the stack size limit value is set to unlimited, MATLAB will not start. ","You can fix the problem for just MATLAB or more generally.MATLAB specific fix: Create a file named java.opts in the directory from which MATLAB is started. Put the following line in the file: -XX:ThreadStackSize=8100When you start MATLAB, it loads the JVM with a default stack size limit that provides approximately 8 MB for each new thread.General fix (might affect other applications): Use the ulimit command to adjust the system's default stack size to something other than unlimited.",MATLAB,Other,R14SP3,22 May 2008
251277, Spaces in MATLAB install directory name cause vsim and Link for ModelSim demos to fail,"If the name of the directory in which MATLAB is installed contains spaces, the Link for ModelSim vsim  command fails. Link for ModelSim demos will also fail.","To avoid this problem, you must upgrade to ModelSim version 6.0b (or higher). This version of ModelSim fixes a problem handling spaces in directory names. In addition to upgrading Modelsim, you must apply the Link for ModelSim patches attached to this bug report (see Attachments below), as follows:Extract the patch files to a temporary directory. To do this on Windows, you can either run the self- extracting archive lfmpatch.exe or unzip lfmpatch.zip. On Linux, use the command unzip lfmpatch.zip.Copy vsim.m from your temporary directory to MATLABROOT\toolbox\modelsim\modelsim, replacing the existing file.Copy the other files from your temporary directory to MATLABROOT\toolbox\modelsim\modelsimdemos, replacing the existing files.",EDA Simulator Link MQ,Other,R14SP3,09 Aug 2011
251142, Storing a filter in the filter manager causes generated MATLAB code file to be empty,"If you store a filter in the filter manager and then try to generate a MATLAB code file, the generated file will be empty. ",,Signal Processing Toolbox,Other,R14SP3,13 Dec 2005
250874, Preferences Directory Sometimes Becomes Corrupt,"In some situations, files in the preferences directory become corrupt, for example, when running multiple versions of MATLAB. This can cause MATLAB to become nonresponsive. ","R13 (MATLAB Version 6.5) to R14SP2 (MATLAB Version 7.0.4)If you are running R13 through R14SP2, perform the following steps:Run prefdir in the Command Window to determine where the MATLAB preferences directory is located on your system. MATLAB returns, for exampleC:\WINNT\Profiles\{username}\Application Data\MathWorks\MATLAB\R14which is the preference directory for all R14 releases on Windowsor\home\{username}\.matlab\R13which is the preferences directory for all R13 releases on UNIX.Quit MATLAB.Rename the preferences directory for your current release and any older releases.  For example, for R14 (MATLAB 7.0), rename the directory from R14 to R14old. If you also have R13 (MATLAB 6.5) installed, rename the R13 directory to R13old.Start MATLAB. This creates a new preferences directory with default settings for the release you are running, for example R14.This should resolve the problem of corrupt preferences. If it does not solve the problems as you expected, you can restore your original preferences directory by deleting the newly created directories, R14 and R13, and renaming R14old to R14 and R13old to R13.R14SP3 (MATLAB Version 7.1)Starting in R14SP3, each release has its own preferences directory. This new structure is expected to resolve preference corruption problems. You can restore R14SP3 preference settings to either the MathWorks defaults for the release, or to your settings from the previous R14 release  Use MathWorks Default SettingsRun prefdir in the Command Window to determine where the MATLAB preferences directory is located on your system. MATLAB returns, for exampleC:\WINNT\Profiles\{username}\Application Data\MathWorks\MATLAB\R14SP3for Windows, or\home\{username}\.matlab\R14SP3for UNIX.Quit MATLAB.Rename the R14SP3 preferences directory, for example,  to R14SP3old.In that directory (the one containing R14sp3old), create a new, empty directory named R14SP3.Start MATLAB. MATLAB assumes it is running a new installation and populates the preferences directory with the MathWorks default preference settings for the release. Migrate Preferences from Previous R14 ReleasesRun prefdir in the Command Window to determine where the MATLAB preferences directory is located on your system. MATLAB returns, for exampleC:\WINNT\Profiles\{username}\Application Data\MathWorks\MATLAB\R14SP3for Windows, or\home\{username}\.matlab\R14SP3for UNIX.Quit MATLAB.Delete the R14SP3 preferences directory.Start MATLAB. MATLAB assumes it is running on a system that just upgraded to R14SP3 and populates the R14SP3 preferences directory with the preferences from the R14 preference directory.",MATLAB,Other,R14SP3,20 Oct 2005
250818, Inline invariant signals: storage generated when option is selected,"If an invariant signal is the input for a For Iterator or While Iterator block and you select the Inline invariant signals  option on the Optimization  pane of the Configuration Parameters dialog box, Real-Time Workshop might not honor the option setting and generate storage for some inline invariant signals.",,Simulink Coder,Other,R14SP3,31 Aug 2005
250808, Find Files Tool Results can be Incorrect with Match Case Option,"In the Find Files tool, if you search for a filename containing uppercase letters and the Match case  option is selected, no results are returned even though matching files might exist.",Clear the Match case option to find filenames that contain uppercase letters.,MATLAB,Other,R14SP3,05 Oct 2005
250779, Kinematics mode simulation of closed-loop machines: segmentation violation,Certain closed-loop mechanisms could produce a segmentation violation when simulated in Kinematics mode. This happens when the cut joint is any of the following: A Six-DoFThe Six-DoF inside a Body Spring-DamperA Custom Joint with 3 prismatic and 3 revolute primitives ,"To work around this issue, try either of the following:In a loop in Kinematics mode, choose a Joint that does not have six DoFs as the preferred cut joint.  For example, choose a Joint that is not a Bushing, Six-DoF, or a Custom Joint with 3 prismatics and 3 revolutes.Replace any Six-DoF joint with a Joint block that has fewer DoFs.",Simscape Multibody,Other,R14SP3,20 Jun 2005
250774, Forward compatibility issue with certain blocks,Modifying a model containing any of the following blocks in Simulink 6.3 will result in bad links when opening the model in previous Simulink releases:AWGN Channel Binary Symmetric Channel Multipath Rayleigh Fading Channel Rician Fading Channel Voltage-Controlled Oscillator All blocks from the AM and PM sublibraries of the Digital Baseband Modulation library  ,,Communications Blockset,Other,R14SP3,26 Nov 2019
250768, Icons are missing from Root Locus Property Editor Limit Stack,The Limits  pane of the Root Locus Property Editor contains a  Limit Stack  section. The icons are missing from the buttons within  this section.,"To use these buttons, position your mouse over each one and  a brief description of the action each button performs appears directly  below.",Control System Toolbox,Other,R14SP3,10 Jul 2007
250667, MATLAB crashes evaluating a recursive function call,"In rare cases, an expression containing a recursive function call combined with element-by-element array functions (e.g., +, -, .*) can cause MATLAB to segv.",Type 'feature accel off' at the MATLAB command prompt to disable the accelerator.,MATLAB,Other,R14SP3,21 Sep 2006
250661, realizemdl/Filter Wizard errors the first time the command is run,Filter Wizard (or the realizemdl  command) may produce an error if the Signal Processing Blockset is not installed. This error occurs if Simulink has not been previously loaded because the Integer Delay block can not be found.,Start Simulink before using the realizemdl command.,Signal Processing Toolbox,Other,R14SP3,14 Jul 2005
250647," Measurement Computing Switch and Sense 8/8, USB-SSR24, USB-SSR08, USB-ERB24, USB-ERB08, and USB-PDISO8 devices not supported","The Data Acquisition Toolbox does not support the Measurement Computing Switch and Sense 8/8, USB-SSR24, USB-SSR08, USB-ERB24, USB-ERB08, or USB-PDISO8 devices.  The complete list of supported devices is available from:https://www.mathworks.com/hardware-support/data-acquistion-software.html ","For the workaround to support these devices with the Data Acquisition Toolbox, use the following steps:  1. Copy the file     $MATLAB/toolbox/daq/daq/private/mwmcc.ini    (where $MATLAB = the MATLAB root directory on your machine) to $MATLAB/toolbox/daq/daq/private/mwmcc.ini.old  2. Use a text editor to add the following lines to the bottom of the original mwmcc.ini file: ;;;;;;;;;;;;;;;;;;;;;;;;;;;;;;;;;;;;;;;;;;[Switch and Sense 8/8]ID = 0x84Bus = USBDIOConfigurable = 0DPORTS = 2DPORT0LINES = 8DPORT0TYPE = 1DPORT0CONFIG = 0DPORT1LINES = 8DPORT1TYPE = 1DPORT1CONFIG = 1;;;;;;;;;;;;;;;;;;;;;;;;;;;;;;;;;;;;;;;;;;[USB-SSR24]ID = 0x85Bus = USBDIOConfigurable = 1DPORTS = 4DPORT0LINES = 4DPORT0TYPE = 12DPORT0CONFIG = 2DPORT1LINES = 4DPORT1TYPE = 13DPORT1CONFIG = 2DPORT2LINES = 8DPORT2TYPE = 10DPORT2CONFIG = 2DPORT3LINES = 8DPORT3TYPE = 11DPORT3CONFIG = 2;;;;;;;;;;;;;;;;;;;;;;;;;;;;;;;;;;;;;;;;;;[USB-SSR08]ID = 0x86Bus = USBDIOConfigurable = 1DPORTS = 2DPORT0LINES = 4DPORT0TYPE = 12DPORT0CONFIG = 2DPORT1LINES = 4DPORT1TYPE = 13DPORT1CONFIG = 2;;;;;;;;;;;;;;;;;;;;;;;;;;;;;;;;;;;;;;;;;;[USB-ERB24]ID = 0x8aBus = USBDIOConfigurable = 1DPORTS = 4DPORT0LINES = 4DPORT0TYPE = 12DPORT0CONFIG = 2DPORT1LINES = 4DPORT1TYPE = 13DPORT1CONFIG = 2DPORT2LINES = 8DPORT2TYPE = 10DPORT2CONFIG = 2DPORT3LINES = 8DPORT3TYPE = 11DPORT3CONFIG = 2;;;;;;;;;;;;;;;;;;;;;;;;;;;;;;;;;;;;;;;;;;[USB-ERB08]ID = 0x8bBus = USBDIOConfigurable = 1DPORTS = 2DPORT0LINES = 4DPORT0TYPE = 12DPORT0CONFIG = 2DPORT1LINES = 4DPORT1TYPE = 13DPORT1CONFIG = 2;;;;;;;;;;;;;;;;;;;;;;;;;;;;;;;;;;;;;;;;;;[USB-PDISO8]ID = 0x8cBus = USBDIOConfigurable = 0DPORTS = 2DPORT0LINES = 8DPORT0TYPE = 1DPORT0CONFIG = 0DPORT1LINES = 8DPORT1TYPE = 1DPORT1CONFIG = 13. Restart MATLAB.",Data Acquisition Toolbox,Other,R14SP3,13 Jul 2015
250547, Enable Java Figures on Macintosh,"In Bioinformatics Toolbox 2.0.1 the functions seqlogo , seqshowwords , seqshoworfs ,and showalignment  use Java based figures. Currently onthe Macintosh, Java figures are not enabled by default.","If you use these functions on a Macintosh, you should start MATLAB withmatlab -useJavaFiguresSome functionality does not work with modal windows. For example runninga Bioinformatics Toolbox demo opens a blank dialog box. A work aroundis to minimize and maximize the dialog box to force the window to refresh.",Bioinformatics Toolbox,Other,R14SP3,15 Sep 2005
250518, SimMechanics CAD translator does not work with SolidWorks 2005,"The previous version of the SolidWorks CAD translator for SimMechanics was 1.0.3.  It is compatible with SolidWorks 2003 and 2004.When used with SolidWorks 2005, this version either crashes or produces ill-formed SimMechanics models.",,Simscape Multibody,Other,R14SP3,28 Jun 2005
250429, CANdb Packing / Unpacking blocks fail to read CANdb DBC files that contain large numerical values,"When using the CANdb Packing / Unpacking blocks, CANdb DBC files that contain CANdb Signal properties, minimum, maximum, offset or factor, with values that are outside the range of a signed 32-bit integer value do not parse correctly.   An example of an out of range value is 4211081215.",,Target Support Package FM5,Other,R14SP3,09 Jun 2005
250272, Tab Completion Uses First Match Instead of Narrowing List of Possible Completions,"In previous versions of MATLAB, when you press Tab  in the Command Window to show a list of partial completions, then type additional characters and press Tab  again, MATLAB narrows the list of completions. MATLAB no longer does this but instead completes the name using the first item in the list of possible completions. The previous behavior was more convenient because you could avoid scrolling through a long list to select an item.",,MATLAB,Other,R14SP3,31 Aug 2005
250257, Dependency Report Sometimes Fails to Show Child and Parent Functions,"In some situations, when you select the Dependency Report in the Current Directory browser and select the check boxes for Show child functions  or Show parent functions , then run the report, the report does not show any parent or child functions even though they exist. This happens when you are running MATLAB using a UNC path name (that is, one that starts like this \\drive-name\dir1\dir2\ ...). ","You can still use the Dependency Report if you make sure and run MATLAB from a letter drive (that is, one that starts like this C:\Work\Ami\matlab rather than \\drive-name\dir1\dir2\ ...).",MATLAB,Other,R14SP3,15 Dec 2005
249913, mapprofile,Function mapprofile  errors if the map axes contain a surfacerendered by the function geoshow .,"If you are using a version of Mapping Toolbox prior to 2.2, use the function meshm to render the surface rather than geoshow.",Mapping Toolbox,Other,R14SP3,06 Jul 2005
249876, Atomic subsystems: incorrect code generated for Async Interrupt block,Real-Time Workshop generates incorrect code for an atomic subsystem when both of the following conditions exist: The option RTW system code  is set to Function . The subsystem contains an Async Interrupt block.  ,Determine your MATLAB root directory by entering the matlabroot command at the MATLAB command prompt.Quit MATLAB.Rename matlabroot\rtw\c\tlc\mw\commonbodlib.tlc to matlabroot\rtw\c\tlc\mw\commonbodlib.tlc.old.Rename matlabroot\rtw\c\tlc\mw\subsystemlib.tlc tomatlabroot\rtw\c\tlc\mw\subsystemlib.tlc.old.Rename matlabroot\rtw\c\tlc\mw\subsystm.tlc tomatlabroot\rtw\c\tlc\mw\subsystm.tlc.old.Download the attached files and place them in the directory matlabroot\rtw\c\tlc\mwRestart MATLAB.,Simulink Coder,Other,R14SP3,09 Aug 2011
249721, Cannot read version 1.3 GSHHS data files,An error results when using function gshhs  to readVersion 1.3 GSHHS data files. GSHHS Version 1.3 was introducedin September 2004. Data files from prior versions of GSHHSare read without error.,,Mapping Toolbox,Other,R14SP3,22 Aug 2005
249662, Stale custom code information in invisible Real-Time Workshop target causes code-generation errors,"Stale custom code information that was entered for a Stateflow simulation target was unintentionally copied to the invisible Real-Time Workshop target maintained by Stateflow. This invisible target is only an anchor for Stateflow code generation. However, Stateflow mistakenly used the custom code settings from this object, causing unexpected error messages.  ","For releases prior to R14SP3, use the attached files as follows:Download the attached zip file to your local disk and unzip it.Copy new_target.m and sf_rtw.m to the directory$MATLAB/toolbox/stateflow/stateflow/private.(where $MATLAB is the MATLAB root directory on your machine, as returned by typing matlabrootat the MATLAB command prompt.)Copy get_custom_code_settings.m to the directory$MATLAB/toolbox/stateflow/coder/private.Restart MATLAB.",Stateflow,Other,R14SP3,09 Aug 2011
249477, The -port flag does not work for startjobmanager and startworker,The -port  flag for the startjobmanager  andstartworker  scripts doesnot work in MATLAB Distributed Computing Engine.,"If you must use ports other than the defaults, you can specify the range of usable port numbers by settingvalues for the MIN_MDCE_PORT and MAX_MDCE_PORTparameters in the mdce_def.sh or mdce_def.batfile.  For more information on setting the parameters in this file,see ""Customizing Engine Services"" in the MATLAB Distributed Computing  Engine Network Administrator's Guide.",MATLAB Parallel Server,Other,R14SP3 web release,09 Mar 2007
249437, mdistort,Contour labels created by the function mdistort  are not visible.,"To work around this problem, execute the command zdatam(handlem('DISTORTMtext'),max(get(gca,'ZLim'))) ",Mapping Toolbox,Other,R14SP3,13 Jun 2005
249310, Clock enable output of FIRDECIM filters does not work correctly,The clock enable output of FIRDECIM filters does not work correctly when the Add pipeline registers  option is selected.  The input to the clock enable delay line is connected to the wrong signal.,,Filter Design HDL Coder,Other,R14SP3,01 Sep 2005
249197, Port name clashes are resolved differently in the generated filter code and testbench code,"The same name can be assigned to more than one port (via either the HDL Options  dialog or the command line property-value pairs). Filter Design HDL Coder resolves such name conflicts, ensuring that all port names are unique to produce valid HDL code. In previous releases, the way in which such unique port names were generated was not consistent between the generated HDL code and the generated test bench HDL code. This could lead to name mismatches that caused test benches to drive the generated filter HDL code incorrectly.","In general, you should be careful to use unique names for all the ports in your designs.",Filter Design HDL Coder,Other,R14SP3,01 Sep 2005
249097, Multicast fails when different users run job manager and client on same Macintosh,Running a job manager and a client as different users on the same Macintosh machine causes multicast lookups to fail.,"To work around this problem, use unicast to access the job manager running on this machine. For example,    findResource('jobmanager','LookupURL','localhost')An alternative workaround is to run the job manager and client as the same user.  To simultaneously run the Distributed Computing Toolbox and MATLAB Distributed Computing Engine entities (job managers or workers) on a single Macintosh machine:Shut down all MDCE entities on the machine with mdce stopDelete all the log and checkpoint files associated with the MDCE entities on this machine.Add a file called java.opts to the directory MATLABROOT/toolbox/distcomp/bin.Edit this new java.opts file to include the following line:-Djava.net.preferIPv4Stack=trueSave the java.opts file.Restart the MDCE services (mdce, job manager, worker) that you want running on this machine.",Parallel Computing Toolbox,Other,R14SP3,28 Sep 2005
249088, Cannot run client and worker sessions simultaneously on the same Macintosh,Running the MDCE worker and the DCT client as the same user on the same Macintosh does not work. The worker session will hang when it begins to execute tasks.,"Because of this limitation on the Macintosh, the following workaround is necessary to simultaneously run the Distributed Computing Toolbox and MATLAB Distributed Computing Engine entities (job managers or workers) on a single Macintosh machine: Shut down all MDCE entities on the machine with     mdce stopDelete all the log and checkpoint files associated with the MDCE entities on this machine.Add a file called java.opts to the directory MATLABROOT/toolbox/distcomp/bin.Edit this new java.opts file to include the following line:    -Djava.awt.headless=trueSave the java.opts file.Restart the MDCE services (mdce, job manager, worker) that you want running on this machine.",Parallel Computing Toolbox,Other,R14SP3,18 May 2005
248932, makecform errors with v.4 ICC profile,"The makecform  function, when used with the makecform('icc', SrcProfile, DstProfile)  syntax, fails for certain ICC Version 4 profiles. The error message displayed is ""Index exceeds matrix dimensions."" ","To work around this issue, replace the version of the makecform function in your current installation with the updated version in the attachment, as follows:Exit MATLAB.Make a backup copy of the following file: matlabroot/toolbox/images/images/makecform.mwhere matlabroot represents the name of your MATLAB installation directory, as returned by the matlabroot function. For example, rename the existing file, adding ""old"" to the file extension: makecform.m.OLDDownload the attached file, extract makecform.m, and store it in the directory specified in the previous step.Restart MATLAB.Run the rehash toolbox command at the MATLAB prompt.",Image Processing Toolbox,Other,R14SP3,09 Aug 2011
248897, dfilt isstable for second-order objects may give the wrong answer,The dfilt isstable  method sometimes returns the wrong answer for second-order IIR digital filter objects.,Appending a zero to the denominator fixes the problem.,Signal Processing Toolbox,Other,R14SP3,07 Jul 2005
248893, Clicking Help for SOS View Settings in FVTool generates an error,"When you click Help  for more information about the SOS View Settings in FVTool, you get an error.",,Filter Design Toolbox,Other,R14SP3,02 Jul 2005
248875, Code for Custom Code Block: when used in an atomic subsystem generated code for block can appear twice,"When you include a Custom Code block in an atomic subsystem, code for the block appears twice in the generated code if the subsystem uses an input or output port with a direct feedthrough connection. ","If you are using Real-Time Workshop R14SP2, download the attached TLC files as follows:Identify your MATLAB root directory by entering the following command at the MATLAB command prompt:matlabrootQuit MATLAB.Rename the following TLC files to filename.tlc.old, where matlabroot is your MATLAB root directory:matlabroot\rtw\c\tlc\lib\syslib.tlcmatlabroot\rtw\c\tlc\mw\hookslib.tlcmatlabroot\rtw\c\tlc\mw\opaquelib.tlcDownload the attached files to the directories indicated in step 3.Restart MATLAB.Issue the following command at the MATLAB prompt:rehash toolboxcacheIf you are using a release prior to R14SP2, there is no workaround.",Simulink Coder,Other,R14SP3,09 Aug 2011
248869, Referencing models containing Stateflow charts requires the Real-Time Workshop,Referencing a model containing a Stateflow chart in another model causes a TLC error if the Real-Time Workshop is not installed.,"For a workaround for releases that precede the fix for this problem, go to www.mathworks.com, select Support, and search for solution 1-YCPFP.",Simulink,Other,R14SP3,20 Jun 2005
248859, Data Field of memmapfile Class Cannot Return a Comma-Separated List,"The Data  field of the memmapfile  class acts similarly to a MATLAB structure if the Format  field is set to a cell array. In R14SP2, if you subscript the Data  field to try to generate a comma-separated list, you instead get back the first element of the list. For example, if you create a memmapfile  object like this in R14SP2,    m=memmapfile(FILENAME, 'format', {'double', 1, 'field1'}, ...                'repeat', 2); and then run   m.data(:).field1 MATLAB assigns only m.data(1).field1  to ans . ",,MATLAB,Other,R14SP3,19 Mar 2007
248819, createClassFromWsdl does not handle output arguments correctly,createClassFromWsdl sometimes creates an interface that returns the wrong number of output arguments.,There is no workaround.,MATLAB,Other,R14SP3,04 Oct 2005
248501, xpcserialbinarysplit.mdl does not work correctly.,"The xPC Target model, xpcserialbinarysplit.mdl , does not work correctly. The constants defining the messages that are sent do not match the constants in the receive binary header block. This prevents the messages from being decoded.  ","As a workaround, if you have a release prior to R14SP3, to send the messages that are being looked for, perform the following modifications:In the MATLAB Command Window, type xpcserialbinarysplitDouble-click the Constant block and change the Constant value parameter to [3 5 170 1]. Double-click the Constant3 block and change the Constant value parameter to [3 170 2 44]. Save and close the model to another name, for example, xpcserialbinarysplit2.mdlUse this model instead of xpcserialbinarysplit.mdl. These changes allow the associated message to be decoded.",Simulink Real-Time,Other,R14SP3,30 Aug 2005
247948," Video Input block displays corrupt strings, preventing models from being saved.","Using the Video Input block with certain image acquisition devices may lead to corrupted strings appearing in the Input Video Format field of the mask, preventing the Simulink model from being saved.",,Image Acquisition Toolbox,Other,R14SP3,12 Jul 2005
247932, Model blocks' signal labels are not propagated properly,Simulink reports the following invalid error when a signal entering a Bus Selector block originates from a Model Reference output port that is not explicitly labeled.  Selected signal 'signalLabel' in 'mdl/Bus Selector' is not part of the bus entering the Bus Selector.  ,Label the output signal of the Model block that is connected to a Bus Selector.,Simulink,Other,R14SP3,27 Dec 2005
247795, MATLAB errors on Linux when opening print dialog after printing to a file,"When running on Linux, MATLAB will print a figure to a file properly the first time, creating a postscript file. However, any subsequent attempts to print from the same figure window raises a java.lang.NullPointerException  error instead of displaying the print dialog.",,MATLAB,Other,R14SP3,16 Feb 2006
247759, Cannot use the Export dialog to export multirate filters from FDATool,You cannot use the File->Export  feature in FDATool to export multirate filters created in the multirate panel.,There are no known workarounds.,Filter Design Toolbox,Other,R14SP3,11 Jul 2005
