Bug Id,Summary,Description,Workaround,Products,Type,Fixed In,Modified Date
947016, Failure of customized Model Advisor checks using the ModelAdvisor.FormatTemplate class to report Stateflow? objects,"Customized checks can use the ModelAdvisor.FormatTemplate  class to format the analysis results. To list Stateflow objects in the report, if you directly pass Stateflow objects to the FormatTemplate  object, the check can fail. Stateflow objects are directly passed to the FormatTemplate  object using a Stateflow object as input to a FormatTemplate  method. Stateflow objects include Stateflow.Transition , Stateflow.State , Stateflow.Junction , Stateflow.Box . ? ","Installation instructionsLog in to an account with appropriate permissions to overwrite files in your MATLAB installation. On Linux systems, this is typically the root account.Locate your MATLAB installation by typing matlabroot at the MATLAB command prompt. This folder is referred to as <MATLAB> in subsequent steps.Exit MATLAB.Download the attached .zip file associated with this Bug Report and store the file in the <MATLAB> folder.Make a backup copy of each of the files listed in the .zip file. To see the contents of the .zip file: Windows Systems*: Open the .zip file and look at the contents.Linux/Macintosh Systems: Type the following in a shell (Linux) or in a terminal window (Macintosh):unzip -l <MATLAB>/<.zip file>Extract the files from the .zip file. Windows Systems*: Open the .zip file.Extract the contents of the file to your <MATLAB> folder.Linux/Macintosh Systems: Type the following in a shell (Linux) or in a terminal window (Macintosh): cd <MATLAB>unzip <.zip file>Delete the .zip file in the <MATLAB> folder.*Notes for Windows Systems:If you see ˇ°Error: Access is deniedˇ± when attempting to extract the .zip file, you may need to start WinZip in administrator mode. Do this by navigating to WinZip.exe or the WinZip Start menu entry, right-clicking on it, and selecting Run as administrator.From within WinZip, find and open the downloaded .zip file.Extract the contents of the file to your <MATLAB> folder.",Simulink Check,Other,R2013b,06 Sep 2013
946912, Integer overflow not reported for fixed-point types with nonstandard word length,"For fixed-point types with nonstandard word length (i.e. word length that is not 8-bit, 16-bit, or 32-bit), design error detection for integer overflow does not report overflow. The overflow checks for fixed-point types with nonstandard word length are silently ignored with no indication to the user. ",,Simulink Design Verifier,Other,R2013b,09 May 2014
946782, The distance function may error for antipodal points on the sphere,"When the distance  function is used to calculate the distance between certain pairs of antipodal points on a sphere, the following error is thrown:Error using atan2Inputs must be real.Error in distance>greatcircledist (line 159)a = sin((lat2-lat1)/2).^2 + cos(lat1) .* cos(lat2) .* sin((lon2-lon1)/2).^2;Error in distance (line 101)    rng = greatcircledist(lat1, lon1, lat2, lon2, ellipsoid(1));   ","Log in to an account with appropriate permissions to overwrite files in your MATLAB installation. On Linux systems, this is typically the root account.Make a backup copy of the file MATLAB/toolbox/map/map/distance.m, where MATLAB refers to the output of the matlabroot command in MATLAB.Edit distance.m, inserting the following line in the greatcircledistance subfunction, immediately after the line on which the haversine a is computed:a(a > 1) = 1;Save distance.mExit and restart MATLAB.You may need to type rehash toolbox at the command prompt to update a stale toolbox cache.",Mapping Toolbox,Other,"R2013b, R2014a",07 Mar 2014
946366," If a Stateflow chart contains unstructured control flow, code inspection may exit with a segmentation violation","If a Stateflow chart contains unstructured control flow, code inspection exits with a segmentation violation. Stateflow charts containing unstructured control flow are fatally incompatible with code inspection. If you check code inspection compatibility for a model with a Stateflow chart containing unstructured control flows, Simulink Code Inspector compability check Check usage of Stateflow charts > Check that control flows are structured  warns. ? ",,Simulink Code Inspector,Other,R2013b,20 Jan 2014
945260, Unnecessary checkout of product licenses for Accelerator and Rapid Accelerator simulation modes,"Simulation in Accelerator or Rapid Accelerator mode results in the unnecessary checkout of MATLAB Coder and/or Embedded Coder licenses if available. If the licenses are not available, simulation continues without error or warning.  ","Installation instructionsLog in to an account with appropriate permissions to overwrite files in your MATLAB installation. On Linux systems, this is typically the root account.Locate your MATLAB installation by typing matlabroot at the MATLAB command prompt. This folder is referred to as <MATLAB> in subsequent steps.Exit MATLAB.Download the attached .zip file associated with this Bug Report and store the file in the <MATLAB> folder.Make a backup copy of each of the files listed in the .zip file. To see the contents of the .zip file: Windows Systems*: Open the .zip file and look at the contents.Linux/Macintosh Systems: Type the following in a shell (Linux) or in a terminal window (Macintosh):unzip -l <MATLAB>/<.zip file>Extract the files from the .zip file. Windows Systems*: Open the .zip file.Extract the contents of the file to your <MATLAB> folder.Linux/Macintosh Systems: Type the following in a shell (Linux) or in a terminal window (Macintosh): cd <MATLAB>unzip <.zip file>Delete the .zip file in the <MATLAB> folder.*Notes for Windows Systems:If you see ˇ°Error: Access is deniedˇ± when attempting to extract the .zip file, you may need to start WinZip in administrator mode. Do this by navigating to WinZip.exe or the WinZip Start menu entry, right-clicking on it, and selecting Run as administrator.From within WinZip, find and open the downloaded .zip file.Extract the contents of the file to your <MATLAB> folder.Change log:May 15, 2013: attachment_945260_13a_2013-05-15.zip: initial version, works on R2013a",Embedded Coder,Other,R2013b,06 Sep 2013
945081," Login to MathWorks Account fails with the error message ""An error has occurred.""","After you enter your email address and password, the login fails with the error message ""An error has occurred."" with no additional information regarding the error. This happens when using a proxy to connect to the Internet with proxy settings defined in Windows Internet Explorer.",,MATLAB,Other,R2013b,13 Dec 2017
944660, Compiled code might fail if it uses some probability distribution objects,Compiled code that uses certain probability distribution objects might fail to run properly and issue the following error message: Undefined function 'dfgetdistributionsold' for input arguments of type 'char'. This might happen if the compiled code does any of the following: Creates a probability distribution by calling the ProbDistUnivParam  or ProbDistUnivKernel  functions (not by calling the makedist  function) Creates a probability distribution by defining a class that inherits from ProbDistUnivParam  Creates a custom distribution that was defined using dfittool  and the File > Define Custom Distribution  menu item in MATLAB R2012b or earlier (not using the same menu item in MATLAB R2013a)  ,"In simple cases it might be possible to include the missing file in the compilation command. For example, to compile the testcomp.m file:mcc -m -N -p stats -v testcomp.m -a private/dfgetdistributionsold.mHowever, in some cases this may reveal additional files that need to be included.Another alternative is to use the makedist function in your own code in place of the old ProbDistUnivParam function. For example, instead ofpd = ProbDistUnivParam('normal',[100 5])usepd = makedist('normal',100,5)A third alternative is to install the patch attached to this bug report, following the instructions below.Installation instructionsLog in to an account with appropriate permissions to overwrite files in your MATLAB installation. On Linux systems, this is typically the root account.Locate your MATLAB installation by typing matlabroot at the MATLAB command prompt. This folder is referred to as <MATLAB> in subsequent steps.Exit MATLAB.Download the attached .zip file associated with this Bug Report and store the file in the <MATLAB> folder.Make a backup copy of each of the files listed in the .zip file. To see the contents of the .zip file: Windows Systems*: Open the .zip file and look at the contents.Linux/Macintosh Systems: Type the following in a shell (Linux) or in a terminal window (Macintosh):unzip -l <MATLAB>/<.zip file>Extract the files from the .zip file. Windows Systems*: Open the .zip file.Extract the contents of the file to your <MATLAB> folder.Linux/Macintosh Systems: Type the following in a shell (Linux) or in a terminal window (Macintosh): cd <MATLAB>unzip <.zip file>Delete the .zip file in the <MATLAB> folder.*Notes for Windows Systems:If you see ˇ°Error: Access is deniedˇ± when attempting to extract the .zip file, you may need to start WinZip in administrator mode. Do this by navigating to WinZip.exe or the WinZip Start menu entry, right-clicking on it, and selecting Run as administrator.From within WinZip, find and open the downloaded .zip file.Extract the contents of the file to your <MATLAB> folder.Change log:March 30, 2013: attachment_944660_13a_2013-04-30.zip: added compiler hint to include missing file",Statistics and Machine Learning Toolbox,Other,R2013b,06 Sep 2013
944259, Unexpected MATLAB? termination with CTRL+C for a MEX function with an active parfor loop,"If you use CTRL+C  to terminate a MEX function during execution of a parfor-loop, MATLAB?  can stop unexpectedly. ",,MATLAB Coder,Other,R2013b,27 Nov 2013
943682, VideoReader object creation fails for some VC-1 encoded WMV files on Windows 7 and higher,"On Windows 7 and higher, the VideoReader  object creation fails for some VC-1 encoded WMV files. For example,vidObj = VideoReader('myfile.wmv');  results in the following error:Error using VideoReader/populateNumFrames (line 364)File could not be read due to an unexpected error. Reason: Error getting sample duration Reason: Unknown error 0xC00D36C9Error in VideoReader/init (line 454)                obj.populateNumFrames()Error in VideoReader (line 147)            obj.init(fileName);  ","Installation instructions       Log in to an account with appropriate permissions to overwrite files in your MATLAB installation.       Locate your MATLAB installation by typing matlabroot at the MATLAB command prompt. This folder is referred to as <MATLAB> in subsequent steps.       Exit MATLAB.       Download the attached .zip file associated with this Bug Report and store the file in the <MATLAB> folder.                     Make a backup copy of each of the files listed in the .zip file. To see the contents of the .zip file:                                    Open the .zip file and look at the contents.                                          Extract the files from the .zip file.                                                               Windows Systems*:                                                             Open the .zip file.                                  Extract the contents of the file to your <MATLAB> folder.                                                                            Delete the .zip file in the <MATLAB> folder.  *Notes for Windows Systems:      If you see ˇ°Error: Access is deniedˇ± when attempting to extract the .zip file, you  may need to start WinZip in administrator mode. Do this by navigating to  WinZip.exe or the WinZip Start menu entry, right-clicking on it, and selecting  Run as administrator.    From  within WinZip, find and open the downloaded .zip file.    Extract  the contents of the file to your <MATLAB> folder.  Change log:May 1, 2013: attachment_943682_13a_win32_2013-05-01.zip : Initial version, works only on R2013a for 32-bit WindowsMay 1, 2013: attachment_943682_13a_win64_2013-05-01.zip : Initial version, works only on R2013a for 64-bit Windows",MATLAB,Other,R2013b,06 Sep 2013
943459, Incorrect UNR check leading to an incorrect red NTC,"In very rare cases, Polyspace displays a UNR check in the middle of a function and propagates it as a red NTC check. This type of error is specific to the code being verified, so it is not possible to provide an example that reproduces the error. If you see this error, contact Technical Support. If possible, provide the source code and the verification log. ","Installation instructions for Polyspace server R2012bLog in to an account with appropriate permissions to overwrite files in your Polyspace installation. On Linux systems, this is typically the root account.Locate your Polyspace installation. By default this is in c:\Polyspace or in /usr/local/Polyspace on Linux systems. This folder is referred to as <POLYSPACE> in subsequent steps. Polyspace_Common and PolyspaceFor<lang>_R2012b are the two principal sub-folders of <POLYSPACE>.Stop Polyspace queue manager service.Download the attached .zip files (split archive) associated with this Bug Report and store the file in the <POLYSPACE> folder.Each file with a *_z0x.zip and *_zip.zip suffix have to be unzipped independently and renamed as *.z0x and *.zipMake a backup copy of each of the files listed in the .zip file. To see the contents of the .zip file: Windows Systems: Open the .zip file and look at the contents.Linux Systems: Type the following in a shell:unzip -l <POLYSPACE>/<.zip file>Extract the files from the .zip file. Windows Systems: Open the .zip file.Extract the contents of the file to your <POLYSPACE> folder.Linux Systems: Type the following in a shell: cd <POLYSPACE>unzip <.zip file>Check that binaries have appropriate ˇ®read &amp; executeˇŻ permissions.Delete the .zip file in the <POLYSPACE> folder.Restart Polyspace queue manager service.",Polyspace Code Prover,Other,R2013b,06 Sep 2013
943182, Code generation error with variant subsystems using Simulink.Variant objects.,Code generation error observed when Variant Subsystem block uses Simulink.Variant object as: hasRainSensor = Simulink.Variant('Rte_SysCon_hasRainSensor') not_hasRainSensor = Simulink.Variant('~Rte_SysCon_hasRainSensor') This issue is seen from R2012a to R2013a. It is fixed in R2013b. ,Use Simulink.Variant objects with conditions as:hasRainSensor = Simulink.Variant('Rte_SysCon_hasRainSensor == 1') not_hasRainSensor = Simulink.Variant('Rte_SysCon_hasRainSensor ~= 1'),Embedded Coder,Other,R2013b,06 Sep 2013
943015, Incorrect Code Generation: Incorrect output initialization code generated for an Assignment block with constant sample time when it is inside a For/While-Iterator subsystem,"Simulink generates incorrect output initialization code in the model output function for an Assignment block in a Simulink model if both of the following conditions are satisfied: The Assignment block has a constant sample time. The Assignment block is inside a For/While-Iterator subsystem.  In such a scenario, the Assignment block output is first assigned in the model initialize function. It is additionally re-initialized incorrectly in the model output function. To check whether this issue affects your model, run the DetectForBugReport943015.p  script. See the Workaround section below for details. ? ","Download and unzip the attached attachment_943015_R13b_20130516.zip script to a folder and add the folder to the MATLAB path using the addpath command. Run the script on your model, using the following syntax:ret = DetectForBugReport943015('modelname')For a model that is unaffected by this issue, the script returns an empty array. If this issue impacts your model, the script returns an array of structures with the following fields:AssignmentBlock: An Assignment block which has constant sample time and is inside a For/While-Iterator subsystem.IteratorSubsystem: The For/While-Iterator subsystem which contains the above Assignment blockTo work around this issue, move the Assignment block identified and all of its source blocks outside the corresponding For/While-Iterator subsystem. See example example_943015.mdl and example_943015_workaround.mdl in the zip file.",Simulink,Incorrect Code Generation,R2013b,05 Dec 2013
942102," PID Tuner window does not fit screen, and cannot be resized","At certain monitor resolution and DPI settings, the PID Tuner window might not fit the computer screen. When this happens, a portion of the PID Tuner window is not accessible. Additionally, the window size cannot be reduced manually. ","Installation instructionsLog in to an account with appropriate permissions to overwrite files in your MATLAB installation. On Linux systems, this is typically the root account.Locate your MATLAB installation by typing matlabroot at the MATLAB command prompt. This folder is referred to as <MATLAB> in subsequent steps.Exit MATLAB.Download the attached .zip file associated with this Bug Report and store the file in the <MATLAB> folder.Make a backup copy of each of the files listed in the .zip file. To see the contents of the .zip file: Windows Systems*: Open the .zip file and look at the contents.Linux/Macintosh Systems: Type the following in a shell (Linux) or in a terminal window (Macintosh):unzip -l <MATLAB>/<.zip file>Extract the files from the .zip file. Windows Systems*: Open the .zip file.Extract the contents of the file to your <MATLAB> folder.Linux/Macintosh Systems: Type the following in a shell (Linux) or in a terminal window (Macintosh): cd <MATLAB>unzip <.zip file>Delete the .zip file in the <MATLAB> folder.*Notes for Windows Systems:If you see ˇ°Error: Access is deniedˇ± when attempting to extract the .zip file, you may need to start WinZip in administrator mode. Do this by navigating to WinZip.exe or the WinZip Start menu entry, right-clicking on it, and selecting Run as administrator.From within WinZip, find and open the downloaded .zip file.Extract the contents of the file to your <MATLAB> folder.",Simulink Control Design,Other,R2013b,06 Sep 2013
941784, MATLAB crashes when dragging a MATLAB Function block from the Library Browser into a Simulink function inside a Stateflow chart,"When you drag a MATLAB Function block from the Simulink Library Browser into a Simulink function contained by a Stateflow chart, MATLAB crashes. ","Use one of the following workarounds:Insert the MATLAB Function block into the Simulink function. Selecting the MATLAB function block and in the Library Browser, select Edit > Add Selected Block (or press Ctrl+I).Drag the MATLAB Function block into an empty Simulink model, then drag the block from the model into the Simulink function.In the MATLAB Command Window, use the add_block function to insert the MATLAB function block. For example:       add_block('simulink/User-Defined Functions/MATLAB Function','/path/to/chart/Simulink Function/Inserted Function Block Name')",Simulink,Other,R2013b,06 Sep 2013
941778, Incorrect red NIP check for partially initialized array of pointers,"Consider the following code where an array is partially initialized: int init_array(void) {  int var0=0, var1=1, var2=2;   int *myarray[5] = { &amp;var0, &amp;var1, &amp;var2 }; /* Array is partially initialized */    *myarray[2] = 5;    /* Array element 3 is initialized and points to var2 */  return *myarray[3]; /* NIP should not be red */} All elements of myarray  are initialized. Note that the elements myarray[3]  and myarray[4]  are initialized to 0. The verification should highlight the dereferencing of a NULL pointer with a red IDP check. However, the verification generates a red NIP check on myarray[3] , which is incorrect.  ",,Polyspace Code Prover,Other,R2013b,06 Sep 2013
941680, VideoReader does not detect frames in some H.264 video files on Ubuntu? 12.04,"If you create a VideoReader  object to read an H.264 video file, the object reports that the file contains 0 frames. For example,vidObj = VideoReader('test.mp4')  results in the following output:Summary of Multimedia Reader Object for 'test.mp4'.   Video Parameters:   0x0.                      0 total video frames available.   This issue exists only on Ubuntu? 12.04. ","Installation instructions       Log in to an account with appropriate permissions to overwrite files in your MATLAB installation. On Linux systems, this is typically the root account.       Locate your MATLAB installation by typing matlabroot at the MATLAB command prompt. This folder is referred to as <MATLAB> in subsequent steps.       Exit MATLAB.       Download the attached .zip file associated with this Bug Report and store the file in the <MATLAB> folder.                     Make a backup copy of each of the files listed in the .zip file. To see the contents of the .zip file:                                    Linux Systems: Type the following in a shell (Linux):unzip -l <MATLAB>/<.zip file>                                          Extract the files from the .zip file.                                                               Linux Systems: Type the following in a shell (Linux):                            cd <MATLAB>unzip <.zip file>                                                 Delete the .zip file in the <MATLAB> folder.Change log:Apr 23, 2013: attachment_941680_13a_glnxa64_2013-04-23.zip : Initial version, works only on R2013a for 64-bit Linux",MATLAB,Other,R2013b,06 Sep 2013
941382, Simulink export to previous version overwrites the Goto tags on Goto/From blocks.,"Customizing the Goto tag on Goto/From blocks and exporting a model with these blocks to R2007b will result in a loss of the customized Goto tag.  The Goto tags on Goto/From blocks are replaced by the default setting ""A"" when exporting to any formats earlier than the R2008a Simulink model file format.","Installation instructions       Log in to an account with appropriate permissions to overwrite files in your MATLAB installation. On Linux systems, this is typically the root account.       Locate your MATLAB installation by typing matlabroot at the MATLAB command prompt. This folder is referred to as <MATLAB> in subsequent steps.       Exit MATLAB.       Download the attached .zip file associated with this Bug Report and store the file in the <MATLAB> folder.                     Make a backup copy of each of the files listed in the .zip file. To see the contents of the .zip file:                                    Windows Systems*: Open the .zip file and look at the contents.                     Linux/Macintosh Systems: Type the following in a shell (Linux) or in a terminal window (Macintosh):unzip -l <MATLAB>/<.zip file>                                          Extract the files from the .zip file.                                                               Windows Systems*:                                                             Open the .zip file.                                  Extract the contents of the file to your <MATLAB> folder.                                                                                                Linux/Macintosh Systems: Type the following in a shell (Linux) or in a terminal window (Macintosh):                            cd <MATLAB>unzip <.zip file>                                                 Delete the .zip file in the <MATLAB> folder.       Run the following MATLAB commands to reset your installation:>> rehash toolboxcache; restoredefaultpath;   *Notes for Windows Systems:      If you see ˇ°Error: Access is deniedˇ± when attempting to extract the .zip file, you  may need to start WinZip in administrator mode. Do this by navigating to  WinZip.exe or the WinZip Start menu entry, right-clicking on it, and selecting  Run as administrator.    From  within WinZip, find and open the downloaded .zip file.    Extract  the contents of the file to your <MATLAB> folder.  ",Simulink,Other,R2013b,06 Sep 2013
940804, Setting for GRT model option Generate reusable code is not preserved,"If you perform the following actions on a model, the value of the model option Generate reusable code  is not preserved: Open a new or existing model, and open the Configuration Parameters dialog box. On the Code Generation  pane, set the System target file  parameter to grt.tlc . On the Code Generation > Interface  pane, select the Generate reusable code  option. Apply changes. Close the model. Reopen the model.  When you reopen the model, the Generate reusable code  option is no longer selected. ",,Simulink Coder,Other,R2013b,06 Sep 2013
939358, Upgrade Advisor issues a warning when Check model for block upgrade issues check is run on a Simulink model with a Stateflow chart under certain conditions,A warning message is issued by Upgrade Advisor when Check model for block upgrade issues  check is run on a model with a Stateflow chart having the following settings Has 2 or 3 input ports and 2 output ports Mask  parameter is off  Link Status  parameter is none   ,,Simulink,Other,R2013b,26 Jun 2014
939203, Stop button on toolbar can become unusable after you restore or propagate library links,"If you restore or propagate changes to a library linked block while any system inside that block is currently open in a Simulink Editor, then when you start a simulation, the toolbar buttons do not reflect the correct state. Most noticeably, you cannot use the Stop  button. ","To address this issue:1. Stop the simulation. Either use the Simulation > Stop menu option or at the MATLAB command line, enter:      set_param(modelname,'SimulationCommand','stop')2. Close the model window and reopen it.",Simulink,Other,R2013b,06 Sep 2013
