Bug Id,Summary,Description,Workaround,Products,Type,Fixed In,Modified Date
677110, solve errors when called for some systems that contains trigonometric functions and real variables.,"The solve  command errors when called with some systems having trigonometric functions and real variables: >> syms p1 p2 p3 y1 y2 y3 real>> S=solve('p1-y1','p2-y2','p3-sin(y3)','y1','y2','y3')??? Error using ==> mupadmex Error in MuPAD command: Index exceeds matrix dimensions. ","Call the MuPAD symbolic engine directly. For example,>> S = evalin(symengine,'solve([p1-y1,p2-y2,p3-sin(y3)],[y1,y2,y3])')",Symbolic Math Toolbox,Other,R2011a,07 Apr 2011
677080, Running an ASP.NET application using a MATLAB Builder NE assembly crashes when deployed to IIS 6 or later,"A MATLAB function is compiled into a .NET Assembly and is used in an ASP.NET Web application. The web application works without any issues on the ASP.NET Development Server (shipped with Microsoft Visual Studio). However, when deployed to an IIS 6 or later version server it causes the Application Pool to crash. In the system log the following message is seen: A process serving application pool 'DefaultAppPool' suffered a fatal communication error with the Windows Process Activation Service. The process id was 'XXXX'. The data field contains the error number. In the %SystemRoot%\Temp  directory there is a Java crash log (hs_errXXXX.pid ) containing the following: Stack: [0x061b0000,0x069b0000],  sp=0x069a84d0,  free space=8161kNative frames: (J=compiled Java code, j=interpreted, Vv=VM code, C=native code)C  [kernel32.dll+0x3fbae]C  [MSVCR80.dll+0x28e89]C  [libmx.dll+0x16cdf]C  [libmx.dll+0x17928]C  [libmwservices.dll+0x9d83e]C  [libmwservices.dll+0xa66d]C  0x7b65167dj  com.mathworks.services.Prefs.nativeGetPreferencesDirectory()Ljava/lang/String;+0j  com.mathworks.services.Prefs.getPropertyDirectory()Ljava/lang/String;+0j  com.mathworks.services.Prefs.load()V+15j  com.mathworks.services.Prefs.<clinit()>V+64v  ~StubRoutines::call_stub By default, an Application Pool runs under the ""NetworkService"" ID which does not have write access to the %UserProfile%  folder. This bug is due to the MCR trying to create a default MATLAB preference directory under %UserProfile%  if the preference directory is missing, causing a segmentation violation. ","To work around the issue, do either of the following:Create an environment variable named MATLAB_PREFDIR. Set the variable to a folder with write access to NETWORK SERVICE.Create a new Application Pool that runs under the ""LocalSystem"" Identity (found in the Advanced Settings dialog of the Application Pool). Configure your application to use this Application Pool (found in the Basic Settings dialog of your Application).",MATLAB Builder NE,Other,R2011a,13 Feb 2012
676735," Simulink manifest comparison can give the wrong answer if ""Include subfolders"" is not checked.","Manifest comparisons can incorrectly report that a folder does not have changes if the option to ""Include subfolders"" is not selected and the manifests refer to files within subfolders of the project root.","To avoid this problem, always select the ""Include subfolders"" check box when comparing Simulink manifests.",Simulink,Other,R2011a,09 May 2011
676450, Incorrect mask prompts and values for some masks containing Japanese characters,"When loading some masked blocks, the mask prompt strings and values may display incorrectly. The problem occurs only when the last character in a prompt or value is a Japanese character. Not all Japanese characters cause this problem. Instead of displaying one prompt string for each dialog entry, the mask displays two or more strings for the same entry, separated by pipe characters (""|""), and later entries are misaligned. Entries at the end of the mask dialog may display a placeholder string, e.g. ""Mask Parameter 5"". Similar problems can occur with the values in the mask dialog if they contain Japanese characters. ","To avoid this problem, make sure you include an ASCII character at the end of each prompt and value string. For example, you can add a space character at the end of each prompt or value.",Simulink,Other,"R2010bSP1, R2011a",07 Apr 2011
676307, Changing the data type of a structure field in the property of a Simulink data object may be ignored.?,"If you change the property of a Simulink data object that contains a structure by changing only the data type of a structure field, the change is ignored. To apply a data type change, you must also change the value of the structure field at the same time. Consider the following example. a = Simulink.Parameter; a.Value = struct('field1', 1, 'field2', 2);a.Value.field1 = int8(1); The data type of field1  is still double , despite the explicit change to int8 . ",Use one of the following approaches:Clear the structure field before setting a field valueReset the entire structure instead of setting an individual field value,Simulink,Other,R2011a,25 Apr 2011
676211, Incorrect scheduling of exported functions during PIL block simulations,"Incorrect scheduling of exported functions during PIL block simulations can lead to incorrect simulation results or the following error: ??? Caused by:  Unexpected or internal error encountered in ""slOneSimStep"". Please report this to The  MathWorks if you can cause it to recur When this error occurs, you must restart MATLAB. This bug affects exported functions that are configured for the ert.tlc and autosar.tlc system target files. ","Installation instructionsLog in to an account with appropriate permissions to overwrite files in your MATLAB installation. On Linux systems, this is typically the root account.Locate your MATLAB installation by typing matlabroot at the MATLAB command prompt. This folder is referred to as <MATLAB> in subsequent steps.Exit MATLAB.Download the attached .zip file associated with this Bug Report and store the file in the <MATLAB> folder.Make a backup copy of each of the files listed in the .zip file. To see the contents of the .zip file: Windows Systems: Open the .zip file and look at the contents.Linux/Macintosh Systems: Type the following in a shell (Linux) or in a terminal window (Macintosh):unzip -l <MATLAB>/<.zip file>Extract the files from the .zip file. Windows Systems: Open the .zip file.Extract the contents of the file to your <MATLAB> folder.Linux/Macintosh Systems: Type the following in a shell (Linux) or in a terminal window (Macintosh): cd <MATLAB>unzip <.zip file>Delete the .zip file in the <MATLAB> folder.Change log:October 25, 2010: attachment_676211_10b_2010-10-25.zip: initial version",Embedded Coder,Other,R2011a,07 Apr 2011
676200, National Instruments PCI-6221 37-pin driver maps counter and encoder I/O to incorrect pins,"The National Instruments PCI-6221 37-pin driver maps counter and encoder inputs and outputs to the same pins as the PCI-6221 68-pin version. However, the 37-pin version does not have all these pins available, causing the National Instruments PCI-6221 37-pin driver counter and encoder to be partially unusable. ","As a workaround:Log into your computer using an account with Administrator privileges.Look at the list of available workaround files. These files are named according to the release they support.Select and download the appropriate workaround file for your release.Locate the downloaded file - this directory is referred to as <DOWNLOAD> in subsequent steps.Type matlabroot to locate your MATLAB installation - this directory is referred to as <MATLABROOT> in subsequent steps.Exit MATLAB.Navigate to <DOWNLOAD> and open the downloaded file.Extract the contents of the file to <MATLABROOT>.Restart MATLAB.October 21, 2010: attachment_676200_9a_win32_2010-10-21.zip: initial version, works on R2009a onlyOctober 21, 2010: attachment_676200_9b_win32_2010-10-21.zip: initial version, works on R2009b onlyOctober 21, 2010: attachment_676200_10a_win32_2010-10-21.zip: initial version, works on R2010a onlyOctober 21, 2010: attachment_676200_10b_win32_2010-10-21.zip: initial version, works on R2010b only?",Simulink Desktop Real-Time,Other,R2011a,07 Apr 2011
675897," C/C++ builds using emlc command might fail on Linux systems if ""."" is not on the system path","Depending on the shell used on Linux systems, the emlc  command might fail when generating C/C++ code with a message indicating that the file mexopts.sh  cannot be found. ","First workaround:Ensure that ""."" is in the path before invoking MATLAB and using the emlc command.Second workaround:Backup toolbox/emlcoder/emlcoder/private/EmitMakefile.pReplace this file with the EmitMakefile.p file contained in the attachment.Restart MATLAB.Depending on your preference settings, you might also need to run the rehash command to refresh the toolbox cache.",Simulink,Other,R2011a,09 Aug 2011
675894, Incorrect Code Generation: Incorrect reuse of function-call initiator blocks,"Code generation might incorrectly reuse two or more function-call initiator blocks under all of the following conditions: The inputs or outports of the function-call subsystem must connect to the function-call initiator block The function-call subsystem blocks, called by the function-call initiator blocks, must be identical The function-call initiator block must also be identical The input or output connectivity of those function-call initiator and function-call subsystem pairs do not match  The function-call initiator can be a S-Function block, Subsystem block, MATLAB block, or Stateflow chart. The attached model minvalid_fcn_call_reuse.mdl  is an example of this modeling pattern. In this example, the function-call initiator block is a Stateflow chart. ","Download the attached zip file and extract the P-code MATLAB script findInvalidCodeReuse.p. To determine if the model might produce this failure, execute this p-script with the model name as an argument. For example,>> invalidReuse = findInvalidCodeReuse('minvalid_fcn_call_reuse')returns a structured cell array of size one, that contains two block handles indicating invalid code reuse. You can locate these subsystems using the hilite_system command. For example,>> hilite_system(invalidReuse{1}.blkHdls)highlights blocks that might be incorrectly reused in the generated code.To work around this problem, for each of the highlighted blocks, open the Subsystem Block Parameter dialog box. On the Code Generation pane, set the Function packaging parameter to either Inline or Function.",Simulink,Incorrect Code Generation,"R2010bSP1, R2011a",09 Aug 2011
675888, Model update may fail if a bus object with complex bus elements is specified for an Outport block,"You may receive an error similar to the following if all the conditions listed below exist: Complex signal mismatch. Input port 1 of 'modelname/Subsystem/Out1' expects a signal of numeric type real. However, it is driven by a signal of numeric type complex. At model update time, you may receive a message similar to this if all  of these conditions are true:  The Outport block specifies a bus object for its data type. The bus object has at least one complex bus element. The incoming bus is virtual.  ",You can use either of these two workarounds: Remove the bus object specification from the Outport block dialog box.Use a non-virtual bus.,Simulink,Other,"R2010bSP1, R2011a",12 Apr 2011
675832, Cannot close the Coverage/Informer Help window,"After selecting the Coverage for this model  check box in the Coverage Settings dialog and running a simulation, a Coverage Report window and a Coverage window opens. The Coverage window does not have minimize, maximize and close buttons. ","Select the Coverage Display Window,and then use the keyboard shortcut ALT-F4 to close the window.  ",Simulink,Other,R2011a,07 Apr 2011
675815, Neural network not compiling,"Compiled code is not able to load a saved neural network object, but generates an error like this: Warning: An error occurred when running a class's loadobj method. The object that was loaded from the MAT-file was a copy of the object before the loadobj method was run. The rest of the variables were also loaded from the MAT-file. ",,Deep Learning Toolbox,Other,R2011a,10 Aug 2011
675812, Accelerator mode simulation might use the wrong MEX-file if a custom Simulation cache folder is configured,"When the Simulink preference Simulation cache folder  (CacheFolder ) is set to a folder other than the current working folder (pwd ), Accelerator mode simulation might use a potentially stale model_acc.mexext   from pwd , if one exists, rather than a current version created by target code generation in the cache folder. This could lead to silent wrong answers, crashes, or internal errors. ","To work around this bug, cd to a folder that does not contain any MEX-files before simulating in Accelerator mode.",Simulink Coder,Other,R2011a,26 Mar 2012
675772," When importing large results files, an ""out of memory"" problem occurs","When importing large results files, a scaling issue can occur, leading to an ""out of memory"" problem. The ""import review"" process may lead to scaling problems when large files are part of the verification. ","The attached file contains a patch. This patch includes fixes for the following issues:Error '@FFT: color of comment is different' when importing"" comments Error '@FFT: Unable to find the source file <source.h>' when importing commentsError '@FFT: Try to access line <line>' when importing comments Review information not displayed after import until package is parsed Automatic comments import does not justify the same line of codeWhen importing results, a scaling issue can occur for big files, leading to an ""out of memory"" problem ??",Polyspace Code Prover,Other,R2011a,06 Jun 2011
675709," SIL simulation with BullseyeCoverage does not produce link to HTML code generation report if Windows is configured for certain Regional and Language Options, for example, Korean.","To find out whether you have this problem: Open a model, for example,  rtwdemo_sil_topmodel . Ensure the model is configured to run in the software-in-the-loop (SIL) simulation mode. Through the Configuration Parameters > Code Generation > SIL and PIL Verification  pane, configure the model to use the BullseyeCoverage code coverage tool. Run a simulation.  At the end of the simulation, you should see a hyperlink in the MATLAB command window that allows you to open the HTML code generation report (which includes code coverage annotations). However, for certain regional settings and tool versions of BullseyeCoverage, the software may generate an error. For example: [Fatal Error] tp3554ab8a_616e_4f03_bef6_2a78f21f984b:3:102: Invalid byte 1 of 1-byte UTF-8 sequence. ? ","To work around the issue, update your version of BullseyeCoverage to 7.14.23 or later.?",Embedded Coder,Other,R2011a,09 May 2011
675606, STL files generated with SimMechanics Link from Autodesk Inventor 2011 with incorrect units,"When you generate a SimMechanics XML file from Autodesk Inventor 2011 with SimMechanics Link, the associated exported STL files save their data in centimeters (cm), irrespective of the assembly unit. The wrong unit in the STL files results in wrong SimMechanics visualization from the model generated from the XML file. ",Please contact MathWorks technical support for a patch for this problem.https://www.mathworks.com/support/contact_us.html,Simscape Multibody,Other,R2011a,07 Apr 2011
675333, Precision provided by function worldfilewrite is fixed at 8 decimal digits,"The precision provided by function worldfilewrite  is fixed at 8 decimal digits to the right of the decimal place. This amounts to specifying the center of the first pixel or grid cell to within 1/100 of a micron when working in meters or slightly over 1 millimeter when working in degrees (on planet Earth). But for the position of the pixel or grid cell diagonally opposite the first, in an M-by-N image or grid, the precision is decreased by a multiple of M or N. M and N could easily be on the order of 10^4, resulting in a loss of up to 10 cm precision when working in degrees, for example. Just how much loss actually occurs in a given situation depends also on whether or not the specific pixel/cell sizes are ""round"" numbers that can be represented exactly in the floating point set. This loss of precision does not always occur, and is not critical when it does, but it is unnecessary and it can affect computed latitude-longitude (or map x-y) limits that would otherwise come out to be round numbers. You may also find that if you export a referencing matrix to a world file and then import it back into MATLAB via worldfileread , the result returned by worldfileread  may differ from your original referencing matrix. ","If you encounter this problem in any release through R2010b, you can modify your installed version of worldfilewrite.m as follows:Exit MATLAB.Make a backup copy of the following file:matlabroot/toolbox/map/mapformats/worldfilewrite.mwhere matlabroot represents the name of your MATLAB installation directory, as returned by the matlabroot function. For example, rename the existing file, adding ""old"" to the file extension: worldfilewrite.m.oldEdit the format string in the following line, replacing ""8"" with a larger value:fprintf(fid, '%20.8f\n', W);Restart MATLAB.Run the rehash toolbox command at the MATLAB prompt. ?Alternatively, you can incorporate the more adaptive approach described in the article How Many Digits to Write? in the blog Loren on the Art of MATLAB.",Mapping Toolbox,Other,R2011a,07 Apr 2011
675232, Incorrect Code Generation: parameter represented in generated code in extern declaration instead of with #define macro,"If all of the following conditions exist, the code generator declares a parameter as an extern  instead of with a #define  macro: Parameter is defined with a custom storage class (type Define (Custom) ) In the model Configuration Parameters dialog box, Code Generation > Code Placement  > Data declaration  is set to Data declared in source file  In the model Configuration Parameters dialog box, Code Generation > SIL and PIL Verification > Create block  is set to SIL   When you compile the generated code, the invalid declaration statement causes a compilation error. ",Define the parameter as an MPT parameter object.Configure the model such that the code generator places the #define statement in the header file that you specify with Code Generation > Code Placement > Data declaration filename.,Embedded Coder,Incorrect Code Generation,R2011a,07 Apr 2011
675216, Models with non-inlined S-functions fail the Simulink Design Verifier compatibility check.,"When you run a Simulink Design Verifier analysis on a model that contains S-functions and you enable automatic stubbing, instances of S-functions should be stubbed so that partial results can be generated. If the model includes a non-inlined S-function, stubbing cannot be performed. The software indicates that model is incompatible with Simulink Design Verifier, and no results are generated. When you encounter this problem, the following error message displays: Block $BLOCKPATH$ is a non-inlined s-function, which is not supported with the current configuration. Consider selecting the support 'non-inlined s-functions' option on the Configuration Parameters > Code Generation > Interface pane ? ? ? ",,Simulink Design Verifier,Other,R2011a,07 Apr 2011
675173, MATLAB Function blocks (formerly Embedded MATLAB Function blocks) cause simulation failures if they contain bus objects using enumerations defined in external header files,"Simulink models containing MATLAB Function blocks or MATLAB functions in Stateflow charts fail to simulate if all of the following conditions exist: Stateflow or MATLAB Function block has bus data or signals Associated bus object contains enumeration fields Bus object and enumeration specify custom header files, i.e., are defined in custom header files  The error message is: enumType ~= enumType ? ",,MATLAB Coder,Other,R2011a,14 Sep 2011
675127, daysadd does not return the correct answer when the input basis value is 13 (BUS/252).,Calculating daysadd  with a basis value of 13 gives an answer of 0. ,,Financial Toolbox,Other,R2011a,09 Aug 2011
675120, Output/Update methods for Simulink subsystems are not merged as expected in generated Structured Text code,"In the generated Structured Text code from Simulink subsystems, the coder generates code for Output and Update methods in separate case statements instead of one case statement. This is a minor readability issue and has negligible affect on efficiency or code-correctness. ",Installation instructionsLog in to an account with appropriate permissions to overwrite files in your MATLAB installation.Locate your MATLAB installation by typing matlabroot at the MATLAB command prompt. This folder is referred to as <MATLAB> in subsequent steps.Exit MATLAB.Download the attached .zip file associated with this Bug Report and store the file in the <MATLAB> folder.Make a backup copy of each of the files listed in the .zip file. To see the contents of the .zip file: Open the .zip file and look at the contents.Extract the files from the .zip file. Open the .zip file.Extract the contents of the file to your <MATLAB> folder.Delete the .zip file in the <MATLAB> folder.,Simulink PLC Coder,Other,R2011a,07 Apr 2011
675032, Incorrect Code Generation: Code generator can produce incorrect code or a segmentation violation for data defined as an alias type for Simulink.StructType,"The code generator can produce incorrect code (more or less padding than expected) or a segmentation viloation when using data defined as an alias type for Simulink.StructType . This bug also affects accelerated simulation targets. This bug does not  affect Simulink.Bus  types, because Simulink does not support alias types for Simulink.Bus .  ","Define data to use a Simulink.StructType directly, instead of using an alias for Simulink.StructType.",Simulink,Incorrect Code Generation,"R2010bSP1, R2011a",07 Apr 2011
675031, MATLAB crashes at model closing time,"If you have a Simulink model containing a SimPowerSystems subsystem that is linked to a library block, closing the model might trigger a seg-v, with the Stack Trace referring to a failed assertion in .\utils\object.cpp and in stateflow.dl. ",,Simscape Electrical,Other,R2011a,28 Nov 2011
674979, Real-Time Workshop Embedded Coder optimization does not use specified minimum and maximum values for Data Store Memory and some other Simulink blocks with state identifiers.,"The code generation optimization based on specified minimum and maximum values does not take into account the minimum and maximum values specified for Data Store Memory blocks. The optimization should use these values whenever corresponding Data Store Read blocks exist in the model. This issue also affects other blocks, such as Unit Delay and Discrete-Time Integrator, that have state identifiers. For these blocks, if the state identifier is specified as a variable that resolves to a Simulink.Signal object, the optimization does not use the minimum and maximum values specified for the Simulink.Signal object. ","The workaround for the Data Store Memory block issue is to add a Signal Specification block with the desired minimum and maximum values downstream from each Data Store Read block.In the attached model, the first subsystem does not use this workaround, and therefore generates code for the relational operator. The second subsystem does use the workaround so it optimizes the code, simply setting the output to true.void mDSM_workaround_step(void){ Out_Missed_Optimization = (3 * In1 <= (int8_T)(5 * mDSM_workaround_DWork.A)); Out_Workaround = TRUE;}",Embedded Coder,Other,R2011a,09 Aug 2011
674857," When using a path in the addheader option to loadlibrary,   the directory delimiter and case of the file name must match that used by the C compiler.","If a path is specified to a header file in an addheader  statement, then the directory delimiter must match that used in line statements that are placed into the preprocessed header file by the C pre-processor. MATLAB always ignores the file extension. The Microsoft compilers use the C escape for a backslash in the header path. For example: ""C:\\dir\\anotherdir\\headerfile""  ? ",Do not specify a path in addheader arguments to loadlibrary. The only case for using a path is to differentiate between two header files with the same name in different directories.,MATLAB,Other,R2011a,07 Apr 2011
674649," PolySpace verification stops during 'Software Safety Analysis Level 1' with the message ""@FFT: illegal call to <package.procedure>, #actuals=<nb_actuals>, #formals=<nb_formals>.""","When launching PolySpace verification on Ada code, the verification stops with the following message in the log file: * Software Safety Analysis Level 1 ...  ----------------------------------------------------------------------@FFT: illegal call to <package.procedure>, #actuals=<nb_actuals>, #formals=<nb_formals>|An internal consistency problem has been detected.|In order to avoid generating incomplete verification information,|the computation has been halted.|...----------------------------------------------------------------------FATAL ERROR while processing <package>.dfaexception Failure(Failure) raised.  Note  that error has nothing to do with <package.proecdure> . The reason for the error is code-specific, so there is no easy workaround. If you experience this error, send the affected code to customer support. We will investigate the problem and provide a workaround, if possible. ",,Polyspace Server for Ada,Other,R2011a,07 Apr 2011
