Bug Id,Summary,Description,Workaround,Products,Type,Fixed In,Modified Date
694056, Requesting the edit-time signal hierarchy crashes MATLAB if a block with a broken link exists upstream,"When you request the edit-time signal hierarchy for a signal, if a broken link block exists upstream on the path of a signal, then MATLAB crashes instead of producing an error message. You can request edit-time signal hierarchy either by opening the Bus Creator, Bus Selector, or Bus Assignment block dialog, or by calling the get_param  method on a port handle, using the SignalHierarchy  property. ","Update your model. During the update process, Simulink reports broken links as an error.Resolve the broken link.Request the edit-time signal hierarchy.",Simulink,Other,"R2010bSP1, R2011a",12 Apr 2011
693982," Broken ""What's this?"" help for IDE Link parameters in Model Explorer","In Model Explorer, if you right-click any of the IDE Link parameters and select ""What's This?"", instead of displaying the help topic, the software generates the following error message: ??? Error using ==> helpview at 200Specified topic id (Tag_ConfigSet_Target_buildFormat) does not exist in map file\\mathworks\devel\jobarchive\Adoc\latest_pass\matlab\help\toolbox\rtw\csh\configparams\Simulink.ConfigSet@Tag_ConfigSet_RTW_General_Panel.map.  ","Two approaches are available to get more information about a specific parameter:You can search the Product Help for the parameter name.Instead of using Model Explorer, you can use ""What's This?"" for the same parameter in the Configuration Parameters.",Embedded Coder,Other,R2011a,08 Apr 2011
693862, Tiff object errors out when reading images with ImageDepth tag.,"The Tiff object will error out when the read  method is used on images with the ImageDepth tag.  While not commom, images with this tag are supported by libtiff.","Installation instructions?????? Log in to an account with appropriate permissions to overwrite files in your MATLAB installation. On Linux systems, this is typically the root account.?????? Locate your MATLAB installation by typing matlabroot at the MATLAB command prompt. This folder is referred to as <MATLAB> in subsequent steps.?????? Exit MATLAB.?????? Download the attached .zip file associated with this Bug Report and store the file in the <MATLAB> folder.?????? Make a backup copy of each of the files listed in the .zip file. To see the contents of the .zip file: ????????????? ???????????????????? Windows Systems: Open the .zip file and look at the contents.???????????????????? Linux/Macintosh Systems: Type the following in a shell (Linux) or in a terminal window (Macintosh):unzip -l <MATLAB>/<.zip file>????????????? ?????? ?????? Extract the files from the .zip file. ????????????? ???????????????????? Windows Systems:?????????????????????????? ????????????????????????????????? Open the .zip file.????????????????????????????????? Extract the contents of the file to your <MATLAB> folder.?????????????????????????? ???????????????????? ???????????????????? Linux/Macintosh Systems: Type the following in a shell (Linux) or in a terminal window (Macintosh): ?????????????????????????? cd <MATLAB>unzip <.zip file>???????????????????? ????????????? ?????? ?????? Delete the .zip file in the <MATLAB> folder. Change Log December 23, 2010:  attachment_693862_10a_through_10b_2010_12_22.zip:  initial version. December 23, 2010:  attachment_693862_09b_2010_12_22.zip:  initial version.",MATLAB,Other,R2011a,07 Apr 2011
693752, Incorrect code generation: Indexing into scalar with variable-size indices causes wrong answers,"The problem occurs when one of the following code patterns is used: x(I) = s;  x(I,J) = s;  x(I,J,K) = s;  ...   under the following conditions: x  and s  must be scalars (size 1x1). At least one of the indices (I , J , ...) must be variable sized.  In R2010b the bug causes an assertion failure during code generation, rather than generating incorrect code. ","Rewrite the assignment as a loop:for i = 1:numel(I)  for j = 1:numel(J)    x(I(i),J(j)) = s;  endend","Simulink Coder, MATLAB Coder",Incorrect Code Generation,R2011a,07 Apr 2011
693664," Error reported when structure field, used by nontunable block parameter, shares name with tunable variable","If the following conditions exist, Simulink incorrectly reports a warning or error: You specify an expression for a block parameter that cannot be tuned, such as Sample time  The expression refers to a structure field, object property, or object method that has the same name as a tunable variable in the base workspace Diagnostics > Data Validity > Detect loss of tunability  in the Configuration Parameters dialog box is set to warning  or error   ",Suppress the warning or error by setting Diagnostics > Data Validity > Detect loss of tunability to none.,Simulink,Other,R2011a,07 Apr 2011
693498, Error message or crash when block uses elapsed time with negative start time,"An error message or crash might occur when a block uses elapsed time with a negative start time under the following conditions: On the Solver  pane of the Configuration Parameters dialog box, the Start time  parameter is set to a negative value. On the Optimization  pane, the Application life span  parameter is set to in  or a larger value such that Simulink must use two unsigned int32  to store the absolute time counter. This avoids overflow. For example, a value greater than MAX_UINT32/(3600*24)/ts , where ts  is the base rate step size of the model. The block is in a triggered or function-call subsystem and must use elapsed time, for example, a Discrete Integrator block.  Simulation does not finish successfully. You might see the following behavior: In R2006b-R2007a, simulating the model causes the following error message: Unexpected internal error.  MATLAB crashes.  In R2007b-8b, the model continuously runs. If you try to close the model, Simulink displays the message: 'ModelName' is running. Do you want to stop it and close the model?  The model does not close successfully.  In R2009b-R2010b, you might see the following error message: The time between the last two triggers was so long that the Elapsed Time Counter used more than 32 bits. The block 'BlockName' can not carry out accurate calculations when this happens.   ? ","To work around this issue, you can do one of the following:Avoid a negative start time. Code generation does not support a negative start time.On the Optimization pane, reduce the value of the Application life span parameter.Change the Sample time type parameter of the function call port from triggered to periodic.?",Simulink,Other,"R2011a, R2011b",01 Sep 2011
693421, histfit produces a histogram and a density plot with different areas.,"The histfit  command produces a graph containing a histogram and a fitted density plot. However, the area under the density plot is smaller than the area under the histogram. This discrepency can make it hard to compare the two plots. ","To decide whether the distribution fits the data, it is safe to compare just the shapes of the histogram and fitted density plot. For example, the fit can be good if both are similar bell-shaped curves, even if the density plot is lower than the histogram bin heights.",Statistics and Machine Learning Toolbox,Other,R2011a,07 Apr 2011
693263, Model with array of buses signal may not generate accurate code,"Code generation for may be inaccurate when all  of the following conditions are true: The model contains an array of buses signal. The array of buses signal has the Struct  custom storage class specified (via Signal Properties dialog box or a Simulink.Signal  object). The Configuration Parameters -> Code Generation -> SIL and PIL Verification -> Create Block  option is set to SIL .  When code is generated for this kind of model, the compilation process may error. The output of the compilation process looks similar to the following: modelname_sf.c(344) : error C2088: '[' : illegal for struct modelname_sf.c(345) :error C2088: '[' : illegal for struct modelname_sf.c(352) :error C2088: '[' : illegal for struct modelname_sf.c(353) : error C2088: '[' : illegal for struct ",,Embedded Coder,Other,"R2010bSP1, R2011a",06 Jan 2012
693244, Generated code may fail to compile for reused variant subsystems that are controlled by C preprocessor conditionals,The generated code may fail to compile when the model contains variant subsystems that are reused as well as controlled by C preprocessor conditionals. The problem is caused by the code referencing the address of non-constant parameter data that is excluded from compilation due to the preprocessor conditionals.,,Embedded Coder,Other,"R2010bSP1, R2011a",07 Apr 2011
693159, Code generation errors with arrays of buses and custom storage classes," Indexing code for arrays of buses signal lines in a Simulink model may be incorrect when generating code from the model. The incorrect code will appear in the output and/or the update methods if both  of the following conditions are true: The model has at least one array of buses signal. The custom GetSet  storage class is specified for the array of buses signal (via the Signal Properties dialog box or a Simulink.Signal  object).  Under these conditions, if TLC assertions have been turned on (using the Configuration Parameters > Code Generation > Debugging  option), then a TLC assertion similar to the following may be thrown: Error: File: (matlabroot)/toolbox/simulink/simulink/@Simulink/tlc/GetSet.tlc Line: 56 Column: 9 Assertion failed ",See EBR 923193.,Simulink,Other,"R2010bSP1, R2011a",25 Mar 2013
693062, Incorrect value returned for negative log likelihood of inverse Gaussian distribution,"The reported negative log likelihood value for the inverse Gaussian distribution is incorrect. It is missing a constant additive term. This constant is not a function of the parameters. The erroneous log likelihood value appears in the fit summary of the Distribution Fitting Tool, and also as the NLogL  property of a fitted probability distribution object. ","For many purposes you can safely ignore the missing term. For example, some hypothesis tests involve the difference between two log likelihood values, and the constant term does not affect the difference.There are cases where the constant is important, such as using the value to compute an AIC statistic for comparing an inverse Gaussian fit with the fit of a different distribution. In that case, the workaround is to compute the negative log likelihood directly. For example, to compute the negative log likelihood for a data vector x at parameter values mu and lambda, enter:nlogl = -sum(log(pdf('inversegaussian',x,mu,lambda)))",Statistics and Machine Learning Toolbox,Other,R2011a,07 Apr 2011
692728, Callback function error dialog box may appear when you click items in Configure AUTOSAR Interface dialog box rapidly,"In the Configure AUTOSAR Interface dialog box, if you click certain items in rapid succession, for example, items on the Runnables  tab, you may see the Callback function error dialog box with the following message: Error: Callback function Detected 1 error(s) in RTW.FcnCtlUI.getDialogSchema: Subscript indices must either be real positive or logicals. ","If you see the Callback function error dialog box, click OK, which closes the dialog box. In the Configure AUTOSAR Interface dialog box, when you select an item, wait until the display is updated before you select another item.",Embedded Coder,Other,R2011a,15 Aug 2011
692679, Parameters UnderspecifiedInitializationDetection and MergeDetectMultiDrivingBlocksExec are not saved in MATLAB file when using the saveAs method of the Simulink.ConfigSet object,"When using the saveAs method of the Simulink.ConfigSet object, the parameters UnderspecifiedInitializationDetection  and MergeDetectMultiDrivingBlocksExec  are not saved in the resulting MATLAB file. Consequently, the Simulink.ConfigSet object loaded from the MATLAB file will always have the default values for these parameters. The default values UnderspecifiedInitializationDetection  and MergeDetectMultiDrivingBlocksExec  are 'Simplified' and 'none', respectively. As an example, the problem is illustrated for the parameter UnderspecifiedInitializationDetection  by the following MATLAB command sequence: >> currConfigset = Simulink.ConfigSetcurrConfigset =Simulink.ConfigSet (handle)  Description: ''  Components: [8x1 Simulink.ConfigComponent]  Name: 'Configuration'  >> get_param(currConfigset, 'UnderspecifiedInitializationDetection')  ans =  Classic  >> set_param(currConfigset, 'UnderspecifiedInitializationDetection', 'Simplified')>> get_param(currConfigset, 'UnderspecifiedInitializationDetection')  ans =  Simplified  >> currConfigset.saveAs('modifiedConfigset.m')>> clear currConfigset>> currConfigset = modifiedConfigsetcurrConfigset =Simulink.ConfigSet (handle)  Description: ''  Components: [8x1 Simulink.ConfigComponent]  Name: 'Configuration'  >> get_param(currConfigset, 'UnderspecifiedInitializationDetection')  ans =  Classic  >>  ",,Simulink,Other,"R2010bSP1, R2011a",04 Aug 2015
692649, Code for variant subsystems may define unnecessary data,"The code generated for a model containing variant subsystems controlled by C preprocessor conditionals may fail to conditionally compile those subsystems' constant and unstructured parameter data. As a consequence, the compiled executable is not optimally efficient because it defines data that is never used.",,Embedded Coder,Other,"R2010bSP1, R2011a",07 Apr 2011
692446, Selecting Find Referenced Variables context menu item in Model Explorer for libraries and blocks in libraries renders Model Explorer unresponsive or crashes MATLAB,"The Model Explorer context menu item Find Referenced Variables  is not disabled for libraries and blocks in libraries, even though you cannot use this feature with libraries or blocks within libraries. Selecting that menu item causes Model Explorer to become unresponsive. On some platforms (for example, Linux x86-64), it may cause MATLAB to crash. ",,Simulink,Other,R2011a,07 Apr 2011
692400, int can return wrong results if boundaries are given in descending order.,"Definite integration with the larger boundary given first can return answers with the wrong sign. For example, int  returns 3 instead of -3 for the following definite integral: syms xint(x^2,2,-1)ans =3 ","When computing definite integrals, specify boundaries in ascending order.",Symbolic Math Toolbox,Other,R2011a,07 Apr 2011
692390, Incorrect Code Generation: Model reference with variable-size signal with non-Auto storage class,"Simulink might give an incorrect answer and Real-Time Workshop might generate incorrect code for a model, which contains a model block and its referenced model has either of the following: A variable-size root inport and the output signal of the root Inport block has an ExportedGlobal , ImportedExtern,  or ImportedExternalPointer  storage class. A variable-size root outport and the input signal of the root Outport block has an ExportedGlobal , ImportedExtern,  or ImportedExternalPointer  storage class.  ",,Simulink,Incorrect Code Generation,"R2010bSP1, R2011a",11 Apr 2011
692384," In Japanese Windows 7 environments, MATLAB Report Generator generates unreadable text","In a Japanese Windows 7 environment, for PDF documents, MATLAB Report Generator and Simulink Report Generator may generate garbled or incorrect text. ","?Log in to an account with appropriate permissions to overwrite files in your MATLAB installation. On Linux systems, this is typically the root account.Locate your MATLAB installation by typing matlabroot at the MATLAB command prompt. This folder is referred to as <MATLAB> in subsequent steps.Exit MATLAB.Download the attached .zip file for your release (for example, attachment_706307_9b_2011-02-07.zip for R2009b) and store the file in the <MATLAB> folder.Make a backup copy of each of the files listed in the .zip file. To see the contents of the .zip file: Windows Systems: Open the .zip file and look at the contents.Linux/Macintosh Systems: Type the following in a shell (Linux) or in a terminal window (Macintosh):unzip -l <MATLAB>/<.zip file>Extract the files from the .zip file. Windows Systems: Open the .zip file.Extract the contents of the file to your <MATLAB> folder.Linux/Macintosh Systems: Type the following in a shell (Linux) or in a terminal window (Macintosh): cd <MATLAB>unzip <.zip file>Delete the .zip file in the <MATLAB> folder.",MATLAB Report Generator,Other,"R2010bSP1, R2011a",07 Apr 2011
692142, Data Type Conversion block might not report overflows for certain built-in type conversions,"For the Data Type Conversion block, the ""Detect overflow"" diagnostics might not report overflows for floating point to built-in integer conversions. The software always performs the wrapping operation correctly, but the diagnostics might not report that wrapping occurred. This bug occurs under the following circumstances: When converting from double or single data types to 8, 16, and 32-bit signed and unsigned integers With all rounding modes except Zero and Simplest Only for values in the vicinity of the limits of the integer range. For a specific integer type, MIN_INT > x > MIN_INT-1 and MAX_INT < x < MAX_INT+1.  ?  ","Use rounding to zero or simplest rounding for floating point to integer conversions.If you use rounding modes other than Zero and Simplest, do not rely on the diagnostics for values around the limit of the integer range (around MIN_INT and around MAX_INT for the specified word length and signedness).",Simulink Fixed Point,Other,R2011a,28 Jul 2011
691933, Incorrect algebraic loop simulation,"Simulink returns an incorrect algebraic loop result when the following is true: The model contains an algebraic loop. In the Data Import/Export  pane of the model Configuration Parameters dialog box, the Save to workspace > States  check box is cleared. In the Real-Time Workshop  pane of the model Configuration Parameters dialog box, ert.tlc  is selected as the current system target file. In the Real-Time Workshop > Interface  pane of the model Configuration Parameters dialog box, Code interface > Single output/update function  check box is selected.  ","As a workaround, before starting a simulation of a model that contains algebraic loops, in the Data Import/Export pane of the model Configuration Parameters dialog box, select the Save to workspace > States check box.",Simulink,Other,R2011a,23 May 2011
691635, MATLAB may crash when acquiring from a JAI GigE Vision camera in a BayerGB format,MATLAB may crash when acquiring video data from a JAI GigE Vision camera using a BayerGB video format. This is caused by improper handling of a change to the minimum y-offset and maximum height allowed. ,"Installation instructionsLog in to an account with appropriate permissions to overwrite files in your MATLAB installation. On Linux systems, this is typically the root account.Locate your MATLAB installation by typing matlabroot at the MATLAB command prompt. This folder is referred to as <MATLAB> in subsequent steps.Exit MATLAB.Download the attached .zip file associated with this Bug Report and store the file in the <MATLAB> folder.Make a backup copy of each of the files listed in the .zip file. To see the contents of the .zip file: Windows Systems: Open the .zip file and look at the contents.Linux/Macintosh Systems: Type the following in a shell (Linux) or in a terminal window (Macintosh):unzip -l <MATLAB>/<.zip file>Extract the files from the .zip file. Windows Systems: Open the .zip file.Extract the contents of the file to your <MATLAB> folder.Linux/Macintosh Systems: Type the following in a shell (Linux) or in a terminal window (Macintosh): cd <MATLAB>unzip <.zip file>Delete the .zip file in the <MATLAB> folder.",Image Acquisition Toolbox,Other,R2011a,07 Apr 2011
690764, Comments on OVFL checks are not imported when you import comments from verification results generated with older versions of the software?,"When importing comments from verification results generated with older versions of the software, justifications and comments on scalar OVFL and float OVFL checks are not imported into the new results. ",,Polyspace Code Prover,Other,R2011a,13 Apr 2011
690709, Subsystem to referenced model conversion may cause a segmentation violation,"If a subsystem has one or more Subsystem Variants blocks as children, then Simulink may crash with a segmentation violation if you convert that subsystem to a referenced model. ",,Simulink,Other,"R2010bSP1, R2011a",12 Apr 2011
690577," When a model that contains Simscape blocks is simulated in Accelerator mode, a segmentation violation might occur","When a model that contains Simscape blocks is simulated in Accelerator mode, a segmentation violation might occur. You might see this behavior if you rerun the model after you edit the Simscape blocks. ","As a workaround, in the file matlab/rtw/c/tlc/mw/accelreg.tlc replace line%<FcnGenInitMassMatrixPrInRoot()>withif (ssGetSizeofDWork(S) == sizeof(%<::tDWorkType>)) {%<FcnGenInitMassMatrixPrInRoot()>}",Simulink,Other,"R2010bSP1, R2011a, R2011b",01 Sep 2011
690523, Simulation And Code Generation Mismatch: Software-In-the-Loop (SIL) and Simulink simulation mismatch for multi-rate subsystem,"A SIL block created for a subsystem might not reflect the same behavior under the following conditions The input signals to the selected Subsystem block are updated at multiple rates. The Inport blocks of the Subsystem block have the block parameter, Sample time  (for -1 inherited) , set to -1 .  ","Avoid setting the block parameter, Sample time (-1 for inherited), to -1 for Inport blocks of subsystems intended for code generation.",Simulink Coder,Other,"R2010bSP2, R2011a",05 Apr 2012
690317, Error in vsim command when launching ModelSim 6.6c or 6.6d from MATLAB on Windows operating systems,"On Windows operating systems, you will see the following error message when you invoke the vsim command to launch ModelSim 6.6c or 6.6d:Both launcher "" modelsim -noautoldlibpath -gui -do ""do {C:/tmp/compile_and_launch.tcl}"""" and "" questasim -noautoldlibpath -gui -do ""do {C:/tmp/compile_and_launch.tcl}"""" failed with non-zero status! If the problem is that it is not on the system path, please use parameter 'hdlsimdir' to specify its location ??? Error using ==> hdlsim at 283'questasim' is not recognized as an internal or external command,operable program or batch file. Error in ==> vsim at 101 hdlsim(pvpairs{:});  ","This fix allows you to launch ModelSim 6.6c and 6.6d using the vsim command on Windows operating systems. Note that this fix does not allow you to launch ModelSim from a directory with white-space in the path. To change the ModelSim launching directory, change the current MATLAB directory or specify a valid path with the 'rundir' property of the vsim command.Alternatively, you can use a currently supported version of ModelSim to avoid this error. Refer to the EDA Simulator Link Getting Started Guide for a list of supported versions. Installation instructions       Log in to an account with appropriate permissions to overwrite files in your MATLAB installation. On Linux systems, this is typically the root account.       Locate your MATLAB installation by typing matlabroot at the MATLAB command prompt. This folder is referred to as <MATLAB> in subsequent steps.       Exit MATLAB.       Download the attached .zip file associated with this Bug Report and store the file in the <MATLAB> folder.                     Make a backup copy of each of the files listed in the .zip file. To see the contents of the .zip file:                                    Windows Systems: Open the .zip file and look at the contents.                     Linux/Macintosh Systems: Type the following in a shell (Linux) or in a terminal window (Macintosh):unzip -l <MATLAB>/<.zip file>                                          Extract the files from the .zip file.                                                               Windows Systems:                                                             Open the .zip file.                                  Extract the contents of the file to your <MATLAB> folder.                                                                                                Linux/Macintosh Systems: Type the following in a shell (Linux) or in a terminal window (Macintosh):                            cd <MATLAB>unzip <.zip file>                                                 Delete the .zip file in the <MATLAB> folder.",HDL Verifier,Other,R2011a,07 Apr 2011
690018, A warning for a minimum step size violation causes Simulink to become unresponsive,"In very rare situations, the warning for a minimum step size violation is thrown consecutively and Simulink becomes unresponsive. You cannot stop the simulation without terminating MATLAB. This bug is fixed and you can use CTRL-C in the MATLAB command window to stop the simulation. ","By adjusting solver parameters, such as Relative tolerance, Absolute tolerance, or Initial step size, you can avoid the warning for a minimum step size violation.",Simulink,Other,"R2010bSP1, R2011a",29 Jul 2015
689914, Underspecified initialization detection parameter value incorrectly displayed on Japanese machine,"On a Japanese machine, on the Diagnostics > Data Validity  pane of the Configuration Parameter dialog box, the Underspecified initialization detection  parameter always displays Classic , even when the parameter is set to Simplified . ",,Simulink,Other,"R2010bSP1, R2011a, R2011b",01 Sep 2011
