Bug Id,Summary,Description,Workaround,Products,Type,Fixed In,Modified Date
928622, Compiling a MATLAB function with Image Acquisition VideoDevice System object results in an error,Using Image Acquisition VideoDevice System object with compiler results in the following error Error using VideoDevice/step    Could not connect to image acquisition device.  ,Please contact MathWorks Technical Support team for a workaround.,Image Acquisition Toolbox,Other,R2013b,06 Sep 2013
928417," Two models configured for external mode simulation with ""Wind River Diab/GCC (makefile generation only)"" IDE tool chain cannot run simultaneously.","The error occurs in the following situation. Run two external mode simulations for model1 and model2 which are configured to use ""Wind River Diab/GCC (makefile generation only)"" IDE tool chain with default base rate priority of 40. The two models generate model1.vxe and model2.vxe. Follow the steps below to simultaneously run the two models with external mode simulation. 1) Launch the first model (model1.vxe) with the ""-w -tf inf -port <12346>"" options.2) Launch the second model (model2.vxe) with the ""-w -tf inf -port <12345>"" options.3) Press the external mode connect button of model1 in Simulink.4) Press the external mode connect button of model2 in Simulink.5) Run model1 in Simulink.6) Run model2 in Simulink. Step 3 incorrectly starts off the external mode simulation for model1 in addition to the desired connect action. Therefore as per the Step 4, the model2 does not connect to the target as the target is already running. ","1. Backup main_vxworks.tlc in folder $(MATLABROOT)/toolbox/idelink/foundation/pjtgenerator/main2. Unzip the attached zip file and copy main_vxworks.tlc to folder $(MATLABROOT)/toolbox/idelink/foundation/pjtgenerator/main.3. You can set the base rate priority in the configuration parameters of the model. Change the base rate priority of the model1 and model2 to more than 50 as the default network task priority in VxWorks is 50.4. Follow the below steps to simultaneously run the two models in external mode.Launch the first model (model1.vxe) with the ""-w -tf inf -port <12346>"" optionsThe second model should be launched with lower priority. This can be done by running the following command in vxsim.                                                                                                                                                                                                                                                                   rtpSp(""host:X:/model2.vxe -w -tf inf -port 12345"", <Lowerpriortynum>)              NOTE: The <Lowerpriortynum> number is greater than the base rate priority of model1. This ensures that model2 is launched with a lower priority compared to model1.Press the external mode connect button of model1 in Simulink.Press the external mode connect button of model2 in Simulink.Run model1 in Simulink.Run model2 in Simulink.??",Embedded Coder,Other,R2013b,21 Oct 2013
928329, SVD with three output arguments may fail to converge for certain valid inputs.,"[U,S,V] = svd(A)  may return the following error for certain valid inputs.  Error using svd   SVD did not converge.  ",,MATLAB,Other,R2013b,06 Sep 2013
928257, Code inspection fails for If blocks containing variables with numeric precisions of more than 4 decimal places.,"Code inspection fails for If blocks with If  or Elseif  expressions containing variables with numeric precisions of more than 4 decimal places.  For example, Simulink Code Inspector will fail to verify the block if the If  expression is of the form u1 == val , where val  is defined in the MATLAB workspace as any of the following:  va l  = 3.141592653589793 val   = 3.141592 val  = 31.41592   ","In the If or Elseif expression, replace the variable with its numerical value. For example, if the If expression is of the form u1 == val, where val is defined as 3.141592653589793, replace u1 == val with u1 == 3.141592653589793.",Simulink Code Inspector,Other,R2013b,06 Sep 2013
928221, Using a model argument in the D parameter of the Discrete State-Space block can cause a segmentation violation,Simulating a model that meets all of the following conditions causes a segmentation violation: The model contains a Model block that is in Accelerator mode. The model that is referenced in Accelerator mode contains a Discrete State-Space block that uses a model argument in the D  parameter. The Discrete State-Space block is connected directly to a root inport. The D  parameter evaluates to 0 in the context of the referenced model.  ? ,,Simulink,Other,R2013b,06 Sep 2013
927997," Error ""Not enough input arguments"" in ""Verify with Cosimulation"" and ""Verify with FPGA-in-the-Loop"" steps of MATLAB HDL Workflow Advisor","The MATLAB HDL Workflow Advisor may generate the error message ""Not enough input arguments"" during the ""Verify with Cosimulation"" or ""Verify with FPGA-in-the-Loop"" steps. You get this error only if you have selected the ""Log output for comparison plots"" option at either of those steps. ","Installation instructionsLog in to an account with appropriate permissions to overwrite files in your MATLAB installation. On Linux systems, this is typically the root account.Locate your MATLAB installation by typing matlabroot at the MATLAB command prompt. This folder is referred to as <MATLAB> in subsequent steps.Exit MATLAB.Download the attached .zip file associated with this Bug Report and store the file in the <MATLAB> folder.Make a backup copy of each of the files listed in the .zip file. To see the contents of the .zip file: Windows Systems*: Open the .zip file and look at the contents.Linux/Macintosh Systems: Type the following in a shell (Linux) or in a terminal window (Macintosh):unzip -l <MATLAB>/<.zip file>Extract the files from the .zip file. Windows Systems*: Open the .zip file.Extract the contents of the file to your <MATLAB> folder.Linux/Macintosh Systems: Type the following in a shell (Linux) or in a terminal window (Macintosh): cd <MATLAB>unzip <.zip file>Delete the .zip file in the <MATLAB> folder.*Notes for Windows Systems:If you see ˇ°Error: Access is deniedˇ± when attempting to extract the .zip file, you may need to start WinZip in administrator mode. Do this by navigating to WinZip.exe or the WinZip Start menu entry, right-clicking on it, and selecting Run as administrator.From within WinZip, find and open the downloaded .zip file.Extract the contents of the file to your <MATLAB> folder.",HDL Coder,Other,R2013b,06 Sep 2013
927948, lsqlin sometimes gives residuals of the wrong sign.,"When you solve a problem that has bound constraints with the default lsqlin  trust-region-reflective algorithm, lsqlin  returns residuals  -(C*x-d)  instead of the documented value C*x-d. lsqlin  returns the correct residuals for unconstrained problems, and for problems that use the active-set algorithm. ","Reverse the sign of the returned residuals, or use the lsqlin active-set algorithm.",Optimization Toolbox,Other,R2013b,06 Sep 2013
927910, Symbolic Math Toolbox diag function misses diagonal entries of particular matrices.,"The commands A = sym('A_',[2,3]);diag(A,1) return the 1x1 matrix ans =A_1_2 The correct result is the 2x1 matrix [A_1_2; A_2_3]  ","Instead of calling diag on the matrix A, use the MATLAB indexing to extract the corresponding subdiagonal of A:D = reshape(1:numel(A),size(A));Indices = diag(D,1);A(Indices)This returns the correct result:ans = A_1_2 A_2_3",Symbolic Math Toolbox,Other,R2013b,06 Sep 2013
927692, TreeBagger can produce incorrect predictions if you input class labels Y as a categorical or numeric array,"If you input class labels Y  to TreeBagger  as a categorical (ordinal or nominal) array or a numeric array, the order of classes in the ClassNames  property of the TreeBagger  object and the order of the columns in the array of scores returned by the predict  method might be mismatched. As a result, the predict  and oobPredict  methods of TreeBagger  might return incorrect class labels. TreeBagger  methods such as error , oobError , margin , oobMargin  and others would then return incorrect results as well. ",Convert class labels Y to a cell array of strings before passing them to TreeBagger.,Statistics and Machine Learning Toolbox,Other,R2013b,06 Sep 2013
927505, Incorrect WCDMA Secondary Synchronization Code Sequence in the Wcdma Example Library commwcdma_lib.mdl,"The Pattern Repetition sequence has incorrect values in the 'Scdma SSC Generator' Subsystem block of the 'Wcdma Sources' sub-library in the'Wcdma Example Library' commwcdma_lib.mdl. This is referred to as the z sequence in Section 5.2.3.1 ""Code Generation"" of document ""3GPP TS 25.213 V3.6.0 (2001-06)"". ",,Communications Toolbox,Other,R2013b,06 Sep 2013
927445," In the Simulation Data Inspector, Run Configuration Options and Data Import dialog boxes are empty.",The Simulation Data Inspector might display empty dialog boxes for the following:Data Import Run Configuration Options  This behavior is seen on certain non-English installations.,Unzip the attached folder. Use the unzipped files to replace the following two files:toolbox\simulink\simulink\+Simulink\+sdi\+views\+html\@ImportDialog\importData.htmltoolbox\simulink\simulink\+Simulink\+sdi\+views\+html\@RunConfigDialog\runConfigDialog.html,Simulink,Other,R2013b,06 Sep 2013
927403, Incorrect Code Generation: Generated code for n-D Lookup Table block might have extra addressof,"When both of these conditions are true, generated code for the n-D Lookup Table block has an extra addressof : The number of table dimensions is three or more. You are passing breakpoint data to the lookup table block using an ImportedExternPointer storage class, or   the lookup table block is in a referenced model and you have specified the breakpoint data in the model arguments of the referenced model.  ? ",,Embedded Coder,Incorrect Code Generation,R2013b,20 Feb 2014
927034, Compiler error when internal-data memory section applied to real-time model data structure pointer (model_M),"Embedded Coder users can apply memory sections to internal data, such as block I/O (model _B ) and D-work vectors (model _D ), using the model parameter Code Generation > Memory Sections > Internal data  in the Configuration Parameters dialog box. The internal-data memory section also applies to the real-time model data structure pointer (model _M ). However, model _M  is a constant pointer. If you allocate a RAM section to internal data, the generated code does not compile because of the model _M  constant pointer. ","Installation instructionsLog in to an account with appropriate permissions to overwrite files in your MATLAB installation. On Linux systems, this is typically the root account.Locate your MATLAB installation by typing matlabroot at the MATLAB command prompt. This folder is referred to as <MATLAB> in subsequent steps.Exit MATLAB.Download the attached .zip file associated with this Bug Report and store the file in the <MATLAB> folder.Make a backup copy of each of the files listed in the .zip file. To see the contents of the .zip file: Windows Systems*: Open the .zip file and look at the contents.Linux/Macintosh Systems: Type the following in a shell (Linux) or in a terminal window (Macintosh):unzip -l <MATLAB>/<.zip file>Extract the files from the .zip file. Windows Systems*: Open the .zip file.Extract the contents of the file to your <MATLAB> folder.Linux/Macintosh Systems: Type the following in a shell (Linux) or in a terminal window (Macintosh): cd <MATLAB>unzip <.zip file>Delete the .zip file in the <MATLAB> folder.*Notes for Windows Systems:You need administrative privileges to save the .zip file in the <MATLAB> folder. To save the .zip file in the <MATLAB> folder, open this Bug Report in a browser started in administrator mode.If you see ˇ°Error: Access is deniedˇ± when attempting to extract the .zip file, you may need to start WinZip in administrator mode. Do this by navigating to WinZip.exe or the WinZip Start menu entry, right-clicking on it, and selecting Run as administrator.From within WinZip, find and open the downloaded .zip file.Extract the contents of the file to your <MATLAB> folder.",Embedded Coder,Other,R2013b,14 Nov 2014
926744, Simulating a model in Rapid Accelerator mode with RapidAcceleratorUpToDateCheck turned off causes memory leaks,"For simulations in Rapid Accelerator mode with RapidAcceleratorUpToDateCheck turned off, there is a memory leak in every simulation. This leak is proportional to the number of model parameters. ","Installation instructions       Log in to an account with appropriate permissions to overwrite files in your MATLAB installation. On Linux systems, this is typically the root account.       Locate your MATLAB installation by typing matlabroot at the MATLAB command prompt. This folder is referred to as <MATLAB> in subsequent steps.       Exit MATLAB.       Download the attached .zip file associated with this Bug Report and store the file in the <MATLAB> folder.                     Make a backup copy of each of the files listed in the .zip file. To see the contents of the .zip file:                                    Windows Systems*: Open the .zip file and look at the contents.                     Linux/Macintosh Systems: Type the following in a shell (Linux) or in a terminal window (Macintosh):unzip -l <MATLAB>/<.zip file>                                          Extract the files from the .zip file.                                                               Windows Systems*:                                                             Open the .zip file.                                  Extract the contents of the file to your <MATLAB> folder.                                                                                                Linux/Macintosh Systems: Type the following in a shell (Linux) or in a terminal window (Macintosh):                            cd <MATLAB>unzip <.zip file>                                                 Delete the .zip file in the <MATLAB> folder.  *Notes for Windows Systems:      You need administrative privileges to save the .zip file in the <MATLAB> folder.  To save the .zip file in the <MATLAB> folder, open this Bug Report in a browser started in administrator mode.    If you see ˇ°Error: Access is deniedˇ± when attempting to extract the .zip file, you  may need to start WinZip in administrator mode. Do this by navigating to  WinZip.exe or the WinZip Start menu entry, right-clicking on it, and selecting  Run as administrator.    From  within WinZip, find and open the downloaded .zip file.    Extract  the contents of the file to your <MATLAB> folder.  ",Simulink,Other,R2013b,06 Sep 2013
926524, Stateflow does not display text exceeding 35 lines,"If the text content of a Stateflow graphical object (e.g. states, transitions, etc.) exceeds 35 lines, the text beyond 35 lines is not displayed. The text still exists internally and Stateflow uses it.  You may not see all of the state actions, transition labels, and other text lines that are present in the chart. While editing the graphical object text, Stateflow displays the entirety of the text. ","Installation instructions       Log in to an account with appropriate permissions to overwrite files in your MATLAB installation. On Linux systems, this is typically the root account.       Locate your MATLAB installation by typing matlabroot at the MATLAB command prompt. This folder is referred to as <MATLAB> in subsequent steps.       Exit MATLAB.       Download the attached .zip file associated with this Bug Report and store the file in the <MATLAB> folder.                     Make a backup copy of each of the files listed in the .zip file. To see the contents of the .zip file:                                    Windows Systems*: Open the .zip file and look at the contents.                     Linux/Macintosh Systems: Type the following in a shell (Linux) or in a terminal window (Macintosh):unzip -l <MATLAB>/<.zip file>                                          Extract the files from the .zip file.                                                               Windows Systems*:                                                             Open the .zip file.                                  Extract the contents of the file to your <MATLAB> folder.                                                                                                Linux/Macintosh Systems: Type the following in a shell (Linux) or in a terminal window (Macintosh):                            cd <MATLAB>unzip <.zip file>                                                 Delete the .zip file in the <MATLAB> folder.  *Notes for Windows Systems:      You need administrative privileges to save the .zip file in the <MATLAB> folder.  To save the .zip file in the <MATLAB> folder, open this Bug Report in a browser started in administrator mode.    If you see ˇ°Error: Access is deniedˇ± when attempting to extract the .zip file, you  may need to start WinZip in administrator mode. Do this by navigating to  WinZip.exe or the WinZip Start menu entry, right-clicking on it, and selecting  Run as administrator.    From  within WinZip, find and open the downloaded .zip file.    Extract  the contents of the file to your <MATLAB> folder.  ",Stateflow,Other,R2013b,14 Aug 2014
926296, Incorrect Code Generation: Code from default transitions can sometimes be reused incorrectly for inner transitions,"Code from default transitions can be reused incorrectly for inner transitions when the following conditions are met: A state has a single default and a single inner transition. Both the default and inner transitions lead to the same junction. The default and inner transitions have the same leading  actions but are otherwise different. For example, the default transition has the code a=0;b=0;  while the inner transition has the code a=0; .  In this situation, the correct behavior is that when the state is first entered, we execute a=0;b=0;  and when the state remains active, we execute only a=0; . However, this bug results in the state executing a=0;b=0;  not just the first time it is entered, but even in succeeding time steps. This wrong behavior is illustrated in the attached example incorrect_inner_default_reuse.mdl . In this example, the correct behavior is that the output b  gets incremented from b=1  to b=11  during the course of simulation. However, if debugging is turned off, or when code is generated, b  keeps getting reset every time leading to it always having the value 1.  ","As a workaround, make sure that the first actions of the default transition and the inner transition are not identical. For example, consider using b=1;a=1; for the default transition and a=1; for the inner transition.",Stateflow,Incorrect Code Generation,R2013b,06 Sep 2013
926267, Put-call parity is not observed in SWAPTIONBYBLK for non-flat yield curves.,"The ""put"" and ""call"" price of a swaption should be the same when the Strike  is equal to the forward swap rate. However, the ""put"" and ""call"" prices produced by SWAPTIONBYBLK can be significantly different even when the Strike  is equal to the forward swap rate. This does not happen when the yield curve is flat. ","Download the attached file ""swaptionbyblk.m"" and replace it for the original on the following path$MATLABROOT\toolbox\fininst\fininst\where $MATLABROOT is the path returned by typing ""matlabroot"" in the Command Window.",Financial Instruments Toolbox,Other,R2013b,06 Sep 2013
926023, Transition lines appear distorted after certain operations on the State Transition Table,"In a State Transition Table, certain operations such as state row moves, row deletions, or row insertions, may cause existing straight-line transitions to become skewed. ","Installation instructionsLog in to an account with appropriate permissions to overwrite files in your MATLAB installation. On Linux systems, this is typically the root account.Locate your MATLAB installation by typing matlabroot at the MATLAB command prompt. This folder is referred to as <MATLAB> in subsequent steps.Exit MATLAB.Download the attached .zip file associated with this Bug Report and store the file in the <MATLAB> folder.Make a backup copy of each of the files listed in the .zip file. To see the contents of the .zip file: Windows Systems*: Open the .zip file and look at the contents.Linux/Macintosh Systems: Type the following in a shell (Linux) or in a terminal window (Macintosh):unzip -l <MATLAB>/<.zip file>Extract the files from the .zip file. Windows Systems*: Open the .zip file.Extract the contents of the file to your <MATLAB> folder.Linux/Macintosh Systems: Type the following in a shell (Linux) or in a terminal window (Macintosh): cd <MATLAB>unzip <.zip file>Delete the .zip file in the <MATLAB> folder.*Notes for Windows Systems:If you see ˇ°Error: Access is deniedˇ± when attempting to extract the .zip file, you may need to start WinZip in administrator mode. Do this by navigating to WinZip.exe or the WinZip Start menu entry, right-clicking on it, and selecting Run as administrator.From within WinZip, find and open the downloaded .zip file.Extract the contents of the file to your <MATLAB> folder.",Stateflow,Other,R2013b,06 Sep 2013
925949, Uninstalling a MATLAB App containing folders will leave empty folders behind.,"Uninstalling an app that contains extra folders for MATLAB code or data will remove all files, but will leave the folders intact. The remaining folders are harmless and can be removed manually. ",There is no workaround.,MATLAB Compiler,Other,R2013b,23 Sep 2014
925867, Error during code generation when File packaging format set to Compact and Shared code placement set to Auto,"In some models using MATLAB structures to store parameters or bus signals without bus objects, you may encounter an error during code generation similar to the following: Error: Error occurred when generating shared type: Type, 'struct_EF6jG8VvmjOPAZSjmOw0PE', is specified to export to a header file, but compact file format has been requested. Either select a different file packaging format or do not select the 'Export' option for the data type. This happens under the following conditions: On the Code Generation > Code Placement  pane, the File packaging format  option is set to Compact  On the Code Generation > Interface  pane, the Shared code placement  option is set to Auto  The model is a standalone model (not part of a model reference hierarchy)  ","Do one of the following:In the Configuration Parameters dialog box, on the Code Generation > Interface pane, set the Shared code placement option to Shared location.On the Code Generation > Code Placement pane, set the File packaging format option to Modular.If you can identify the bus without a bus object that is generating the structure type, create a bus object for that signal.If you can identify the MATLAB structure parameter that is generating the structure type, replace the parameter with a Simulink data object.??",Embedded Coder,Other,R2013b,06 Sep 2013
925724, Error: Unexpected exception SysErr (SysErr: No such file or directory [noent]) when downloading results from Polyspace Metrics,"When downloading results through the Polyspace Metrics Web interface, you may see the following error: Error: Unexpected exception SysErr (SysErr: No such file or directory [noent])  This error occurs on a client machine. During the download, Polyspace tries to create temporary files in the results repository folder. The error is produced because the results repository folder does not exist on a client machine. ","On a client machine where Polyspace is installed in the default folder c:\Program Files\Polyspace\PolyspaceForCandCPP_R2013a, do the following:From a DOS command window, run c:\Program Files\Polyspace\PolyspaceForCandCPP_R2013a\polyspace\bin\polyspaced.exe -check-only From your Polyspace Metrics Web page, download the results again.",Polyspace Code Prover,Other,R2013b,06 Sep 2013
