Bug Id,Summary,Description,Workaround,Products,Type,Fixed In,Modified Date
1737913, Assertion error during MEX code generation when memory integrity checks enabled?,MATLAB might throw an assertion error when you try to generate MEX code with integrity checks enabled.?The assertion is similar to: Assertion at b:\ matlab\ src\ cgir_xform\ dom_c\ lowermatrixtypesforbackend.cpp line 447:?  !MatrixType::isa(exprType)  The stack trace is similar to: ? [??3] 0x26c5b8db client_assertion_failed at b:\ matlab\ src\ cg_ir\ util_prim\ cg_assert.cpp:22 (in matlab\ bin\ win32\ cg_ir.dll)? [??4] 0x2a5c9ecf CG::transform::LowerMatrixTypesForBackend::LowerFcn::lowerExprStmt at b:\ matlab\ src\ cgir_xform\ dom_c\ lowermatrixtypesforbackend.cpp:447 (in matlab\ bin\ win32\ cgir_xform.dll)?  [??5] 0x2a5ca0ae CG::transform::LowerMatrixTypesForBackend::LowerFcn::lowerStmt at b:\ matlab\ src\ cgir_xform\ dom_c\ lowermatrixtypesforbackend.cpp:495 (in matlab\ bin\ win32\ cgir_xform.dll)?  ,,MATLAB Coder,Other,R2013b,05 Mar 2018
1716979, MATLAB crashes or coverage missing when analyzing subsystem containing Switch Case block,"This bug occurs when a Model Coverage analysis is scoped to a particular subsystem (for example, by setting the CovPath parameter) where Switch Case blocks are found both inside and outside of this subsystem. Under this circumstance, either MATLAB crashes or the analysis completes but the Switch Case blocks inside of the specified subsystem are incorrectly reported as never having executed for coverage. ",Do not scope the coverage analysis to a single subsystem if this subsystem contains a Switch Case block while one or more Switch Case blocks are found elsewhere in the model.? Instead analyze coverage for the entire model by ensuring that the CovPath parameter is set to the default value '/'.,Simulink Check,Other,R2013b,17 Jan 2018
1185416, USRP support package installation can error out when installing the dd v0.5 for Windows third-party software,"Installing the USRP support package on Windows can trigger an error such as this: Error installing third party software dd v0.5 for Windows: Error executing command ""unzip('C:\MATLAB\SupportPackages\R2014b\downloads\usrpradio_download\dd-0.5.zip', fullfile(sdruroot,'uhdapps','utils'))"" Invalid zip file ""C:\MATLAB\SupportPackages\R2014b\downloads\usrpradio_download\dd-0.5.zip"". ","Download the USRP support package to a folder (for example, C:\MATLAB\SupportPackages\R2014b\downloads\usrpradio_download).In the folder, delete the dd-0.5.zip file. It is not a valid zip file.Use a web browser to download dd-0.5.zip manually from http://www.chrysocome.net/downloads/dd-0.5.zip to C:\MATLAB\SupportPackages\R2014b\downloads\usrpradio_download.Install the USRP support package from the folder C:\MATLAB\SupportPackages\R2014b\downloads\usrpradio_download.",Communications Toolbox,Other,"R2013b, R2014a, R2014b, R2015a, R2015b",04 Sep 2015
1103654, Simulink does not display text exceeding 35 lines,"If the text of a model element exceeds 35 lines, the text beyond 35 lines is not displayed. The text still exists internally and Simulink uses it. You may not see all of the text present in the model. While editing the text of the model element, the Simulink editor displays the entirety of the text. ",,Simulink,Other,R2013b,17 Jun 2014
1087867, importdata imports incorrect data from MAT-files on Windows,"On Windows? platforms, the importdata  function does not load MAT-files correctly. For example, a call to importdata  with the name of a MAT-file as the input returns incorrect data:data = importdata('myMATFile.mat'); ","Installation instructions       Log in to an account with appropriate permissions to overwrite files in your MATLAB installation. On Linux systems, this is typically the root account.       Locate your MATLAB installation by typing matlabroot at the MATLAB command prompt. This folder is referred to as <MATLAB> in subsequent steps.       Exit MATLAB.       Download the attached .zip file associated with this Bug Report and store the file in the <MATLAB> folder.                     Make a backup copy of each of the files listed in the .zip file. To see the contents of the .zip file:                                    Windows Systems*: Open the .zip file and look at the contents.                     Linux/Macintosh Systems: Type the following in a shell (Linux) or in a terminal window (Macintosh):unzip -l <MATLAB>/<.zip file>                                          Extract the files from the .zip file.                                                               Windows Systems*:                                                             Open the .zip file.                                  Extract the contents of the file to your <MATLAB> folder.                                                                                                Linux/Macintosh Systems: Type the following in a shell (Linux) or in a terminal window (Macintosh):                            cd <MATLAB>unzip <.zip file>                                                 Delete the .zip file in the <MATLAB> folder.  *Notes for Windows Systems:      If you see ˇ°Error: Access is deniedˇ± when attempting to extract the .zip file, you  may need to start WinZip in administrator mode. Do this by navigating to  WinZip.exe or the WinZip Start menu entry, right-clicking on it, and selecting  Run as administrator.    From  within WinZip, find and open the downloaded .zip file.    Extract  the contents of the file to your <MATLAB> folder.  ",MATLAB,Other,R2013b,03 Jun 2014
1082102, Model Advisor MAAB check Check for event broadcasts in Stateflow charts incorrectly reports an undirected event broadcast warning,Model Advisor MAAB check Check for event broadcasts in Stateflow charts  incorrectly reports an undirected event broadcast  warning for non-local events. The check verifies compliance with MAAB Modeling Guideline jm_0012. ,"Installation instructions       Log in to an account with appropriate permissions to overwrite files in your MATLAB installation. On Linux systems, this is typically the root account.       Locate your MATLAB installation by typing matlabroot at the MATLAB command prompt. This folder is referred to as <MATLAB> in subsequent steps.       Exit MATLAB.       Download the attached .zip file associated with this Bug Report and store the file in the <MATLAB> folder.                     Make a backup copy of each of the files listed in the .zip file. To see the contents of the .zip file:                                    Windows Systems*: Open the .zip file and look at the contents.                     Linux/Macintosh Systems: Type the following in a shell (Linux) or in a terminal window (Macintosh):unzip -l <MATLAB>/<.zip file>                                          Extract the files from the .zip file.                                                               Windows Systems*:                                                             Open the .zip file.                                  Extract the contents of the file to your <MATLAB> folder.                                                                                                Linux/Macintosh Systems: Type the following in a shell (Linux) or in a terminal window (Macintosh):                            cd <MATLAB>unzip <.zip file>                                                 Delete the .zip file in the <MATLAB> folder.  *Notes for Windows Systems:      If you see ˇ°Error: Access is deniedˇ± when attempting to extract the .zip file, you  may need to start WinZip in administrator mode. Do this by navigating to  WinZip.exe or the WinZip Start menu entry, right-clicking on it, and selecting  Run as administrator.    From  within WinZip, find and open the downloaded .zip file.    Extract  the contents of the file to your <MATLAB> folder.  ",Simulink Check,Other,R2013b,19 May 2014
1077216, MATLAB crash while generating annotations for a saturating add or subtraction operation,"MATLAB might crash during code generation for a model under the following the conditions: For certain blocks, the Saturate on overflow  checkbox is selected. On the Code Generation > Comments  pane, the Operator annotations  check box is selected.  The crash occurs during code generation while generating annotations for a saturating add or subtraction operation. ","In the Configuration Parameters dialog, on the Code Generation > Comments pane, clear the Operator annotations check box.",Embedded Coder,Other,R2013b,07 Jul 2014
1063051, Error when using Simulink functions inside Stateflow with digits in their name,"When you attempt to simulate a model that meets all of the following conditions, MATLAB throws an error, mxResult == 0 , or crashes.The Stateflow chart contains Simulink functions. The names of one or more of the Simulink functions end with a zero followed by any number of digits. The Stateflow chart contains parameter data.  ","Installation instructions       Log in to an account with appropriate permissions to overwrite files in your MATLAB installation. On Linux systems, this is typically the root account.       Locate your MATLAB installation by typing matlabroot at the MATLAB command prompt. This folder is referred to as <MATLAB> in subsequent steps.       Exit MATLAB.       Download the attached .zip file associated with this Bug Report and store the file in the <MATLAB> folder.                    For each file that appears in the .zip file, find the corresponding file in your existing <MATLAB> folder and make a backup of it.  To see the contents of the .zip file:                                    Windows Systems*: Open the .zip file and look at the contents.                     Linux/Macintosh Systems: Type the following in a shell (Linux) or in a terminal window (Macintosh):unzip -l <MATLAB>/<.zip file>                                          Extract the files from the .zip file.                                                               Windows Systems*:                                                             Open the .zip file.                                  Extract the contents of the file to your <MATLAB> folder.                                                                                                Linux/Macintosh Systems: Type the following in a shell (Linux) or in a terminal window (Macintosh):                            cd <MATLAB>unzip <.zip file>                                                 Delete the .zip file in the <MATLAB> folder.  *Notes for Windows Systems:      You need administrative privileges to save the .zip file in the <MATLAB> folder.  To save the .zip file in the <MATLAB> folder, open this Bug Report in a browser started in administrator mode.    If you see ˇ°Error: Access is deniedˇ± when attempting to extract the .zip file, you  may need to start WinZip in administrator mode. Do this by navigating to  WinZip.exe or the WinZip Start menu entry, right-clicking on it, and selecting  Run as administrator.    From  within WinZip, find and open the downloaded .zip file.    Extract  the contents of the file to your <MATLAB> folder.  ",Stateflow,Other,R2013b,10 Sep 2015
1056832, Cannot set model coverage filter on two instances of the same atomic subchart from library.,User wants to set filter on both atomic subcharts of library (no1 and no2). no1:model/Subsystem/Chart/Statemachine no2:model/Subsystem/Chart/Statemachine1 Filter = transition [In_a==3] User can set filter on first one (ex.no1) but cannot set the same filter on another atomic subchart of library. (ex.no2) ,No worakround.,Simulink Check,Other,R2013b,28 Jul 2014
1024686, A coverage filter file is ignored in coverage simulation,The coverage filter is ignored if the coverage filter file is on the path but not in the current folder. ,"Installation instructionsLog in to an account with appropriate permissions to overwrite files in your MATLAB installation. On Linux systems, this is typically the root account.Locate your MATLAB installation by typing matlabroot at the MATLAB command prompt. This folder is referred to as <MATLAB> in subsequent steps.Exit MATLAB.Download the attached .zip file associated with this Bug Report and store the file in the <MATLAB> folder.Make a backup copy of each of the files listed in the .zip file. To see the contents of the .zip file: Windows Systems*: Open the .zip file and look at the contents.Linux/Macintosh Systems: Type the following in a shell (Linux) or in a terminal window (Macintosh):unzip -l <MATLAB>/<.zip file>Extract the files from the .zip file. Windows Systems*: Open the .zip file.Extract the contents of the file to your <MATLAB> folder.Linux/Macintosh Systems: Type the following in a shell (Linux) or in a terminal window (Macintosh): cd <MATLAB>unzip <.zip file>Delete the .zip file in the <MATLAB> folder.*Notes for Windows Systems:You need administrative privileges to save the .zip file in the <MATLAB> folder. To save the .zip file in the <MATLAB> folder, open this Bug Report in a browser started in administrator mode.If you see ˇ°Error: Access is deniedˇ± when attempting to extract the .zip file, you may need to start WinZip in administrator mode. Do this by navigating to WinZip.exe or the WinZip Start menu entry, right-clicking on it, and selecting Run as administrator.From within WinZip, find and open the downloaded .zip file.Extract the contents of the file to your <MATLAB> folder.",Simulink Check,Other,"R2013b, R2014a, R2014b",18 May 2015
1021444, Quick Control Oscilloscope does not use specified IVI-C driver,"After creating a Quick Control Oscilloscope object and specifying the driver to be used as the IVI-C driver, calling the connect() method on the object does not cause the object to use the IVI-C driver specified.  For example:  >> o = oscilloscope;  >> o.Resource = 'GPIB0::12::INSTR';  >> o.Driver= 'tktds2x0';  >> o.connect % The object will ignore the 'tktds2x0' driver specified. ",,Instrument Control Toolbox,Other,R2013b,09 Jan 2014
1008018, Crash in GLBridge when shutting down MATLAB,"When shutting down MATLAB, after using Simulink, sometimes MATLAB can crash.  Clicking the ""Details"" button in the crash dialog shows that a segmentation violation has occurred, and the first line of the call stack shows ""GLBridge::GLBridge"".",The problem is caused by an out-of-date toolboxcache file.  Restart MATLAB and run this command: >> rehash toolboxcache.This action repairs the toolboxcache file and prevents the problem from occurring again.,Simulink,Other,R2013b,22 Jul 2014
1007163, Copying files from Current Folder browser to Powerpoint? or Windows? Explorer can cause target application to crash,"Copying a file from the MATLAB? Current Folder browser and pasting it into Windows Explorer can cause Windows Explorer to crash. Also, copying an image file from the Current Folder browser to Microsoft? Powerpoint can cause Powerpoint to crash. ",This issue appears to have been resolved by some combination of Windows or Office updates.,MATLAB,Other,R2013b,16 Oct 2017
995706," The section ""Code an EDA Simulator Link MATLAB Test Bench Function"" contains incorrect paths to the files used in the example.","The section ""Code an EDA Simulator Link MATLAB Test Bench Function >  Sample MATLAB Test Bench Function"" lists the paths to the files used in the example as being:matlabroot\toolbox\hdlv\extensions\modelsim\modelsimdemos\vhdl\manchester\decoder.vhd andmatlabroot\toolbox\hdlv\extensions\modelsim\modelsimdemos\manchester_decoder.m However, the correct paths for these files are:matlabroot\toolbox\edalink\extensions\modelsim\modelsimdemos\vhdl\manchester\decoder.vhd andmatlabroot\toolbox\edalink\extensions\modelsim\modelsimdemos\manchester_decoder.m ",,HDL Verifier,Other,R2013b,08 Oct 2013
993247," System objects and a subset of functions return ""Unable to load"" errors.","Three required libraries that support the Computer Vision System Toolbox do not get installed. The absence of these libraries cause System objects and a subset of functions to return errors similar to the ones shown below. Errors seen in Mac OS X or Linux: Error using compSetParameters:  Unable to load /Applications/MATLAB_R2013b.app/toolbox/vision/visionutilities/visionmex/mvipcolorconv.mexmaci64 [error: dlopen(/Applications/MATLAB_R2013b.app/toolbox/vision/visionutilities/visionmex/mvipcolorconv.mexmaci64, 6): Library not loaded: @rpath/libmwSimulinkBlock.dylib Referenced from: /Applications/MATLAB_R2013b.app/toolbox/vision/visionutilities/visionmex/mvipcolorconv.mexmaci64 Reason: image not found]  Error seen in Windows: MATLAB:dispatcher:loadLibrary Can't load 'c:\program files\matlab\r2013b\bin\win32\systemobject_sfunmcos.dll': The specified module could not be found.   Caught MathWorks::System::FatalException   Note:If your installation includes either the Simulink, DSP System Toolbox, or the Image Acquisition Toolbox products, you will not experience this error. These products trigger the installation of the required libraries. ","Installation instructionsLog in to an account with appropriate permissions to overwrite files in your MATLAB installation. On Linux systems, this is typically the root account.Locate your MATLAB installation by typing matlabroot at the MATLAB command prompt. This folder is referred to as <MATLAB> in subsequent steps.Determine the platform architecture by typing computer('arch') at the MATLAB command prompt. The returned string is referred to as <ARCH> in subsequent steps.Exit MATLAB.Download attachment_993247_13b_<ARCH>_2013-09-18.zip from below and store it in the <MATLAB> folder.Extract the files from the .zip file. The files will automatically be placed into <MATLAB>/bin/<ARCH> after extraction. If you extracted each file in the .zip file individually, then you must move them into the <MATLAB>/bin/<ARCH> folder manually.Windows Systems*: Open the .zip file.Extract the contents of the file to your <MATLAB> folder.Linux/Macintosh Systems: Type the following in a shell (Linux) or in a terminal window (Macintosh): cd <MATLAB>unzip <.zip file>Delete the .zip file in the <MATLAB> folder.*Notes for Windows Systems:You need administrative privileges to save the .zip file in the <MATLAB> folder. To save the .zip file in the <MATLAB> folder, open this Bug Report in a browser started in administrator mode.If you see ˇ°Error: Access is deniedˇ± when attempting to extract the .zip file, you may need to start WinZip in administrator mode. Do this by navigating to WinZip.exe or the WinZip Start menu entry, right-clicking on it, and selecting Run as administrator.From within WinZip, find and open the downloaded .zip file.Extract the contents of the file to your <MATLAB> folder.Change Log:September 18, 2013: initial version. added attachment_993247_13b_glnxa64_2013-09-18.zip, attachment_993247_13b_win64_2013-09-18.zip, attachment_993247_13b_win32_2013-09-18.zip, attachment_993247_13b_maci64_2013-09-18.zip.",Computer Vision Toolbox,Other,"R2013b web release, R2014a",15 Sep 2016
989850, Help browser display is unformatted when the installed version of Internet Explorer is IE 11,"For some users, the display in the Help browser is unformatted. This may happen when they access the installed documentation from MATLAB? and the installed version of Internet Explorer is IE 11. ","Apply the attached patch using the following instructions. Installation instructionsLog in to an account with appropriate permissions to overwrite files in your MATLAB installation. On Linux systems, this is typically the root account.Locate your MATLAB installation by typing matlabroot at the MATLAB command prompt. This folder is referred to as <MATLAB> in subsequent steps.Exit MATLAB.Download the attached .zip file associated with this Bug Report and store the file in the <MATLAB> folder.Make a backup copy of each of the files listed in the .zip file. To see the contents of the .zip file: Windows Systems*: Open the .zip file and look at the contents.Linux/Macintosh Systems: Type the following in a shell (Linux) or in a terminal window (Macintosh):unzip -l <MATLAB>/<.zip file>Extract the files from the .zip file. Windows Systems*: Open the .zip file.Extract the contents of the file to your <MATLAB> folder.Linux/Macintosh Systems: Type the following in a shell (Linux) or in a terminal window (Macintosh): cd <MATLAB>unzip <.zip file>Delete the .zip file in the <MATLAB> folder.*Notes for Windows Systems:You need administrative privileges to save the .zip file in the <MATLAB> folder. To save the .zip file in the <MATLAB> folder, open this Bug Report in a browser started in administrator mode.If you see ˇ°Error: Access is deniedˇ± when attempting to extract the .zip file, you may need to start WinZip in administrator mode. Do this by navigating to WinZip.exe or the WinZip Start menu entry, right-clicking on it, and selecting Run as administrator.From within WinZip, find and open the downloaded .zip file.Extract the contents of the file to your <MATLAB> folder.",MATLAB,Other,R2013b,17 Nov 2015
984860, Cannot open Simulink? model files from MATLAB? Current Folder browser,"Attempting to open Simulink? model files from the MATLAB? Current Folder browser opens the Import Wizard, and does not open the model.The same behavior is observed when executing the following in the MATLAB? Command Window:open('myModel.slx');  ","Installation instructions       Log in to an account with appropriate permissions to overwrite files in your MATLAB installation. On Linux systems, this is typically the root account.       Locate your MATLAB installation by typing matlabroot at the MATLAB command prompt. This folder is referred to as <MATLAB> in subsequent steps.       Exit MATLAB.       Download the attached .zip file associated with this Bug Report and store the file in the <MATLAB> folder.                     Make a backup copy of each of the files listed in the .zip file. To see the contents of the .zip file:                                    Windows Systems*: Open the .zip file and look at the contents.                     Linux/Macintosh Systems: Type the following in a shell (Linux) or in a terminal window (Macintosh):unzip -l <MATLAB>/<.zip file>                                          Extract the files from the .zip file.                                                               Windows Systems*:                                                             Open the .zip file.                                  Extract the contents of the file to your <MATLAB> folder.                                                                                                Linux/Macintosh Systems: Type the following in a shell (Linux) or in a terminal window (Macintosh):                            cd <MATLAB>unzip <.zip file>                                                 Delete the .zip file in the <MATLAB> folder.  *Notes for Windows Systems:      If you see ˇ°Error: Access is deniedˇ± when attempting to extract the .zip file, you  may need to start WinZip in administrator mode. Do this by navigating to  WinZip.exe or the WinZip Start menu entry, right-clicking on it, and selecting  Run as administrator.    From  within WinZip, find and open the downloaded .zip file.    Extract  the contents of the file to your <MATLAB> folder.  Change log:Sep 20, 2013: attachment_984860_13a_2013-09-20.zip : Initial version, works only on R2013a for all platforms",MATLAB,Other,R2013b,26 Sep 2013
984371, VideoReader produces corrupt frames when reading Xvid encoded AVI files,"On Windows? 7 systems with the Xvid 1.3.2 codec installed, reading Xvid encoded AVI files using VideoReader  can result in corrupt frames.For example, the following code produces corrupt frames:   >> vidObj = VideoReader('myxvidfile.avi');    % The call to read produces a corrupt frame   >> frame = read(readerObj,1);   In some rare occasions, this causes MATLAB? to crash.","Installation instructions       Log in to an account with appropriate permissions to overwrite files in your MATLAB installation.       Locate your MATLAB installation by typing matlabroot at the MATLAB command prompt. This folder is referred to as <MATLAB> in subsequent steps.       Exit MATLAB.       Download the attached .zip file associated with this Bug Report and store the file in the <MATLAB> folder.                     Make a backup copy of each of the files listed in the .zip file. To see the contents of the .zip file:                                    Open the .zip file and look at the contents.                                          Extract the files from the .zip file.                                                               Windows Systems*:                                                             Open the .zip file.                                  Extract the contents of the file to your <MATLAB> folder.                                                                            Delete the .zip file in the <MATLAB> folder.  *Notes for Windows Systems:      If you see ˇ°Error: Access is deniedˇ± when attempting to extract the .zip file, you  may need to start WinZip in administrator mode. Do this by navigating to  WinZip.exe or the WinZip Start menu entry, right-clicking on it, and selecting  Run as administrator.    From  within WinZip, find and open the downloaded .zip file.    Extract  the contents of the file to your <MATLAB> folder.  Change log:Sept 6, 2013: attachment_984371_13a_win32_2013-09-06.zip : Initial version, works only on R2013a for 32-bit WindowsSep 6, 2013: attachment_984371_13a_win64_2013-09-06.zip : Initial version, works only on R2013a for 64-bit Windows",MATLAB,Other,R2013b,16 Sep 2013
