Bug Id,Summary,Description,Workaround,Products,Type,Fixed In,Modified Date
1953983, Output modules not synchronized with NI 9215 (BNC),"Output modules and the NI 9215 (BNC) are not automatically synchronized when they are in the same CompactDAQ chassis. ?For example, the following code shows that an input can be significantly out of phase with the output. s = daq.createSession('ni');% NI cDAQ-9179 (cDAQ2)aiDev = 'cDAQ2Mod8'; % NI 9215 (BNC)aoDev = 'cDAQ2Mod6'; % NI 9263addAnalogOutputChannel(s, aoDev, 0, 'Voltage');addAnalogInputChannel(s, aiDev, 0, 'Voltage');s.Rate = 25000; f = 1000;A = 1;t = linspace(0,1,round(s.Rate))';Vout = A*sin(2*pi*f*t);%%queueOutputData(s, repmat(Vout,1,numChannels))[Vin, timestamps] = startForeground(s);figureplot(t, Vin(:,1),'o',timestamps,Vout,'x')xlim([0 0.005])xlabel('Time (s)')ylabel('Voltage (V)') ",,Data Acquisition Toolbox,Other,"R2018b Update 5, R2019a Update 1, R2019b",16 Aug 2019
1953732, Misconfigured bus ports with bus objects might cause MATLAB to crash,"When a bus object defines an element in a bus port, the bus object determines the data type of all elements of the bus. Changing the data type of the elements of the bus from the block dialog is not supported. If you add an element to the bus that does not exist in the bus object and set its data type to a bus object, MATLAB might crash.",,Simulink,Other,"R2019a Update 1, R2019b",24 Apr 2019
1953577, JavaScript TypeError when saving an App Designer app,"If you attempt to save an app without ever visiting the App Designer Code View, MATLAB throws the following error instead of saving the app: TypeError: Cannot read property 'length' of undefined   ",,MATLAB,Other,"R2019a Update 1, R2019b",24 Apr 2019
1953309, LTE HDL SIB1?Recovery example failing to decode PDSCH due to incorrect interpretation of transport block length,"In the LTE HDL SIB1 Recovery example, the DCI message parsing section (ltehdlDCIResourceAllocation) sometimes wrongly interprets the transport block length. This error results in failure to decode the PDSCH. ",,Wireless HDL Toolbox,Other,"R2019a Update 3, R2019b",14 Jun 2019
1953282, Saving model to previous version breaks XCP block library links,"When you export a model containing XCP blocks to an earlier version with the option File >? Export Model to > Previous Version  then open the exported model in the older release, the blocks appear as broken library links. ",,Vehicle Network Toolbox,Other,"R2019a Update 1, R2019b",24 Apr 2019
1952779," Incorrect coverage for first assignment statement in Stateflow state when ""on"" state action is present","When analyzing coverage for a Stateflow state in a C Chart, the Condition and MCDC results for the first logical assignment statement in the state might be incorrect if this state also contains an ""on..."" state action. For example, consider a state with entry  and on  actions. State1  en:?  ? a = w &amp;&amp; x;  ? b = y &amp;&amp; z;  on every(1, tick):  ? c = x || y;   MCDC and Condition coverage results for the logical expression (w &amp;&amp; x)  found in the first assignment statement might be incorrect.? Note that this issue only affects coverage for this first assignment in the state.",,"Simulink Design Verifier, Simulink Coverage",Other,"R2018b Update 4, R2019a, R2019b",26 Mar 2019
1952687, Maximum path length exceeded during parallel build of referenced models on Windows,"The Windows operating system imposes a limit on the maximum length of a file path. Parallel building of referenced models might generate file paths that exceed the limit. For example, if: Referenced models have long names. The Windows operating system's temporary folder has a long file path.  ","On Windows, the TMP and TEMP environment variables specify the location of the temporary folder. By default, the environment variables specify a subfolder in the Users folder. To reduce the length of the file path, specify a location that is closer to the root of the drive. For example, C:\Temp.",Simulink Coder,Other,"R2019a Update 1, R2019b",24 Apr 2019
1952405, MEX command not work outside of MATLAB on Windows,mex  command does not work outside of MATLAB on Windows in R2018b.,"From the system operating prompt, type:<matlabroot>\bin\win64\mexwhere?<matlabroot> is the value returned by the matlabroot command.",MATLAB,Other,"R2018b Update 4, R2019a",26 Mar 2019
1952215, EtherCAT Sync SSC/SoE Download block handles the IDN value incorrectly,"The EtherCAT Sync SSC/SoE Download block handles the IDN (identification number) value incorrectly, passing the wrong value to the S-function for the IDN. This issue results in incorrect EtherCAT device configuration. Depending on the EtherCAT device, this can result in incorrect answers or an error message when running the model on the target.?  ",Adapt your model to use the EtherCAT Async SSC/SoE Download block rather than the EtherCAT Sync SSC/SoE Download block.,Simulink Real-Time,Other,"R2018b Update 4, R2019a Update 1, R2019b",15 Aug 2019
1952171," Coverage not recorded for assignments under ""on"" state actions in C Charts","When analyzing coverage for Stateflow states in C Charts, coverage is recorded for logical expressions in assignment statements only when these statements are found under the entry , during , or exit  state actions.? Assignment statements under ""on "" state actions (such as ""on event_name "" or ""on every(1, tick) "") are not analyzed for coverage.",,"Requirements Toolbox, Simulink Design Verifier, Simulink Coverage, Simulink Check",Other,"R2018b Update 4, R2019a, R2019b",26 Mar 2019
1952084, Inference on vector regression networks errors for different sized inputs,Inference on vector regression networks errors when the following conditions hold true-?? 1. Input size during inference is different than the one used for training. 2. The input is passed to the network through a transform or combine datastore. ,,Deep Learning Toolbox,Other,"R2019a Update 1, R2019b",01 Oct 2019
1951976," If the axle torque input is zero, the Longitudinal Wheel and Combined Slip Wheel 2DOF blocks do not use the initial angular velocity block parameters","If the axle torque input port AxlTrq ?is zero, the Longitudinal Wheel and Combined Slip Wheel 2DOF blocks do not use the initial angular velocity block parameters. Specifically, theCombined Split Wheel 2DOF block does not use the Initial rotational velocity, omegao  parameter Longitudinal Wheel block does not use the?Wheel initial angular velocity, omegao ?parameter  ","Do not provide the axle torque?AxlTrq? input port a signal that is exactly zero. Instead, you can use a signal that is near zero, for example 2*eps N*m, where eps is a very small number approaching zero. To achieve this, consider either approach:??Use a Sum block to add the axle torque signal to a Constant block with a value set to 2*eps?Use an IC block to set the initial condition of the axle torque?AxlTrq?input signal to??2*eps",Vehicle Dynamics Blockset,Other,"R2018b Update 4, R2019a",26 Mar 2019
1951837, MATLAB displays stale data in uitable when size of data changes,"If a?uitable ?is created with a large data set, and then the data set size is reduced and then increased again, MATLAB?displays stale fields of the data. For example MATLAB displays stale data when this code is run: u = uitable(uifigure);drawnow;pause(1);u.Data = array2table(ones(10));drawnow;pause(1);u.Data = array2table(randn(2));drawnow;pause(1);u.Data = array2table(zeros(10));","After resizing the data in the uitable, assign random data of the same size to it before assigning it the actual data.For example:?u = uitable(uifigure);drawnow;pause(1);u.Data = array2table(ones(10));drawnow;pause(1);u.Data = array2table(randn(2));drawnow;pause(1);u.Data = array2table(randn(10));drawnow;pause(1);u.Data = array2table(zeros(10));",MATLAB,Other,"R2019a Update 6, R2019b",11 Oct 2019
1951322, Code inspection fails to verify the code for the elements of a bus object that originate from Simulink.Signal object outside of Stateflow Chart,Simulink Code Inspector fails to verify the generated code from a model that meets the following conditions: The model contains a Stateflow chart. The chart contains a non-inlined graphical function. The function selects elements from a bus object that is specified on a Simulink.Signal  object outside of the chart.?  The code that Simulink Code Inspector fails to verify is similar to the following: BusObject.<BusElement> = 5;  ,,Simulink Code Inspector,Other,"R2019a Update 2, R2019b",17 May 2019
1951084, Polyspace Access times out when the database is too large,"When you try you to access the Polyspace Access database, you see this error message:   The server response timed out. This is caused by a performance issue when there are too many results stored in the database. ",Clean up your database by regularly deleting old and obsolete results.,Polyspace Access,Other,"R2019a Update 1, R2019b",07 Oct 2019
1950912, Incorrect Code Generation: While-loop used to increment or decrement a single variable omitted from the generated code,"Incorrect results are possible for a MATLAB function containing a while-loop with the following properties: The expression for the while-loop condition is a simple relational comparison between a variable and a constant (for example, k < 5 or k >= 10). In the following text, this variable is referred to as the loop induction variable. The body of the loop contains a statement in which the loop induction variable is incremented or decremented by a constant (for example, k = k + 1 or k = k - 5). The body of the while loop contains no other statements. The loop induction variable is assigned to a persistent variable after the while-loop.  The code generator might incorrectly omit code for the while-loop. For an example see the file issue_example_1950912.m in the attached issue_1950912.zip:  persistent P6;?  [SNIP]?  P31 = 1;  while P31<=6     P31 = P31 + 1;  end  P6( 1, 1 ) = P31( 1, 1 ); In the generated code? for issue_example_1950912, there is no loop corresponding to the while-loop above. This can be observed by comparing the numeric result of the generated Mex file against MATLAB:?  >> cfg = coder.config('mex');>> cfg.IntegrityChecks = 0;>> cfg.ResponsivenessChecks = 0;>> codegen -config cfg issue_example_1950912>> [~,~,~,ml_out] = issue_example_1950912();>> [~,~,~,cg_out] = issue_example_1950912_mex();>> disp(ml_out - cg_out)   56 ","Replace the while-loop with an assignment to the final value of the loop induction variable. For an example see issue_workaround_1950912.m:  persistent P6;?  [SNIP]?  P31 = 7;  P6( 1, 1 ) = P31( 1, 1 );>> cfg = coder.config('mex');>> cfg.IntegrityChecks = 0;>> cfg.ResponsivenessChecks = 0;>> codegen -config cfg issue_workaround_1950912>> [~,~,~,ml_out] = issue_workaround_1950912();>> [~,~,~,cg_out] = issue_workaround_1950912_mex();>> disp(ml_out - cg_out)?   0",MATLAB Coder,Incorrect Code Generation,"R2018b Update 5, R2019a Update 1, R2019b",16 Aug 2019
1950434, Identify Modeling Clones tool might not detect clones when Maximum number of different parameters parameter is set to a value greater than 0,"The Identify Modeling Clones tool might not detect clones when the Maximum number of different parameters  parameter is set to a value greater than 0 for a model that meets these conditions: The model contains a signal that branches and connects to blocks that are of the same type.? One of these blocks is commutative, and the other block is noncommutative.  For example, a signal might branch and connect to two Product blocks. One Product block is noncommutative because the Number of Inputs  block parameter is set to */ . The other Product block is commutative because the Number of Inputs   block parameter is set to ** . ",,Simulink Check,Other,"R2019a Update 3, R2019b",02 Jul 2019
1950400, Whitespace converted to '+' symbol when searching the MATLAB documentation,"When searching the MATLAB documentation either in the Help browser or by using the?docsearch ?command,? any whitespace character in the search term is converted to a '+' symbol.  For example, the command?docsearch plot tools ?returns search results for ""plot+tools"" instead of ""plot tools"". This is an issue because the search term ""plot+tools"" only returns results where the two words are exactly sequential while the search term ""plot tools"" returns results that contain the two words anywhere in the document. ",,MATLAB,Other,"R2019a Update 2, R2019b",17 May 2019
1950312, Variable Editor cannot be launched from the Model Explorer Dialog pane for custom attribute properties of data objects,"In the Model Explorer Dialog pane, when you select?Open Variable Editor  from the menu near the value for a custom attribute property of a data object, the Variable Editor does not launch. ",Launch the dialog from the custom attribute property in the Model Explorer?Contents?pane.?,Simulink,Other,"R2018b Update 5, R2019a Update 3, R2019b",16 Aug 2019
1950254, Code inspection fails or MATLAB crashes when local data is defined but not used inside a non-inlined graphical function in Stateflow chart,MATLAB might crash or code inspection might fail for a model that meets all of these conditions: The model contains a non-inlined graphical function inside a Stateflow chart. The chart contains locally-scoped data that is defined inside the non-inlined graphical function but is not used. The unused local data is optimized out of the generated code.??  Simulink Code Inspector does not ignore the local data causing MATLAB to crash during code inspection or for Simulink Code Inspector to fail.,,Simulink Code Inspector,Other,"R2019a Update 2, R2019b",17 May 2019
1950183, MATLAB might crash during code generation from a model with large (>2000) partitions,Creating more than about 2000 distinct rates or partitions in a model might cause MATLAB to crash during code generation. ,,"Simulink Coder, MATLAB Coder",Other,"R2019a Update 1, R2019b",26 Apr 2019
1949459, Error when opening App Designer app saved over a later release app,"If you save an app, created in R2017b or earlier, over an existing app saved in App Designer release R2018a or later, the saved app file is corrupted. The error that displays when attempting to open the app in releases R2018a, R2018b, and R2019a is?Reference to non-existent field 'code' . The saved app opens without error in releases R2017b and earlier. ","When saving an app in App Designer in releases older than R2017b, either:* Do not choose an existing file saved in R2018a, R2018b, or R2019a* Save the app to a new file, not an existing one.?",MATLAB,Other,"R2018b Update 5, R2019a Update 3, R2019b",16 Aug 2019
1949309, Tooltips that indicate an error or warning state are missing icons,"Tooltips that indicate an error or warning state in MATLAB, Simulink, or toolbox apps are missing the error (!) or information (i) icons. ",,MATLAB,Other,"R2019a Update 2, R2019b",17 May 2019
1949133, Simulink can crash during upgrade of models using the Upgrade Advisor,"When upgrading models to a new release of Simulink using the Upgrade Advisor, Simulink may crash.? This occurs after there has been an error saving one of the models.? ","Change settings to ensure that no errors will occur when saving the models.? Two such settings are ""Block diagram contains disabled library links"" and ""Block diagram contains parameterized library links"" in the ""Diagnostics"" section of the Configuration Parameters window.? Alternatively:? set_param(modelname,'SaveWithDisabledLinksMsg','warning')? set_param(modelname,'SaveWithParameterizedLinksMsg','warning')?",Simulink,Other,"R2018b Update 6, R2019a Update 2, R2019b",19 Dec 2019
1948768, Line-level traceability can lead to exceedingly long HDL code generation time,"On the HDL Code Generation > Report  pane, you can specify the TraceabilityStyle . By default, the?TraceabilityStyle ?is line-level . When you use this option and enable Generate traceability report , in some cases, the report generation can take a significantly long time. ",Specify comment-based as the?TraceabilityStyle and then generate the traceability report.,HDL Coder,Other,R2019a,12 Dec 2019
1948756, Allowed temperature ranges for thermocouples are narrower than those supported by National Instruments,"Data Acquisition Toolbox supports temperature ranges for thermocouple channels that are narrower than the ranges supported in NI-MAX.  For instance, using NI 9214 or NI USB-TC01, the range supported by the toolbox for a type J thermocouple is 0 to 750 degrees Celsius, while NI-MAX supports a range of -200 to 1200 degrees Celsius. The following code indicates the limited toolbox range: s=daq.createSession('ni');addAnalogInputChannel(s,'Dev1',0,'Thermocouple');s.Channels(1).ThermocoupleType = 'J';s.Channels(1).Rangeans =0 to +750 Celsius  ",,Data Acquisition Toolbox,Other,"R2019a Update 1, R2019b",20 Jun 2019
1948494, C Caller Block displays the same error message when issue with custom code is fixed,"The C Caller Block displays an error if a header file is missing or the file name is wrong. When you fix the issue and rerun the model,? the same error message is displayed.","Rename the header file, insert an empty line in the source code C file, and rerun the model.",Simulink,Other,"R2018b Update 5, R2019a Update 5, R2019b",26 Nov 2019
1948275, Error when exporting a project using relative path,"If you export a project using export(project)  and use a relative path, the export succeeds, but you see an error similar to the following: Error using matlab.project.Project/export?  Could not create the file ""timestableproj.mlproj"". foundation::storage::vfs::InvalidIRIException  ",,MATLAB,Other,"R2019a Update 2, R2019b",17 May 2019
1948166, Slower MCDC analysis of Test Harness model compared to regular model,"Simulation of a Simulink test harness takes a longer time to complete when model coverage analysis is enabled and the structural coverage level is set to?Modified Condition Decision Coverage (MCDC) .  By comparison, MCDC analysis of an equivalent model that is not configured as a test harness takes less time to complete.?? ","To work around the issue, do one of the following:Disable the MCDC metric if it is not necessary for your coverage analysis. Changing the structural coverage level to Condition Decision should improve performance.? This setting can be adjusted via the Coverage pane of the Configuration Parameters or by manually setting the value of the corresponding parameter?CovMetricStructuralLevel.If MCDC analysis is necessary, then avoid running this analysis on test harnesses. Instead, detach and export the test harness, then perform the coverage simulation on the resulting model. To export an individual test harness, from?the test harness menu, select?Analysis?>?Test Harness?>?Detach and Export Harness, as described in the documentation page?Manage Test Harnesses.","Requirements Toolbox, Simulink Check, Simulink Coverage, Simulink Design Verifier",Other,"R2018b Update 4, R2019a, R2019b",26 Mar 2019
1948091, Simulating harness model containing a library block with coverage filter leads to error,Simulating a harness model containing a library block with a coverage filter leads to an error:An error occurred during simulation of Model block '...'. Model 'simulink' is not loaded. A fatal error occurred when accessing the coverage tool: cvi.TopModelCov.modelStart?  ,,Simulink Coverage,Other,"R2019a Update 7, R2019b",13 Feb 2020
1948052, Assertion error when generating code for model : 'In computeAndSetType: Type checker is unable to infer the type of Node 'hcat'. Please provide the type explicitly.'?,Simulink might error unexpectedly when generating code for a model with the message: CGIR assertion 'In computeAndSetType: Type checker is unable to infer the type of Node 'hcat'. Please provide the type explicitly.'?  This error might occur when the model uses one or more Simulink.AliasType? objects ?and one or more of the following conditions is true: The model contains concatenation of a?Simulink.AliasType ?signal with a signal that has the same data type as the BaseType  of the Simulink.AliasType .  The model contains concatenation of different Simulink.AliasType ?signals that have the same specified BaseType . The model contains concatenation of a Simulink.AliasType ?signal with a signal driven by a Constant block.  For examples of this issue see the models within issue_1948052.zip: issue_model_1948052_signal_mismatch and issue_model_1948052_parameter_mismatch. In issue_model_1948052_signal_mismatch there are Mux blocks that concatenate a signal of?single_alias ?type and?single ?type. In issue_model_1948052_parameter_mismatch there is a Mux block driven by a signal of single_alias  type and a Constant block . ,"Adjust the model so that signals of the exact same data type drive the inports of blocks that perform concatenation (for example, Mux and Vector Concatenate). This may involve:Replacing the use of a Simulink.AliasType with its specified BaseType.?Replacing the uses of two or more?Simulink.AliasTypes of the same BaseType with a single?Simulink.AliasType.Inserting a Data Type Conversion block to unify the types of signals feeding a block performing concatenation.?A workaround for issue_model_1948052_signal_mismatch can be seen in the attached model issue_workaround_1948052_signal_mismatch. All inputs in the model have been adjusted to have a single_alias type. This unified all signals driving mux blocks to have the type single_alias.If a constant block is driving a concatenating block like issue_model_1948052_parameter_misatch, use a Simulink.Parameter to specify the value of the Constant block driving the concatenating block with properties:A?DataType?matching the Simulink.AliasType driving the other inports of the concatenating blockA storage?class other than AutoA workaround for issue_model_1948052_parameter_mismatch can be see in the attached model issue_workaround_1948052_parameter_mismatch. The value of the Constant block is now specified as single_alias_ONE which resolves to a Simulink.Parameter with DataType single_alias and a Const storage class specification.",Embedded Coder,Other,"R2018b Update 5, R2019a",16 Aug 2019
1947815, Check data types for blocks with index signals incorrectly flags an index that contains a math operation,The Model Advisor check Check data types for blocks with index signals ?(Check ID: mathworks.hism.hisl_0022 ) might incorrectly flag blocks that use arithmetic operators (+/-)? to calculate index variables.,,Simulink Check,Other,"R2018b Update 7, R2019a, R2019b",06 Feb 2020
1947764, Labeling data not saved when exiting Signal Analyzer while in?Signal Labeler,"If, while you are using?Signal Labeler, you close the Signal Analyzer app by using the X  or Close button? in the title bar, a dialog box prompts you about saving the app data. If you click Yes , only the signal data is saved. No labeling data is saved. ",,Signal Processing Toolbox,Other,"R2019a Update 1, R2019b",24 Apr 2019
1947735, Label data might be deleted if extracted signal is deleted,"In Signal Analyzer, if you extract a signal from a plotted member of a labeledSignalSet ?object and then delete the signal, the labeling information is lost. This bug affects the labeledSignalSet ?only in the scope of Signal Analyzer. Any label data from the labeledSignalSet  in the MATLAB workspace remains intact. ",,Signal Processing Toolbox,Other,"R2019a Update 1, R2019b",24 Apr 2019
1947432, Links for plotting scripts in the Model a Road Profile with Varying Elevation and Friction example do not work,"The documentation for Model a Road Profile with Varying Elevation and Friction example shows how to convert the model in the Four-Wheel Drive Testbed example into the model in the Four-Wheel Drive Testbed with Road Profile example by adding a Road Profile block. The model in the Four-Wheel Drive Testbed with Road Profile compiles and runs without issue, but the links in the model annotation?cannot access code that automatically plots speed and compares differentials.? ",,Simscape Driveline,Other,"R2019a Update 1, R2019b",24 Apr 2019
1947358, Unsupported input type error when creating link between reference objects,"Creating a link between objects of type slreq.Reference  by using the slreq.createLink()  function may throw an?error. The error occurs when running the following command with the first argument being an object of type slreq.Reference  imported from an external tool via ReqIF? file: >> slreq.createLink(ref1, ref2)?  Error using slreq.utils.resolveSrc (line 127) slreq.utils.resolveSrc() does not support input of type slreq.Reference  ",,Requirements Toolbox,Other,"R2019a Update 1, R2019b",24 Apr 2019
1947356, Inconsistent outputfrom Inport blocks that load string data in fast restart simulations?,"When you run multiple simulations in fast restart of a model that loads string data, the Inport block output for the first simulation can differ from the output in subsequent simulations. If the simulation stop time exceeds the time corresponding to the last value in the external input data, the first simulation uses ground values and subsequent simulations hold the last external input value. ",,Simulink,Other,"R2019a, R2019b",03 Jun 2019
1947018, MATLAB might crash when calling segmentGroundFromLidarData,MATLAB might crash when you call the?segmentGroundFromLidarData ?function.  ,,Computer Vision Toolbox,Other,R2019a,04 Apr 2019
