Bug Id,Summary,Description,Workaround,Products,Type,Fixed In,Modified Date
2015596, Simulink.Signal object property InitialValue on root outport of referenced model is ignored in certain cases,"Simulink can produce incorrect numeric results when each of the following conditions are true: Simulink.Signal  object is resolved for signal feeding root outport of referenced model. Simulink.Signal  object has property InitialValue  and a custom storage class specified. Referenced model is conditionally executed. For example, the model is triggered or enabled.? Top model is set to accelerator or rapid accelerator simulation mode, or the parent model is a referenced model that uses an accelerated simulation mode.   ",There are 2 ways to work around this problem:Specify the?InitialOutput property?on the outport block of the referenced model instead of specifying the InitialValue property on the?signal object.Simulate the top model and referenced models in normal simulation mode.,Simulink,Other,"R2018b Update 7, R2019a Update 7, R2019b Update 4, R2020a",19 Mar 2020
2014947, Incorrect Code Generation: Mismatch between simulation and code generation results might occur?for CORDIC atan2 function in Trigonometric Function block?when block input is negative minimal value of its data type,"Mismatch between simulation and code generation results might occur for a Trigonometric Function block under these conditions: Function ?parameter is set to atan2.  Approximation method  parameter is set to CORDIC. Data type of both inputs is signed integer or signed fixed-point. Value of either input is the negative minimal value of its data type. For example, the negative minimal value for int8 is?-128 .  ",,Simulink,Incorrect Code Generation,"R2018b Update 5, R2019a Update 5, R2019b, R2020a",19 Mar 2020
2014352, MATLAB crashes when creating analysis model if component linked to Simulink behavior model,MATLAB crashes when trying to create an analysis model from the UI or API. The crash occurs when the architecture model contains one or more components that are linked to a Simulink behavior model.,,System Composer,Other,"R2019a Update 4, R2019b",15 Jul 2019
2014289," Code generation may fail with a For-Iterator,Variant subsystem and a Merge block","Code generation errors out when all below conditions are met :  ?A variant subsystem?with GeneratePreprocessorConditionals  on, contains a For-Iterator subsystem inside one of the choices  The For-Iterator subsystem drives the output of the variant subsystem, which is connected to a Merge block   An example error message:?? The signal from 'model/block1/blocksys_two/If Action Subsystem1/Variant Subsystem/VARIANT_ONE/Subsystem/Assignment' output port 1 is required to be persistent, hence this signal cannot be connected to a Merge block?  ",,Simulink,Other,"R2018b Update 5, R2019a Update 5, R2019b",16 Aug 2019
2014070, Skip button ignored during the Find Dependencies step of Bus Refactoring,"If you modify a bus name or a bus element name in a project using the Bus Editor, then the project performs an analysis to evaluate the impact of the change. You see a progress dialog with a skip button. If you click the skip button immediately after the dialog is shown, the dialog might close without cancelling the operation. MATLAB might be left busy for some time, and then you see the results showing the impact of the change.? ",Wait for the analysis of the first file to start before clicking skip. The progress dialog closes and MATLAB finishes analyzing the current file before cancelling the operation.,Simulink,Other,"R2019a Update 4, R2019b, R2020a",19 Mar 2020
2013820, Incorrect Code Generation: Incorrect results might occur for Identify Matrix block,"Incorrect code might be generated for a model that meets both of these conditions:  An Identity Matrix block (from the DSP System Toolbox block set) directly feeds into the Root Outport block. The signal at the output of the Identity Matrix?block has a non-Auto custom storage class (for example, ExportToFile ).   ",,Embedded Coder,Incorrect Code Generation,"R2018b Update 5, R2019a Update 4, R2019b",16 Aug 2019
2013768, Integration between MATLAB and Polyspace breaks after MATLAB is updated,"If you have previously linked a MATLAB and Polyspace installation, after updating MATLAB, you can no longer access the Polyspace functions. The issue happens because some parts of the MATLAB-Polyspace integration are reset when MATLAB is updated. ","After updating MATLAB, uninstall the previous link between MATLAB and Polyspace and repeat the steps to link the two installations.See the documentation for details:?https://www.mathworks.com/help/bugfinder/ug/integrate-polyspace-with-matlab-and-simulink.html.",Polyspace Bug Finder,Other,"R2019a Update 5, R2019b",16 Aug 2019
2013396, svd can return invalid NaN values in the singular vectors of some rare matrices.,"For a few rare matrices, [U,S,V] = svd(A) ?returns the?singular vectors in the columns of U  and V  with incorrect NaN  entries. >> [U,S,V] = svd(A);>> any(isnan(V(:))) | any(isnan(U(:)))  ans =??  ? ? ? 1?  ",,MATLAB,Other,"R2018b Update 5, R2019a Update 5, R2019b",16 Aug 2019
2013057, Template makefile build process generates file-specific makefile rules that use absolute paths,"If you use the template makefile approach, the build process compiles source files by using file-specific makefile rules. The rules use absolute paths instead of tokenized paths, e.g.?$(START_DIR)/path  .  The use of absolute paths might produce build errors if:  Your workflow involves a makefile relocation that causes the absolute path to become invalid.  An absolute path contains a space.    ","If a space in a source file path causes a build error, move the file to a folder on a file path that does not contain a space.If your build folder name contains a space, then change your build folder to a folder that does not have a space in its file path.",Simulink Coder,Other,"R2019a Update 7, R2019b Update 4, R2020a",19 Mar 2020
2012587, Roundtripping between IBM DOORS Next Generation and Simulink Requirements using ReqIF might fail,"Roundtripping is the process of exporting, importing, and updating requirements between DOORS Next Generation and Simulink Requirements. Roundtripping follows the process: Export content from IBM DOORS Next Generation into a ReqIF file. Import the ReqIF file into Simulink Requirements. Unlock and edit the requirement data in Simulink Requirements. Export from Simulink Requirements into a ReqIF file, using the previous import settings. Re-import the ReqIF file into IBM DOORS and have IBM DOORS merge/update changes to the requirement data.   Step 5 can result in an error such as ""Import failed"" .  ",,Requirements Toolbox,Other,"R2019a Update 3, R2019b",14 Jun 2019
2012585, Application does not synchronize PTP (IEEE 1588) clock to grand master PTP device,"A Simulink Real-Time application does not synchronize its Precision Time Protocol (PTP) clock with other parties when the following conditions are true: The application includes an IEEE 1588 Real-Time UDP  block.  The block parameter Destination IP address of transmit packets  is set to Standard PTP multicast .   If the block parameter Slave Only  is set, the protocol remains in the Initializing  state (value 4) instead of the Slave  state (value 9). If the block parameter Slave Only  is not set, the protocol enters the Master  state (value 6) instead of the Slave  state (value 9), even when a third party device (for example, Grand Master Clock) is in Master  state. ","Set the block parameter ""Destination IP address of transmit packets"" to ""Specify"" and use the address ""255.255.255.255"". Note that third party PTP applications in the network must be configured in the same way.",Simulink Real-Time,Other,"R2018b Update 5, R2019a Update 3, R2019b, R2020a",28 Jul 2022
2012495, Scale to fit fails for tall images,"The DOM API ScaleToFit format fails to scale images that are too tall to fit between the top and bottom margins of a page. This issue occurs in both Microsoft Word and PDF output. The following script illustrates the issue. import mlreportgen.dom.*d = Document('repro_pdf_portrait', 'docx');open(d);plo = d.CurrentPageLayout;plo.PageMargins.Top = '4in';plo.PageMargins.Bottom = '4in';plo.PageMargins.Left = '0.25in';plo.PageMargins.Right = '0.25in';% b747 ~= 5x6 inchesimg = Image(which('b747.jpg'));img.Style = {ScaleToFit};append(d, img);close(d);rptview(d); ","Scale the image in your MATLAB report generation program:import mlreportgen.dom.*d = Document('repro_pdf_portrait', 'docx');open(d);plo = d.CurrentPageLayout;plo.PageMargins.Top = '4in';plo.PageMargins.Bottom = '4in';plo.PageMargins.Left = '0.25in';plo.PageMargins.Right = '0.25in';% b747 ~= 5x6 inchesimg = Image(which('b747.jpg'));%img.Style = {ScaleToFit};scaletofit(img, '8in', '3in');append(d, img);close(d);rptview(d);function scaletofit(img, maxWidth, maxHeight)    maxWidth = mlreportgen.utils.units.toPixels(maxWidth);    maxHeight = mlreportgen.utils.units.toPixels(maxHeight);    imgWidth = mlreportgen.utils.units.toPixels(img.Width);    imgHeight = mlreportgen.utils.units.toPixels(img.Height);    imgAspectRatio = imgHeight/imgWidth;    if imgHeight > maxHeight        imgHeight = maxHeight;        imgWidth = imgHeight / imgAspectRatio;    end    if imgWidth > maxWidth        imgWidth = maxWidth;        imgHeight = imgHeight * imgAspectRatio;    end    img.Width = sprintf('%4.1fpx', imgWidth);    img.Height = sprintf('%4.1fpx', imgHeight);end",MATLAB Report Generator,Other,"R2018b Update 5, R2019a Update 4, R2019b",16 Aug 2019
2012200, Toolbox project files sometimes fail to open,"Toolbox project files (.prj ) created while packaging a toolbox might fail to open. When this occurs, MATLAB displays the error:?Not a valid project .? Restarting MATLAB usually resolves the issue.? This error does not prevent packaging new toolboxes. ",,MATLAB,Other,"R2018b Update 5, R2019a Update 5, R2019b",16 Aug 2019
2011592, Incorrect Code Generation: Incorrect casts when using max or min with arguments of different types,"If you call?max  or min ?from a Stateflow chart, generated code might contain incorrect casts if all of the following conditions are true: The chart uses C action language The first argument in the function call is a numeric literal  For example, the expression? ? ? ?b = max(0, myVar)?  where b and myVar are of type single, results in the following incorrect casts in the generated code: ? ?if (0 > (int8_T)myVar) {? ? ?b = 0.0F;? ?} else {? ? ?b = (int8_T)myVar;? ?}  ","Specify the first argument as a type that can hold the value of the second argument. For the example above, you could consider using:max(single(0), myVar)max(0.0, myVar)max(Zero, myVar) (where Zero is a Stateflow constant with value 0 of type single).max(myVar,0)?",Stateflow,Incorrect Code Generation,"R2018b Update 6, R2019a",19 Dec 2019
2011536, Ideal Fixed Gear Transmission block mask has two incorrect parameter descriptions,"On the Ideal Fixed Gear Transmission block mask, these parameter descriptions are incorrect Initial gear number, G_o ?(appears as autoblks_sharedautoblkFixedGearTransblkPrm_G_o) Initial neutral gear input rotational velocity, omegaN_o  (appears as autoblks_sharedautoblkFixedGearTransblkPrm_omegaN_o)  The issue is cosmetic and has no?functional impact on the block operation or performance. ",,Vehicle Dynamics Blockset,Other,"R2019a Update 3, R2019b",14 Jun 2019
2011339, surrogateopt checkpoint file?becomes very large,"Because of a bug in the save  function, a surrogateopt  checkpoint file can grow at every function evaluation. The size of the checkpoint file can far exceed the size of the saved data.",,Global Optimization Toolbox,Other,"R2019a Update 5, R2019b",16 Aug 2019
2011015, CDFX-file import fails if the file name extension contains uppercase characters,"When using the cdfx  function to import CDFX-files, the import fails if the filename extension contains any uppercase characters. The resulting error message does not clearly indicate the source of the issue.","To avoid this issue, change the CDFX-file name extension to all lowercase characters.",Vehicle Network Toolbox,Other,"R2019a Update 5, R2019b",16 Aug 2019
2010920, Building a simulation target MEX-file can generate an error message ,"When a model code generation target language is set to C++ , model simulation might generate the following error message in the Command Window:   Error(s) encountered while building simulation target MEX-file for model 'my_model'.  ...?  error C2065: 'static_cast': undeclared identifier  ... This is caused by blocks that use simulation through code generation creating simulation C code that contains C++ static_cast . Blocks that might trigger this error include the C Caller block, MATLAB System block, and Dataflow Subsystem block. ","To avoid this issue, change the model Configuration Parameters > Code Generation > Target selection >? Language from C++ to C.",Simulink,Other,"R2019a Update 6, R2019b",11 Oct 2019
2010904, Setting a format in the Style property of a PowerPoint (PPT) API object causes MATLAB to crash,"Setting a format in the Style  property of a PPT API object causes?MATLAB to crash if there is a corresponding format property. For example, the following code causes MATLAB to crash because the Style  property is used instead of the Bold   property. para = mlreportgen.ppt.Paragraph();  para.Style = {mlreportgen.ppt.Bold(true)};?  ","Do not specify the format in the Style property when there is a corresponding format property. For example, to specify that the text of a paragraph is bold, set the Bold property instead of specifying the Bold format in the Style property.para = mlreportgen.ppt.Paragraph();para.Bold = true;",MATLAB Report Generator,Other,"R2018b Update 5, R2019a Update 4, R2019b",16 Aug 2019
2010493, Update diagram operation for models may be slower during dimension propagation,"When a large model with muxed signals or virtual buses is instructed to update the diagram or to run the simulation, the model update time might significantly increase due to the signal conversion blocks when compared to the model runtime in previous releases. If this occurs, Simulink might take longer to run simulation or update diagram, showing ""Compiling: Propagating frame data and dimensions"" on the bottom left corner of Simulink window.  ",Specify the output dimension of all Signal Conversion blocks in the model explicitly.?,Simulink,Other,"R2019a Update 5, R2019b",16 Aug 2019
2010464, The Vehicle Body 1DOF Longitudinal block incorrectly determines the loads on the front and rear axles,"The Vehicle Body 1DOF Longitudinal Wheel block incorrectly determines the loads on the front and rear axles. The axle loads do not include drag forces, grade forces, or forces externally applied at the vehicle center of gravity. ",,Powertrain Blockset,Other,"R2019a Update 3, R2019b",14 Jun 2019
2010283, Incorrect Code Generation: Incorrect results are possible when configuring function prototype control for referenced model,"The generated code might be incorrect for a model that meets all of the following conditions: The model references a model that specifies that the input and output arguments of the step function use the same variable name. The referenced model is a variant of a variant subsystem. On the variant subsystem block parameters dialog box, the parameter Analyze all choices during update diagram and generate preprocessor conditionals  is selected.?  ","On the variant subsystem block parameters dialog box, clear the Analyze all choices during update diagram and generate preprocessor conditionals.",Embedded Coder,Incorrect Code Generation,"R2019a Update 4, R2019b",15 Jul 2019
2010102, readtable?errors reading text files with duplicate variable names with length greater than or equal to namelengthmax,"readtable  throws an error when you try to read a text file containing duplicate variable names with length greater than or equal to namelengthmax . For example, given a text file data.csv  with the following contents:  SomeReallyLongTableVariableNameGreaterThanOrEqualToNameLengthMax,SomeReallyLongTableVariableNameGreaterThanOrEqualToNameLengthMax1,23,4  readtable  will error as follows:  >> filename = ""data.csv"";>> t = readtable(filename, opts);Error using readtable (line 216)Expected a cell array of valid variable names.Note: readtable detected the following parameters:'Delimiter', ',', 'HeaderLines', , 'ReadVariableNames', true, 'Format', ''  ","Using detectImportOptions with readtable. For example:>> filename = ""data.csv"";>> opts = detectImportOptions(filename);>> t = readtable(filename, opts);",MATLAB,Other,"R2019a Update 4, R2019b",15 Jul 2019
2010073, Incorrect Code Generation: Incorrect Code Generation: Uninitialized variable passed to AUTOSAR?Rte_Write call when subsystem signal branches to root outport and another subsystem,"Incorrect code might be generated for an AUTOSAR model when all of the following conditions are true: An output signal from a subsystem branches. One branch of the signal feeds a root outport. The AUTOSAR data access mode of the root outport is ExplicitSend . The other signal branch feeds another subsystem.  In the generated code, an uninitialized stack variable is passed as an argument to the Rte_Write  function. ",Place a Signal Conversion block on either branch of the branched subsystem output signal.,Embedded Coder,Incorrect Code Generation,"R2018b Update 6, R2019a Update 9, R2019b",18 Sep 2020
2009896, Error at start of external mode simulation on Arduino when using XCP on Serial and non-default code generation folder,An external mode simulation on the Arduino target produces an error at the start when these conditions apply:?  Configuration parameter?Transport layer  is?XCP on Serial .  Simulink preference?Code generation folder  is not empty or? CodeGenFolder  is set by?Simulink.fileGenControl .         The error message is:  Executing the 'Connect' command produced the following error:   DWARF Parser internal error:? Parser::initialize failed to open file  ,"Reset the code generation folder to the default:In the Simulink Preferences dialog box, clear the?Cache folder and?Code generation folder fields.Reset Simulink.fileGenControl settings by running the command?Simulink.fileGenControl('reset').?Alternatively, run the Simulink external mode simulation on a Linux or Mac computer.",Embedded Coder,Other,"R2019a Update 3, R2019b",14 Jun 2019
2009017, Incorrect Code Generation: Incorrect code generated for Switch block whose signal source is a Constant block inside an enabled subsystem,"The code generated from a model may be incorrect if all of the following conditions are true: The model contains a Switch block whose signal source is a Constant block that is inside an Enabled Subsystem block.? In the Constant block parameters dialog box, the Sample time  parameter is set to Inf . The model configuration parameter Default parameter behavior  is set to Inlined .  ","Set the sample time of the Constant block that is inside the Enabled Subsystem block to -1, or clear the model configuration parameter Block reduction.",Embedded Coder,Incorrect Code Generation,"R2018b Update 5, R2019a Update 5, R2019b",16 Aug 2019
2008889, LTE HDL SIB1 Recovery example failing to decode PDSCH due to an error in DCI decoding,"For DCI format1C, the DCI message is correctly decoded, but the DCI Format output signal is cleared before the next stage in processing can read the value. The DCI format parameter calculated is now registered on condition of successful decode, and held until the decoder is reset.",,Wireless HDL Toolbox,Other,"R2019a Update 3, R2019b",19 Jul 2023
2008845, Incorrect Code Generation: Shift operations incorrectly cast to unsigned type,"Incorrect code might be generated for shift operations matching the following situation:? The Casting mode  is set to Standards Compliant . The result of the bitshift operation is assigned to a floating point variable or casted to a floating point type. The value of the bitshift operation is a negative value.  In the incorrect generated code, the result of the bitshift is cast to an unsigned type and then cast to the floating point data type. An additional cast to a signed type is required to properly represent negative values. Note that the cast to unsigned is required to comply with MISRA. For example, when generating code for the following function with standards casting mode enabled?    function issue_example_2008845(x)       global out      out = double(bitshift(int64(1), int64(x)));  end The bitshift operation generated is?   out = (double)(unsigned long)((unsigned long)1L << (unsigned long)(long)x); Instead an additional cast to a signed integer type is needed prior to casting to double  out = (double)(long)(unsigned long)((unsigned long)1L << (unsigned long)x); ",,Embedded Coder,Incorrect Code Generation,"R2018b Update 6, R2019a Update 6, R2019b",19 Dec 2019
2008397, Tool-coupling FMU fails to simulate if current working directory is Windows UNC path,"Tool-coupling FMU exported from Simulink fails to simulate in FMU import tools, if the import tool unzips FMU to Windows UNC path (for example,?\\localhost\shared_folder\) . Specifically, if the import tool is Simulink, tool-coupling FMU fails to simulate when the MATLAB current working directory is UNC path. An example error message from Simulink FMU Import Block: Log from FMU: [category:logStatusError, status:fmi2Error] fmi2Instantiate: Error using cd Cannot CD to C:\work\localhost\shared_folder\slprj\_fmu\12345abc\testFMU\resources (Name is nonexistent or not a directory).?  Error in supplied FMU: An error occurred in function 'fmi2Instantiate' for block 'model/FMU' during simulation. For more information, see the FMU troubleshooting documentation.?   ",,Simulink,Other,"R2019a Update 5, R2019b",16 Aug 2019
2008193, Simulink might crash when extracting signals from an element of a nonvirtual bus that a virtual bus contains,Simulink crashes when all of these conditions apply: A virtual bus has multiple levels of hierarchy and contains a nonvirtual bus. A Bus Selector block selects a multidimensional signal from this nonvirtual bus. A Demux block extracts signals from this multidimensional signal.  ,"For R2018b, unzip and run the attached script every time you start Simulink. The script enables Simulink to convert a nonvirtual bus into a virtual bus when the nonvirtual bus is contained in a virtual bus.",Simulink,Other,"R2018b Update 5, R2019a Update 4, R2019b, R2020a",19 Mar 2020
2007892, Incorrect Code Generation: HDL Reciprocal block might produce wrong answer for fixed-point inputs,HDL Reciprocal block might produce mismatched?answers during?normal mode simulation and?code generation? when the following conditions are true: The input value is zero The input type is fixed-point Number of iterations  is set to 1  ,,Simulink,Incorrect Code Generation,"R2019a Update 4, R2019b",15 Jul 2019
2007773," Error when reverting an architecture model file with unsaved changes,?using MATLAB source control integration for Git or SVN","It is not possible to revert a file whileediting a Simulink architecture model under Git or SVN source control fromwithin MATLAB. With unsaved changes, users encounter an error when discarding local changes or reverting the file to an older revision.  ","To avoid this issue, save or close the model before reverting changes.",Simulink,Other,"R2019a Update 4, R2019b",15 Jul 2019
2007592, Incorrect Code Generation: Incorrect results might occur for a model with a?Bus Assignment block and?an?Assignment block,The generated code might be incorrect for a model that meets the following conditions: The model contains a?Bus Assignment block block and an?Assignment?block.  An?Assignment ?block connects to the?assignment input ports?of the?Bus Assignment ?block. The?Assignment ?block and?Bus Assignment block are inside ?the same?For-Iterator ?or?While-Iterator ?subsystem.  ,Clear the model configuration parameter Perform in-place updates for Assignment and Bus Assignment blocks.,Embedded Coder,Incorrect Code Generation,"R2018b Update 5, R2019a Update 4, R2019b",05 Feb 2024
2007459, Incorrect Code Generation: Simulation results might be incorrect for a model consisting of cascading Bus Selector and Bus Creator blocks,Simulation results might be incorrect in both normal and accelerator modes for a model that meets these conditions: A Bus Selector block selects more than one element of a bus.? The elements are permuted and sent to a Bus Creator block of the same bus object type. The model configuration parameter Element name mismatch  is not set to error .     ,"In the model configuration parameters dialog box, set the Element name mismatch diagnostic parameter to error.",Simulink,Incorrect Code Generation,"R2019a Update 4, R2019b, R2020a",19 Mar 2020
2007273, Initial condition dx/dt?field appears on the x pane of the block dialog for Second-Order Integrator block.,"The initial condition value of dx/dt  state in the Second-Order Integrator block can be provided on the block dialog using the Initial condition dx/dt? edit field. This field should normally appear on the dx/dt  pane of the block dialog as is expected and documented. However, it is on the x   pane of the block below the State name x  field.? ",,Simulink,Other,"R2019a Update 4, R2019b",15 Jul 2019
