Bug Id,Summary,Description,Workaround,Products,Type,Fixed In,Modified Date
918853, VideoReader might fail when attempting to read an arbitrary frame,"VideoReader  might fail when attempting to read a video frame that is not the first frame in a file. This problem occurs even if the frame index is valid and within the range limited by the NumberOfFrames  property of the VideoReader  object.For example,vid = VideoReader(filename);% read the last frameread(vid,Inf); Returns this error:Error using VideoReader/read (line 86)The frame index requested is beyond the end of the file. However, once VideoReader  successfully reads a frame, this error no longer occurs.","Installation instructions       Log in to an account with appropriate permissions to overwrite files in your MATLAB installation.       Locate your MATLAB installation by typing matlabroot at the MATLAB command prompt. This folder is referred to as <MATLAB> in subsequent steps.       Exit MATLAB.       Download the attached .zip file associated with this Bug Report and store the file in the <MATLAB> folder.                     Make a backup copy of each of the files listed in the .zip file. To see the contents of the .zip file:                                    Windows Systems*: Open the .zip file and look at the contents.                                                               Extract the files from the .zip file.                                                               Windows Systems*:                                                             Open the .zip file.                                  Extract the contents of the file to your <MATLAB> folder.                                                                                                 Delete the .zip file in the <MATLAB> folder.  *Notes for Windows Systems:      If you see ˇ°Error: Access is deniedˇ± when attempting to extract the .zip file, you  may need to start WinZip in administrator mode. Do this by navigating to  WinZip.exe or the WinZip Start menu entry, right-clicking on it, and selecting  Run as administrator.    From  within WinZip, find and open the downloaded .zip file.    Extract  the contents of the file to your <MATLAB> folder.  ",MATLAB,Other,R2013b,06 Sep 2013
918671, Outer join on dataset arrays returns merged key variables in wrong order,"When you perform an outer join between two dataset  arrays with the 'MergeKeys',true  option, the output array might have some of the values for the merged key variables in the wrong order. If there are key values in the ""right"" input that are not matched by key values in the ""left"" input, then the key values in the output array for those observations come from the ""right"" input. If the key variables are specified in an order different from how they appear in the ""left"" input, those values are in the wrong variables in the output array. For example, the values of V1  and V2  in the last observation in the dataset array joined  below should be swapped: >> left = dataset([1;2;3],[11;12;13],randn(3,1),'VarNames',{'V1' 'V2' 'V3'})left =     V1   V2   V3     1    11   1.409    2    12   1.4172    3    13   0.6715 >> right = dataset([2;3;4],[12;13;14],randn(3,1),'VarNames',{'V1' 'V2' 'V4'})right =     V1   V2   V4     2    12   -1.2075    3    13   0.71724    4    14   1.6302 >> joined = join(left,right,'Type','outer','Keys',{'V2' 'V1'},'MergeKeys',true)joined =     V1   V2   V3      V4     1    11   1.409   NaN    2    12   1.4172  -1.2075    3    13   0.6715  0.71724    14   4    NaN     1.6302 ","Specify the key variables in their original order, for example:>> joined = join(left,right,'Type','outer','Keys',{'V1' 'V2'},'MergeKeys',true)joined =     V1   V2   V3      V4     1    11   1.409   NaN    2    12   1.4172  -1.2075    3    13   0.6715  0.71724    4    14   NaN     1.6302",Statistics and Machine Learning Toolbox,Other,R2013b,06 Sep 2013
918609," Code generation fails with the message ""assertion failed"" and a stack trace mentioning ""ReusePolicyUB::getPrecisionLoss"".","Code generation fails with the message ""assertion failed"" and a stack trace mentioning ""ReusePolicyUB::getPrecisionLoss"". This failure is due to a bug in the computation of upper bounds for variable-sized matrices in the MATLAB?  code. ","Use dynamic memory allocation for all variable-sized arrays:At the command line, create a code generation configuration object and set the DynamicMemoryAllocation parameter to 'AllVariableSizeArrays'.       x = coder.config('lib');        x.DynamicMemoryAllocation='AllVariableSizeArrays'       codegen -config x ...In a project, on the Project Settings dialog box Memory tab, set Dynamic memory allocation to For all variable-sized arrays.There is no workaround for this problem when using the MATLAB Function Block in Simulink?.",MATLAB Coder,Other,R2013b,06 Sep 2013
918574, Incorrect initialization code for complex matrix parameter containing nonfinite values,"The code generator might generate incorrect initialization code when all of the following conditions for a model are met: A signal or parameter is a matrix or vector The element type of the matrix or vector is complex The initial value contains non-finite values  When this occurs, you see different results from running a simulation on the model than from running the generated code.  ",,Embedded Coder,Other,R2013b,17 Sep 2013
918557, Always create a code generation report option might cause code generation error,"On the Project Settings > Debugging  pane, if you select the Always create a code generation report  check box, an error might occur during code generation: Compilation failed.Assertion failed.Use help codegen for more information on using this command. ","Do one of the following:Locate files named tmp.m in your MATLAB search path by running which tmp.m at the command line. Rename any files found.On the Project Settings > Debugging pane, clear the Always create a code generation report check box.",MATLAB Coder,Other,R2013b,06 Sep 2013
918226, Error message No response received after 10 minutes during download of verification results,"Sometimes when downloading verification results from the Polyspace Spooler, the following message appears and download is aborted: Error: An I/O error occured (Function ReceiveResult: BinIo.getc).Error: No response received after 10 minutes.  ","Installation instructions on Polyspace client and serverLog in to an account with appropriate permissions to overwrite files in your Polyspace installation.Locate your Polyspace installation. By default this is in c:\Polyspace. This folder is referred to as <POLYSPACE> in subsequent steps. PolyspaceForCandCPP_#release or Polyspace_Common is one of the principal sub-folders of <POLYSPACE>.Close the Polyspace verification environment and stop Polyspace queue manager service.Download the attached .zip file associated with this Bug Report and store the file in the <POLYSPACE> folder.Make a backup copy of each of the files listed in the .zip file. To see the contents of the .zip file, open the .zip file.Extract the files from the .zip to your <POLYSPACE> folder.Check that binaries have appropriate ˇ®read &amp; executeˇŻ permissions.Delete the .zip file in the <POLYSPACE> folder.Restart Polyspace queue manager service and reopen the Polyspace verification environment.",Polyspace Code Prover,Other,R2013b,18 Mar 2014
918046," On some Linux distributions, Report Generator generates PDF documents where all characters appear as ""#######"" ","Report Generator generates PDF documents where all characters appear as ""#######"" on some Linux distributions. ","Installation instructionsLog in to an account with appropriate permissions to overwrite files in your MATLAB installation. On Linux systems, this is typically the root account.Locate your MATLAB installation by typing matlabroot at the MATLAB command prompt. This folder is referred to as <MATLAB> in subsequent steps.Exit MATLAB.Download the attached .zip file associated with this Bug Report and store the file in the <MATLAB> folder.Make a backup copy of each of the files listed in the .zip file. To see the contents of the .zip file, type the following in a shell:unzip -l <MATLAB>/<.zip file> Extract the files from the .zip file. Type the following in a Linux shell:cd <MATLAB>unzip <.zip file>Delete the .zip file in the <MATLAB> folder.??",MATLAB Report Generator,Other,R2013b,21 May 2015
917662," With serial architectures, incorrect code is generated for SOS filters when 'Coefficient source' is selected as 'Processor interface'","When you generate HDL code for SOS filters with serial architectures and you select 'CoefficientSource' as the processor interface, the generated code has the port interface for the processor but the RTL logic in the module does not use the coefficients from the port. The logic uses internal fixed coefficients instead.  ",There is no workaround. Serial architectures currently do not support processor interface for IIR SOS filters.,Filter Design HDL Coder,Other,R2013b,06 Sep 2013
917503," Incorrect Code Generation: Running code out of flash on TI C2000 processors may fail, if PLL DIVSEL is set to 1","Execution of the generated code for models on TI C2000 processors may fail while running out of Flash, if the clock divider (DIVSEL) of the PLL is set to division by 1. ","The workaround is provided for R2012b and R2013a. For older releases follow instructions given under the heading Installation instructions for releases prior to R2012b. Installation instructions for R2012b and R2013aLog in to an account with appropriate permissions to overwrite files in your MATLAB installation. On Linux systems, this is typically the root account.Locate your MATLAB installation by typing matlabroot at the MATLAB command prompt. This folder is referred to as <MATLAB> in subsequent steps.Exit MATLAB.Download the attached .zip file associated with this Bug Report and store the file in the <MATLAB> folder.Make a backup copy of each of the files listed in the .zip file. To see the contents of the .zip file: Windows Systems*: Open the .zip file and look at the contents.Linux/Macintosh Systems: Type the following in a shell (Linux) or in a terminal window (Macintosh):unzip -l <MATLAB>/<.zip file>Extract the files from the .zip file. Windows Systems*: Open the .zip file.Extract the contents of the file to your <MATLAB> folder.Linux/Macintosh Systems: Type the following in a shell (Linux) or in a terminal window (Macintosh): cd <MATLAB>unzip <.zip file>Delete the .zip file in the <MATLAB> folder.*Notes for Windows Systems:If you see ˇ°Error: Access is deniedˇ± when attempting to extract the .zip file, you may need to start WinZip in administrator mode. Do this by navigating to WinZip.exe or the WinZip Start menu entry, right-clicking on it, and selecting Run as administrator.From within WinZip, find and open the downloaded .zip file.Extract the contents of the file to your <MATLAB> folder.Installation instructions for releases prior to R2012bPerform one of the following as the workaround for this problem: Use a divider for the PLL DIVSEL other than 1.Open toolbox\idelink\extensions\ticcs\c2000\tgtLibrary_c2000.tlc. Move the call to init_board() at the end of the tgtLibInitialize function as shown below:%function tgtLibInitialize() Output %% %assign szinfo = SIZE(targetInfo.customCode.initializeFunctions) %if (szinfo[0]!=0 &amp;&amp; szinfo[1]!=0) ??%foreach k = szinfo[1] ????%<targetInfo.customCode.initializeFunctions[k]> ??%endforeach %endif init_board(); %endfunction",Embedded Coder,Incorrect Code Generation,R2013b,06 Sep 2013
917083, Inconsistent locale message crashes applications when no console present,"If you deploy a a Windows Standalone application or a .NET Assembly on a machine with a different locale than the machine that generated it, when you run the application for the first time, it crash with the following error message: Runtime Error!  Program: myapplication.exe  This application has requested the Runtime to terminate it in an unusual way.  Please contact the application's support team for more information.  Subsequent runs of the application on the same machine may work fine. ","You can get around the problem by starting the application from a console window. When you run the application on a machine for the first time, you will see the following warning:Warning: application is running on a locale different from the original platform locale.The application will work fine. Subsequent runs won't trigger the warning. If the workaround above doesn't apply to your situation, apply the following fix:Installation instructionsLog in to an account with appropriate permissions to overwrite files in your MATLAB or MATLAB Compiler Runtime (MCR) installation .If you want to apply the fix to a MATLAB installation, locate your MATLAB installation by typing matlabroot at the MATLAB command prompt. This folder is referred to as <MATLAB> in subsequent steps. Then exit MATLAB.If you want to apply the fix to an MCR installation, locate the directory where the MCR is installed. By default, it's 'C:\Program Files\MATLAB\MATLAB Compiler Runtime\v80' for R2012b release and 'C:\Program Files\MATLAB\MATLAB Compiler Runtime\v81' for R2013a release. This folder is referred to as <MATLAB> in subsequent steps.Based on the version of the MATLAB or the MCR installation, download the attached attachment_917083_12b_2013_05_14.zip or attachment_917083_13a_2013_05_14.zip file associated with this Bug Report and store the file in the <MATLAB> folder.Make a backup copy of each of the files listed in the attachment_917083_12b_2013_05_14.zip or attachment_917083_13a_2013_05_14.zip file. To see the contents of the .zip file, open the .zip file and look at the contents.Extract the files from the attachment_917083_12b_2013_05_14.zip or attachment_917083_13a_2013_05_14.zip file. Windows Systems*: Open the attachment_917083_12b_2013_05_14.zip or attachment_917083_13a_2013_05_14.zip file.Extract the contents of the file to your <MATLAB> folder.Delete the attachment_917083_12b_2013_05_14.zip or attachment_917083_13a_2013_05_14.zip file in the <MATLAB> folder.*Notes for Windows Systems:If you see ˇ°Error: Access is deniedˇ± when attempting to extract the attachment_917083_12b_2013_05_14.zip or attachment_917083_13a_2013_05_14.zip file, you may need to start WinZip in administrator mode. Do this by navigating to WinZip.exe or the WinZip Start menu entry, right-clicking on it, and selecting Run as administrator.From within WinZip, find and open the downloaded .zip file.Extract the contents of the file to your <MATLAB> folder.",MATLAB Compiler,Other,R2013b,06 Sep 2013
916895, The Battery block simulation results are not changing when block parameters are changed by a script,"You have a MATLAB script that performs several simulations of a model containing the Battery block with parametrized values for the Nominal Voltage , Rated Capacity , or Initial State-Of-Charge  parameters. For each simulation, your MATLAB script is setting different values for the parameters. However, the simulation results remain identical regardless of the differences in parameter settings. There is an issue with the way the block takes into account a change in its parameter values. To be efffective, any change to a mask value needs to be confirmed with Apply  or OK . ","Installation instructionsLog in to an account with appropriate permissions to overwrite files in your MATLAB installation. On Linux systems, this is typically the root account.Locate your MATLAB installation by typing matlabroot at the MATLAB command prompt. This folder is referred to as <MATLAB> in subsequent steps.Exit MATLAB.Download the attached .zip file associated with this Bug Report and store the file in the <MATLAB> folder.Make a backup copy of each of the files listed in the .zip file. To see the contents of the .zip file: Windows Systems: Open the .zip file and look at the contents.Linux/Macintosh Systems: Type the following in a shell (Linux) or in a terminal window (Macintosh):unzip -l <MATLAB>/<.zip file>Extract the files from the .zip file. Windows Systems: Open the .zip file.Extract the contents of the file to your <MATLAB> folder.Linux/Macintosh Systems: Type the following in a shell (Linux) or in a terminal window (Macintosh): cd <MATLAB>unzip <.zip file>Delete the .zip file in the <MATLAB> folder.",Simscape Electrical,Other,R2013b,06 Sep 2013
916843, Release Notes for Polyspace? Products for C/C++ shipping with the IEC Certification Kit is not the version released with Polyspace? for R2013a,"The Release Notes for Polyspace Products for C/C++ , c_release_notes.pdf , located in <matlabroot>/toolbox/qualkits/iec/polyspace/ r2013a/doc/  is not the version released with Polyspace? for R2013a. The Polyspace? R2013a version of Release Notes for Polyspace Products for C/C++  contains information about the Remote Launcher Manager that is not included in the version shipping with the IEC Certification Kit. ","Installation instructionsLog in to an account with appropriate permissions to overwrite files in your MATLAB installation. On Linux systems, this is typically the root account.Locate your MATLAB installation by typing matlabroot at the MATLAB command prompt. This folder is referred to as <MATLAB> in subsequent steps.Remove <MATLAB>/toolbox/qualkits/iec/polyspace/r2013a/doc/c_release_notes.pdf.Exit MATLAB.Download the attached .zip file associated with this Bug Report and store the file in the <MATLAB> folder.Make a backup copy of the file listed in the .zip file. To see the contents of the .zip file: Windows Systems*: Open the .zip file and look at the contents.Linux/Macintosh Systems: Type the following in a shell (Linux) or in a terminal window (Macintosh):unzip -l <MATLAB>/<.zip file>Extract the file from the .zip file. Windows Systems*: Open the .zip file.Extract the contents of the file to your <MATLAB>/toolbox/qualkits/iec/polyspace/r2013a/doc/ folder.Linux/Macintosh Systems: Type the following in a shell (Linux) or in a terminal window (Macintosh): cd <MATLAB>unzip <.zip file>Delete the .zip file in the <MATLAB> folder.*Notes for Windows Systems:If you see ˇ°Error: Access is deniedˇ± when attempting to extract the .zip file, you may need to start WinZip in administrator mode. Do this by navigating to WinZip.exe or the WinZip Start menu entry, right-clicking on it, and selecting Run as administrator.From within WinZip, find and open the downloaded .zip file.Extract the contents of the file to your <MATLAB> folder.",IEC Certification Kit,Other,R2013b,06 Sep 2013
916830," On Linux? platforms, there are formatting issues when viewing Microsoft? Word .docx certification artifacts with OpenOffice.","On Linux platforms, the Certification Artifacts Explorer uses OpenOffice to view Microsoft? Word .docx  certification artifacts. When viewing the artifacts, you might encounter formatting issues with page breaks, link breaks, or tables. ","1. Save the .docx file as an .odt file, using Microsoft? Word on a Windows? platform.2. Open the .odt version of the artifact, using OpenOffice on a Linux? platform.",IEC Certification Kit,Other,R2013b,06 Sep 2013
916757, Invalid result for Check usage of Stateflow junctions compatibilty check when Stateflow? chart does not specify transition order,"If the Stateflow? chart property User specified state/transition execution order  is not selected, the Check usage of Stateflow junctions > Check that unconditional transtitions execute last in execution order  compatibility check might incorrectly report that a chart has an unconditional transition that does not execute last in execution order. Additionally, Simulink Code Inspector might incorrectly report that the code for a Stateflow chart is invalid. ? ","For all Stateflow charts, select property User specified state/transition execution order.",Simulink Code Inspector,Other,R2013b,06 Sep 2013
916664, Back annotation fails for code generation from a non-top level subsystem,"When you generate code from a non-top level subsystem using the HDL Workflow Advisor, back annotation of the critical path triggers the following error: Failed Attempt to reference field of non-structure array","Installation instructions       Log in to an account with appropriate permissions to overwrite files in your MATLAB installation. On Linux systems, this is typically the root account.       Locate your MATLAB installation by typing matlabroot at the MATLAB command prompt. This folder is referred to as <MATLAB> in subsequent steps.       Exit MATLAB.       Download the attached .zip file associated with this Bug Report and store the file in the <MATLAB> folder.                     Make a backup copy of each of the files listed in the .zip file. To see the contents of the .zip file:                                    Windows Systems*: Open the .zip file and look at the contents.                     Linux/Macintosh Systems: Type the following in a shell (Linux) or in a terminal window (Macintosh):unzip -l <MATLAB>/<.zip file>                                          Extract the files from the .zip file.                                                               Windows Systems*:                                                             Open the .zip file.                                  Extract the contents of the file to your <MATLAB> folder.                                                                                                Linux/Macintosh Systems: Type the following in a shell (Linux) or in a terminal window (Macintosh):                            cd <MATLAB>unzip <.zip file>                                                 Delete the .zip file in the <MATLAB> folder.  *Notes for Windows Systems:      If you see ˇ°Error: Access is deniedˇ± when attempting to extract the .zip file, you  may need to start WinZip in administrator mode. Do this by navigating to  WinZip.exe or the WinZip Start menu entry, right-clicking on it, and selecting  Run as administrator.    From  within WinZip, find and open the downloaded .zip file.    Extract  the contents of the file to your <MATLAB> folder.  March 7, 2013: attachment_918992_13a_linux64_2013-02-28.zip, attachment_918992_13a_win32_2013-02-28.zip, and attachment_918992_13a_win64_2013-02-28.zip: initial version, work on R2013a only",HDL Coder,Other,R2013b,06 Sep 2013
916452, Signal object with initial value might overwrite the zero value initial condition of the connecting Unit Delay block,"The code generator might generate incorrect code when all of the following conditions are met: A signal object with non-zero initial value is associated with the input signal of a Unit Delay block. The Unit Delay block has a zero value initial condition. In the generated code, the variable for the input signal can also be used as the state of the unit delay if the two have the same initial value.  For an example, see the attached model mSignalObjectBug.slx . In the generated code, the variable for the input signal is incorrectly reused as the unit delay state. ","Download the attached MATLAB script WorkaroundForBugReport916452.p.To enable the workaround, execute the script WorkaroundForBugReport916452(true).To disable the workaround, execute the script WorkaroundForBugReport916452(false).",Embedded Coder,Other,R2013b,06 Sep 2013
916381, Incorrect data type conversion error or warning during simulation,"When you convert fixed-point data types such as sfix8_En2  to data types with larger ranges, such as double , Simulink incorrectly reports that a downcast has occurred and triggers an error or warning. ","You can avoid seeing the incorrect diagnostic warning or error by performing the following actions.In the Configuration Parameters dialog, select Diagnostics > Data Validity.In the Parameters section, set Detect downcast to none.",Simulink,Other,R2013b,06 Sep 2013
916233, Model and referenced model using global Goto/From blocks incorrectly reported incompatible with Simulink Design Verifier,"If your model uses global Goto and From blocks and references another model that uses global Goto and From blocks, Simulink Design Verifier incorrectly reports that your model is incompatible. This situation only occurs when there are no conflicting Goto/From labels between the model and any of its referenced models.  ",,Simulink Design Verifier,Other,R2013b,09 May 2014
916069, Signal label propagation for buses that feed Goto blocks increases model update time,Enabling signal label propagation for bus signals that feed a large number of Goto blocks increases model update time significantly. ,The workaround for Bug Report 827771 also works for this bug.,Simulink,Other,R2013b,08 Nov 2019
915390, Packet Output and Stream Output blocks do not work correctly with enabled subsystems,"When a Packet Output or Stream Output block is placed inside an enabled subsystem, it is not disabled when the subsystem is disabled, but continues to send messages. ","As a workaround:Log into your computer using an account with Administrator privileges.Look at the list of available workaround files, named according to the release they support.Select and download the workaround file for your release.Locate the directory of the downloaded file. This directory is referred to as <DOWNLOAD> in subsequent steps.Type matlabroot to locate your MATLAB installation. This directory is referred to as <MATLABROOT> in subsequent steps.Exit MATLAB.Navigate to <DOWNLOAD> and open the downloaded file.Extract the contents of the file to <MATLABROOT>.Restart MATLAB.At the MATLAB command prompt, type rtwintgt -setup to reinstall the Real-Time Windows Target kernel.January 31, 2013: attachment_915390_12b_win32_2013-01-31.zip: works on R2012b Win32 onlyJanuary 31, 2013: attachment_915390_12b_win64_2013-01-31.zip: works on R2012b Win64 only",Simulink Desktop Real-Time,Other,R2013b,06 Sep 2013
